Proprietary  Name,Active Ingredient/Moiety,Applicant,NDA/BLA,Application Number(1),Application Number(2),Application Number(3),Dosage Form(1),Route of Administration(1),Dosage Form(2),Route of Administration(2),Dosage Form(3),Route of Administration(3),FDA Receipt Date,FDA Approval Date,Approval Year,Abbreviated Indication(s),Approved Use(s),Review Designation,Orphan Drug Designation,Accelerated Approval,Breakthrough Therapy Designation,Fast Track Designation,Qualified Infectious Disease Product,Issued a Priority Review Voucher,Redeemed a Priority Review Voucher,Notes,receipt_date,approval_date,review_time_days,log_review_time_days,regulatory_era
Lupron,leuprolide acetate,TAP Pharmaceuticals,NDA,19010,NA,NA,Injectable,Injection,NA,NA,NA,NA,12/28/1983,4/9/1985,1985,palliative treatment of advanced prostatic cancer,NA,Priority,No,N/A,N/A,N/A,N/A,N/A,N/A,NA,1983-12-28,1985-04-09,468,6.148468295917647,Pre-PDUFA
Seldane,terfenadine,Merrell-Dow,NDA,18949,NA,NA,Tablet,Oral,NA,NA,NA,NA,3/1/1983,5/8/1985,1985,"indicated for the relief of symptoms associated with seasonal allergic rhinitis such as sneezing, rhinorrhea, pruritus and lacrimation",NA,Priority,No,N/A,N/A,N/A,N/A,N/A,N/A,NA,1983-03-01,1985-05-08,799,6.683360945766275,Pre-PDUFA
Ridaura,auranofin,SmithKline & French,NDA,18689,NA,NA,Capsule,Oral,NA,NA,NA,NA,10/5/1981,5/24/1985,1985,"indicated in the management of adults with active, classical, or definite rheumatoid arthritis (ARA criteria) who have had an insufficient therapeutic response to, or are intolerant of, an adequate trial of full doses of one or more nonsteroidal anti-inflammatory drugs",NA,Priority,No,N/A,N/A,N/A,N/A,N/A,N/A,NA,1981-10-05,1985-05-24,1327,7.190676034332207,Pre-PDUFA
Marinol,dronabinol,Unimed,NDA,18651,NA,NA,Capsule,Oral,NA,NA,NA,NA,6/25/1981,5/31/1985,1985,treatment of the nausea and vomiting associated with cancer chemotherapy in patients who have failed to respond adequately to conventional anti-emetic treatment,NA,Priority,No,N/A,N/A,N/A,N/A,N/A,N/A,NA,1981-06-25,1985-05-31,1436,7.269616749608169,Pre-PDUFA
Fortaz,ceftazidime,Glaxo,NDA,50578,NA,NA,Injectable,Injection,NA,NA,NA,NA,5/23/1983,7/19/1985,1985,"treatment of patients with following infections caused by susceptible strains of designated organisms: lower respiratory infections including pneumonia, skin and skin structure infections, urinary tract infections, bacterial septicemia, bone and joint infections, gynecological infections, intra-abdominal infections including peritonitis, central nervous system infections including meningitis",NA,Priority,No,N/A,N/A,N/A,N/A,N/A,N/A,NA,1983-05-23,1985-07-19,788,6.669498089857879,Pre-PDUFA
Hexabrix,"ioxaglate meglumine, ioxaglate sodium",Mallinckrodt,NDA,18905,NA,NA,Injectable,Injection,NA,NA,NA,NA,11/19/1982,7/26/1985,1985,"indicated for cerebral angiography, peripheral arteriography, selective visceral arteriography and selective coronary arteriography with or without left ventriculography",NA,Standard,No,N/A,N/A,N/A,N/A,N/A,N/A,NA,1982-11-19,1985-07-26,980,6.887552571664617,Pre-PDUFA
Baros Effervescent,"tartaric acid, sodium bicarbonate",Mallinckrodt,NDA,18509,NA,NA,"Granule, Effervescent",Oral,NA,NA,NA,NA,6/9/1980,8/7/1985,1985,indictated for double-contrast radiographic imaging of the upper gastrointestinal tract,NA,Standard,No,N/A,N/A,N/A,N/A,N/A,N/A,NA,1980-06-09,1985-08-07,1885,7.541683099882111,Pre-PDUFA
Sulcosyn,sulconazole nitrate,Syntex,NDA,18738,NA,NA,Solution,Topical,NA,NA,NA,NA,6/15/1983,8/30/1985,1985,"treatment of tinea cruris tinea corporis caused by Trichophyton mentagrophytes, Epidermophyton floccosum, and Microeporam canis; and for the treatment of tinea versicolor",NA,Standard,No,N/A,N/A,N/A,N/A,N/A,N/A,NA,1983-06-15,1985-08-30,807,6.693323668269949,Pre-PDUFA
Betoptic,betaxolol hydrochloride,Alcon,NDA,19270,NA,NA,Solution/Drops,Ophthalmic,NA,NA,NA,NA,5/4/1984,8/30/1985,1985,"indicated in the treatment of patients with chronic open-angle glaucoma, patients with elevated intraocular pressure (ocular hypertensive patients), patients with glaucoma or ocular hypertension who have reactive airway disease, patients with glaucoma or ocular hypertension who are currently on multiple anti-glaucoma therapy",NA,Priority,No,N/A,N/A,N/A,N/A,N/A,N/A,NA,1984-05-04,1985-08-30,483,6.180016653652572,Pre-PDUFA
Protropin,somatrem,Genentech,NDA,19107,NA,NA,Injectable,Injection,NA,NA,NA,NA,9/1/1983,10/17/1985,1985,long-term treatment of children who have growth failure due to a lack of adequate endogenous growth hormone secretion,NA,Priority,Yes,N/A,N/A,N/A,N/A,N/A,N/A,NA,1983-09-01,1985-10-17,777,6.655440350367647,Pre-PDUFA
Moctanin,monooctanoin,Ascot Hospital,NDA,19368,NA,NA,Liquid,"Perfusion, Biliary",NA,NA,NA,NA,9/25/1984,10/29/1985,1985,"indicated as a solubilizing agent for cholesterol (radiolucent) gallstones retained in the biliary tract of patients following cholecystectomy, when other means of reducing cholesterol stones retained in the common bile duct have failed or cannot be undertaken",NA,Priority,Yes,N/A,N/A,N/A,N/A,N/A,N/A,NA,1984-09-25,1985-10-29,399,5.988961416889864,Pre-PDUFA
Tambocor,flecainide acetate,Riker,NDA,18830,NA,NA,Tablet,Oral,NA,NA,NA,NA,12/21/1982,10/31/1985,1985,"treatment of documented life-threatening ventricular arrhythmias, such as sustained ventricular tachycardia; symptomatic nonsustained ventricular tachycardia and frequent premature ventricular complexes",NA,Priority,No,N/A,N/A,N/A,N/A,N/A,N/A,NA,1982-12-21,1985-10-31,1045,6.951772164398911,Pre-PDUFA
Cuprid,trientine hydrochloride,Merck Sharp & Dohme,NDA,19194,NA,NA,Capsule,Oral,NA,NA,NA,NA,1/6/1984,11/8/1985,1985,treatment of patients with Wilson's disease who are intolerant of penicillamine,NA,Priority,Yes,N/A,N/A,N/A,N/A,N/A,N/A,NA,1984-01-06,1985-11-08,672,6.5102583405231496,Pre-PDUFA
Femstat,butoconazole nitrate,Syntex,NDA,19215,NA,NA,Cream,Vaginal,NA,NA,NA,NA,1/23/1984,11/25/1985,1985,indicated for local treatment of vulvovaginal mycotic infections caused by Candida species,NA,Standard,No,N/A,N/A,N/A,N/A,N/A,N/A,NA,1984-01-23,1985-11-25,672,6.5102583405231496,Pre-PDUFA
Primaxin,"cilastatin sodium, imipenem",Merck Sharp & Dohme,NDA,50587,NA,NA,Powder,Intravenous,NA,NA,NA,NA,5/3/1984,11/26/1985,1985,"treatment of patients with the following infections caused by susceptible strains of designated microorganisms in: lower respiratory tract infections, urinary tract infections, intra-abdominal infections, gynecological infections, bacterial septicemia, bone and joint infections, skin and skin structure infections, endocarditis, polymicrobic infections",NA,Priority,No,N/A,N/A,N/A,N/A,N/A,N/A,NA,1984-05-03,1985-11-26,572,6.349138991379798,Pre-PDUFA
Betagan,levobunolol hydrochloride,Allergan,NDA,19219,NA,NA,Solution/Drops,Ophthalmic,NA,NA,NA,NA,1/19/1984,12/19/1985,1985,has been shown to be effective in lowering intraocular pressure and may be used in patients with chronic open-angle glaucoma or ocular hypertension,NA,Standard,No,N/A,N/A,N/A,N/A,N/A,N/A,NA,1984-01-19,1985-12-19,700,6.551080335043404,Pre-PDUFA
Versed,midazolam hydrochloride,Hoffmann-La Roche,NDA,18654,NA,NA,Injectable,Injection,NA,NA,NA,NA,12/15/1982,12/20/1985,1985,"intramuscularly: for preoperative sedation and to impair memory of peri-operative events;  intravenously: as an agent for conscious sedation prior to short diagnostic or endoscopic procedures either alone or with a narcotic; intravenously: for induction of general anesthesia, before administration of other anesthetic agents",NA,Standard,No,N/A,N/A,N/A,N/A,N/A,N/A,NA,1982-12-15,1985-12-20,1101,7.00397413672268,Pre-PDUFA
Suprol,suprofen,Ortho,NDA,18217,NA,NA,Capsule,Oral,NA,NA,NA,NA,10/23/1978,12/24/1985,1985,relief of mild to moderate pain; treatment of primary dysmenorrhea,NA,Standard,No,N/A,N/A,N/A,N/A,N/A,N/A,NA,1978-10-23,1985-12-24,2619,7.870547844507712,Pre-PDUFA
[drug marketed without a proprietary name],indium In 111 oxyquinoline,Amersham,NDA,19044,NA,NA,Injectable,Injection,NA,NA,NA,NA,12/5/1983,12/24/1985,1985,"indicated for radiolabeling autologous leukocytes as an adjunct in the detection of inflammatory processes to which leukocytes migrate, such as those associated with abscesses or other infection, following reinjection and detection by appropriate imaging procedures",NA,Priority,No,N/A,N/A,N/A,N/A,N/A,N/A,NA,1983-12-05,1985-12-24,750,6.620073206530356,Pre-PDUFA
Cordarone,amiodarone hydrochloride,Ives,NDA,18972,NA,NA,Tablet,Oral,NA,NA,NA,NA,3/14/1983,12/24/1985,1985,"indicated for the treatment of the following documented, life-threatening recurrent ventricular arrhythmias: recurrent ventricular fibrillation or recurrent hemodynamically unstable ventricular tachycardia, when these have not responded to documented aggregate doses of other available antiarrhythmics or when alternative agents could not be tolerated",NA,Priority,No,N/A,N/A,N/A,N/A,N/A,N/A,NA,1983-03-14,1985-12-24,1016,6.923628628138427,Pre-PDUFA
Vasotec,enalapril maleate,Merck Sharp & Dohme,NDA,18998,NA,NA,Tablet,Oral,NA,NA,NA,NA,9/16/1983,12/24/1985,1985,treatment of hypertension,NA,Priority,No,N/A,N/A,N/A,N/A,N/A,N/A,NA,1983-09-16,1985-12-24,830,6.721425700790643,Pre-PDUFA
Cesamet,nabilone,Eli Lilly,NDA,18677,NA,NA,Capsule,Oral,NA,NA,NA,NA,2/17/1982,12/26/1985,1985,for use in the treatment of nausea and vomiting associated with cancer chemotherapy in patients who have failed to respond adequately to conventional antiemetic treatments,NA,Standard,No,N/A,N/A,N/A,N/A,N/A,N/A,NA,1982-02-17,1985-12-26,1408,7.249925536717988,Pre-PDUFA
Omnipaque,iohexol,Sterling,NDA,18956,NA,NA,Solution,"Injection, Oral, Rectal",NA,NA,NA,NA,3/1/1983,12/26/1985,1985,"indicated for intrathecal administration including angiocardiography, cerebral and peripheral arteriography, digital subtraction angiography, urography, phlebography and lumbar myelography",NA,Standard,No,N/A,N/A,N/A,N/A,N/A,N/A,NA,1983-03-01,1985-12-26,1031,6.93828448401696,Pre-PDUFA
Temovate,clobetasol propionate,Glaxo,NDA,19322,19323,NA,Cream,Topical,Ointment,Topical,NA,NA,8/30/1984,12/27/1985,1985,short term treatment of inflammatory and pruritic manifestations of moderate to severe corticosteroid-responsive dermatoses,NA,Standard,No,N/A,N/A,N/A,N/A,N/A,N/A,NA,1984-08-30,1985-12-27,484,6.182084906716632,Pre-PDUFA
Cefotan,cefotetan disodium,Stuart,NDA,50588,NA,NA,Injectable,Injection,NA,NA,NA,NA,1/20/1984,12/27/1985,1985,"indicated for the treatment of the following infections when caused by susceptible strains of designated organisms: urinary tract infections, lower respiratory infections, skin and skin structure infections; gynecologic infections, intra-abdominal infections, bone and joint infections",NA,Standard,No,N/A,N/A,N/A,N/A,N/A,N/A,NA,1984-01-20,1985-12-27,707,6.561030665896573,Pre-PDUFA
Dormalin,quazepam,Schering,NDA,18708,NA,NA,Tablet,Oral,NA,NA,NA,NA,4/9/1982,12/27/1985,1985,"treatment of insomnia characterized by difficulty in falling asleep, frequent nocturnal awakenings and/or early morning awakenings",NA,Standard,No,N/A,N/A,N/A,N/A,N/A,N/A,NA,1982-04-09,1985-12-27,1358,7.213768308118642,Pre-PDUFA
Carnitor,L-carnitine,Sigma-Tau,NDA,18948,NA,NA,Tablet,Oral,NA,NA,NA,NA,2/8/1983,12/27/1985,1985,treatment of primary systemic carnitine deficiency,NA,Priority,No,N/A,N/A,N/A,N/A,N/A,N/A,NA,1983-02-08,1985-12-27,1053,6.959398512133975,Pre-PDUFA
Mexitil,mexiletine hydrochloride,Boehringer Ingelheim Pharmaceuticals,NDA,18873,NA,NA,Capsule,Oral,NA,NA,NA,NA,10/1/1982,12/30/1985,1985,"for the suppression of symptomatic ventricular arrhythmias, including frequent premature ventricular contractions, unifocal or multifocal, couplets and ventricular tachycardia",NA,Priority,No,N/A,N/A,N/A,N/A,N/A,N/A,NA,1982-10-01,1985-12-30,1186,7.078341579557671,Pre-PDUFA
Wellbutrin,bupropion hydrochloride,Burroughs Wellcome,NDA,18644,NA,NA,Tablet,Oral,NA,NA,NA,NA,12/23/1981,12/30/1985,1985,"treatment of depression in patients who fail to respond adequately to, or who cannot tolerate, alternative antidepressant treatments",NA,Priority,No,N/A,N/A,N/A,N/A,N/A,N/A,NA,1981-12-23,1985-12-30,1468,7.291656209174461,Pre-PDUFA
Virazole,ribavirin,Viratek,NDA,18859,NA,NA,For Solution,Inhalation,NA,NA,NA,NA,9/21/1982,12/31/1985,1985,indicated in the treatment of carefully selected hospitalized infants and young children with severe lower respiratory tract infections due to respiratory syncytial virus (RSV),NA,Priority,No,N/A,N/A,N/A,N/A,N/A,N/A,NA,1982-09-21,1985-12-31,1197,7.087573705557973,Pre-PDUFA
Isovue,iopamidol,Squibb,NDA,18735,NA,NA,Injectable,Injection,NA,NA,NA,NA,3/4/1983,12/31/1985,1985,"indicated for lumbar, thoracic, cervical and total columnar myelography, coronary angiography and ventriculography, peripheral arteriography and ventriculography, peripheral arteriography, cerebral arteriography and CT scanning of the head and body",NA,Standard,No,N/A,N/A,N/A,N/A,N/A,N/A,NA,1983-03-04,1985-12-31,1033,6.940222469119639,Pre-PDUFA
Orudis,ketoprofen,Wyeth,NDA,18754,NA,NA,Capsule,Oral,NA,NA,NA,NA,3/16/1982,1/9/1986,1986,treatment of signs and symptoms of osteoarthritis and rheumatoid arthritis,NA,Standard,No,N/A,N/A,N/A,N/A,N/A,N/A,NA,1982-03-16,1986-01-09,1395,7.240649694255466,Pre-PDUFA
Nix,permethrin,Burroughs Wellcome,NDA,19435,NA,NA,Lotion,Topical,NA,NA,NA,NA,2/28/1985,3/31/1986,1986,single-application treatment of infestation with Pediculus humanus capitis (the head louse) and its nits (eggs),NA,Priority,No,N/A,N/A,N/A,N/A,N/A,N/A,NA,1985-02-28,1986-03-31,396,5.981414211254481,Pre-PDUFA
Intron-A,interferon alfa-2b,Schering,BLA,103132,NA,NA,Injectable,Injection,NA,NA,NA,NA,10/4/1983,6/4/1986,1986,treatment of patients 18 years of age or older with hairy cell leukemia,NA,Priority,No,N/A,N/A,N/A,N/A,N/A,N/A,NA,1983-10-04,1986-06-04,974,6.881411303642535,Pre-PDUFA
Roferon-A,interferon alfa-2a,Hoffmann-La Roche,BLA,103145,NA,NA,Injectable,Injection,NA,NA,NA,NA,10/24/1984,6/4/1986,1986,treatment of patients 18 years of age or older with hairy cell leukemia,NA,Priority,No,N/A,N/A,N/A,N/A,N/A,N/A,NA,1984-10-24,1986-06-04,588,6.376726947898627,Pre-PDUFA
Orthoclone OKT3,muromonab-CD3,Ortho Pharms,BLA,103135,NA,NA,Injectable,Injection,NA,NA,NA,NA,3/29/1984,6/19/1986,1986,treatment of acute allograft rejection in renal transplant patients,NA,Standard,No,N/A,N/A,N/A,N/A,N/A,N/A,Biologic product assigned new license number and now referenced by BLA 103463,1984-03-29,1986-06-19,812,6.699500340161678,Pre-PDUFA
Buspar,buspirone hydrochloride,Bristol-Myers,NDA,18731,NA,NA,Tablet,Oral,NA,NA,NA,NA,12/15/1982,9/29/1986,1986,management of anxiety disorders or the short term relief of the symptoms of anxiety,NA,Priority,No,N/A,N/A,N/A,N/A,N/A,N/A,NA,1982-12-15,1986-09-29,1384,7.232733136177615,Pre-PDUFA
Tegison,etretinate,Hoffmann-La Roche,NDA,19369,NA,NA,Capsule,Oral,NA,NA,NA,NA,12/19/1984,9/30/1986,1986,"treatment of severe recalcitrant psoriasis, including erythrodermic and generalized pustular types",NA,Priority,No,N/A,N/A,N/A,N/A,N/A,N/A,NA,1984-12-19,1986-09-30,650,6.476972362889683,Pre-PDUFA
Pepcid,famotidine,Merck Sharp & Dohme,NDA,19462,NA,NA,Tablet,Oral,NA,NA,NA,NA,6/24/1985,10/15/1986,1986,short term treatment of acute duodenal ulcer; maintenance therapy for duodenal ulcer patients at reduced dosage after healing of active ulcer; treatment of pathological hypersecretory conditions such as Zollinger-Ellison syndrome,NA,Standard,No,N/A,N/A,N/A,N/A,N/A,N/A,NA,1985-06-24,1986-10-15,478,6.169610732491456,Pre-PDUFA
Tenex,guanfacine hydrochloride,Robins,NDA,19032,NA,NA,Tablet,Oral,NA,NA,NA,NA,9/14/1983,10/27/1986,1986,indicated in the management of hypertension,NA,Standard,No,N/A,N/A,N/A,N/A,N/A,N/A,NA,1983-09-14,1986-10-27,1139,7.037905963447182,Pre-PDUFA
Provocholine,methacholine chloride,Hoffmann-La Roche,NDA,19193,NA,NA,For Solution,Inhalation,NA,NA,NA,NA,12/29/1983,10/31/1986,1986,indicated for the diagnosis of bronchial airway hyperreactivity in subjects who do not have clinically apparent asthma,NA,Priority,No,N/A,N/A,N/A,N/A,N/A,N/A,NA,1983-12-29,1986-10-31,1037,6.9440872082295275,Pre-PDUFA
Cibacalcin,calcitonin (human),Ciba-Geigy,NDA,18470,NA,NA,Injectable,Injection,NA,NA,NA,NA,12/8/1980,10/31/1986,1986,treatment of symptomatic Paget’s disease of the bone,NA,Priority,Yes,N/A,N/A,N/A,N/A,N/A,N/A,NA,1980-12-08,1986-10-31,2153,7.674617497364363,Pre-PDUFA
Technescan Hida,technetium Tc-99m lidofenin,Merck Sharp & Dohme,NDA,18489,NA,NA,Injectable,Injection,NA,NA,NA,NA,5/6/1980,10/31/1986,1986,indicated as a hepatobiliary imaging agent,NA,Standard,No,N/A,N/A,N/A,N/A,N/A,N/A,NA,1980-05-06,1986-10-31,2369,7.7702232041587855,Pre-PDUFA
Noroxin,norfloxacin,Merck Sharp & Dohme,NDA,19384,NA,NA,Tablet,Oral,NA,NA,NA,NA,1/14/1985,10/31/1986,1986,Treatment of adults with complicated and uncomplicated urinary tract infections caused by susceptible strains of microorganisms,NA,Priority,No,N/A,N/A,N/A,N/A,N/A,N/A,NA,1985-01-14,1986-10-31,655,6.484635235635252,Pre-PDUFA
Lamprene,clofazimine,Ciba-Geigy,NDA,19500,NA,NA,Capsule,Oral,NA,NA,NA,NA,7/1/1985,12/15/1986,1986,"indicated in the treatment of lepromatous leprosy, including dapsone-resistant lepromatous leprosy and lepromatous leprosy complicated by erythema nodosum leprosum",NA,Priority,Yes,N/A,N/A,N/A,N/A,N/A,N/A,NA,1985-07-01,1986-12-15,532,6.2766434893416445,Pre-PDUFA
Enkaid,encainide hydrochloride,Bristol-Myers,NDA,18981,NA,NA,Capsule,Oral,NA,NA,NA,NA,1/13/1984,12/24/1986,1986,for the treatment of documented life threatening arrhythmias such as sustained ventricular tachycardia; for the treatment of patients with symptomatic nonsustained ventricular tachycardia and frequent premature ventricular complexes,NA,Priority,No,N/A,N/A,N/A,N/A,N/A,N/A,NA,1984-01-13,1986-12-24,1076,6.98100574072173,Pre-PDUFA
Atrovent,ipratropium bromide,Boehringer Ingelheim Pharmaceuticals,NDA,19085,NA,NA,"Aerosol, Metered",Inhalation,NA,NA,NA,NA,8/1/1983,12/29/1986,1986,"indicated as a bronchodilator for maintenance treatment of bronchospasm associated with chronic obstructive pulmonary disease, including chronic bronchitis and emphysema",NA,Priority,No,N/A,N/A,N/A,N/A,N/A,N/A,NA,1983-08-01,1986-12-29,1246,7.1276936993473985,Pre-PDUFA
Alfenta,alfentanil hydrochloride,Janssen,NDA,19353,NA,NA,Injectable,Injection,NA,NA,NA,NA,12/26/1984,12/29/1986,1986,indicated as an analgesic adjunct given in incremental doses in the maintenance of anesthesia with barbituate/nitrous oxide/oxygen; as an analgesic administered by continuous infusion with nitrous oxide/oxygen in the maintenance of general anesthesia; as a primary anesthetic agent for the induction of anesthesia in patients undergoing general surgery in which endotracheal intubation and mechanical ventilation are required,NA,Standard,No,N/A,N/A,N/A,N/A,N/A,N/A,NA,1984-12-26,1986-12-29,733,6.597145701886651,Pre-PDUFA
Exirel,pirbuterol acetate,Pfizer,NDA,19009,NA,NA,"Aerosol, Metered",Inhalation,NA,NA,NA,NA,4/21/1983,12/30/1986,1986,"indicated for the relief of acute bronchospasm in patients with chronic reversible obstructive airway disease (extrinsic asthma, intrinsic asthma and chronic bronchitis/emphysema)",NA,Standard,No,N/A,N/A,N/A,N/A,N/A,N/A,NA,1983-04-21,1986-12-30,1349,7.207118856207756,Pre-PDUFA
Cyklokapron,tranexamic acid,KabiVitrum,NDA,19280,19281,NA,Tablet,Oral,Injectable,Injection,NA,NA,5/9/1984,12/30/1986,1986,indicated in patients with hemophilia for short term use (two to eight days) to reduce or prevent hemorrhage and reduce the need for replacement therapy during and following tooth extraction,NA,Standard,Yes,N/A,N/A,N/A,N/A,N/A,N/A,NA,1984-05-09,1986-12-30,965,6.872128101338986,Pre-PDUFA
Brevibloc,esmolol hydrochloride,DuPont,NDA,19386,NA,NA,Injectable,Injection,NA,NA,NA,NA,1/8/1985,12/31/1986,1986,"indicated for the rapid control of ventricular rate in patients with atrial fibrillation or atrial flutter in perioperative, postoperative, or other emergent circumstances where short term control of ventricular rate with a short-acting agent is desirable; also indicated in compensatory sinus tachycardia where, in the physician's judgment the rapid heart rate requires specific intervention",NA,Priority,No,N/A,N/A,N/A,N/A,N/A,N/A,NA,1985-01-08,1986-12-31,722,6.582025138892826,Pre-PDUFA
Azactam,aztreonam,Squibb,NDA,50580,NA,NA,Injectable,Injection,NA,NA,NA,NA,12/29/1983,12/31/1986,1986,"treatment of the following infections caused by susceptible gram-negative microorganisms: Urinary Tract Infections (complicated and uncomplicated), Lower Respiratory Tract Infections, Septicemia, Skin and Skin Structure Infections, Intra-abdominal Infections, Gynecologic Infections; indicated for adjunctive therapy to surgery in the management of infections caused by susceptible organisms including abscesses, infections complicating hollow viscous perforations, cutaneous infections and infections of serous surfaces",NA,Priority,No,N/A,N/A,N/A,N/A,N/A,N/A,NA,1983-12-29,1986-12-31,1098,7.001245622069476,Pre-PDUFA
Unasyn,"sulbactam sodium, ampicillin sodium",Pfizer,NDA,50608,NA,NA,Injectable,Injection,NA,NA,NA,NA,4/18/1985,12/31/1986,1986,treatment of infections due to susceptible of designated microorganisms for: Lower Respiratory Tract Infections; Skin and Skin Structure Infections; Urinary Tract Infections; Intra-Abdominal Infections; Gynecological Infections,NA,Standard,No,N/A,N/A,N/A,N/A,N/A,N/A,NA,1985-04-18,1986-12-31,622,6.432940092739179,Pre-PDUFA
Ocufen,flurbiprofen sodium,Allergan,NDA,19404,NA,NA,Solution/Drops,Ophthalmic,NA,NA,NA,NA,12/19/1984,12/31/1986,1986,inhibition of intraoperative miosis,NA,Priority,No,N/A,N/A,N/A,N/A,N/A,N/A,NA,1984-12-19,1986-12-31,742,6.60934924316738,Pre-PDUFA
Choletec,technetium Tc-99m mebrofenin,Squibb,NDA,18963,NA,NA,Injectable,Injection,NA,NA,NA,NA,3/4/1983,1/21/1987,1987,indicated as a hepatobiliary imaging agent,NA,Standard,No,N/A,N/A,N/A,N/A,N/A,N/A,NA,1983-03-04,1987-01-21,1419,7.257707677160043,Pre-PDUFA
Retrovir,zidovudine,Burroughs Wellcome,NDA,19655,NA,NA,Capsule,Oral,NA,NA,NA,NA,12/2/1986,3/19/1987,1987,for the management of certain adult patients with symptomatic HIV infection (AIDS and advanced ARC) who have a history of cytologically confirmed Pneumocystis carinii pneumonia (PCP) or an absolute CD4 (T4 helper/inducer) lymphocyte count of less than 200/mm in the peripheral blood before therapy is begun,NA,Priority,Yes,N/A,N/A,N/A,N/A,N/A,N/A,NA,1986-12-02,1987-03-19,107,4.672828834461906,Pre-PDUFA
Elocon,mometasone furoate,Schering,NDA,19543,NA,NA,Ointment,Topical,NA,NA,NA,NA,11/8/1985,4/30/1987,1987,indicated for the relief of the inflammatory and pruritic manifestations of corticosteroid-responsive dermatoses,NA,Standard,No,N/A,N/A,N/A,N/A,N/A,N/A,NA,1985-11-08,1987-04-30,538,6.2878585601617845,Pre-PDUFA
Hytrin,terazosin hydrochloride,Abbott Laboratories,NDA,19057,NA,NA,Tablet,Oral,NA,NA,NA,NA,10/3/1983,8/7/1987,1987,treatment of hypertension,NA,Standard,No,N/A,N/A,N/A,N/A,N/A,N/A,NA,1983-10-03,1987-08-07,1404,7.247080584585756,Pre-PDUFA
Mevacor,lovastatin,Merck Sharp & Dohme,NDA,19643,NA,NA,Tablet,Oral,NA,NA,NA,NA,11/14/1986,8/31/1987,1987,indicated as an adjunct to diet for the reduction of elevated total and LDL cholesterol levels in patients with primary hypercholesterolemia (Types IIa and IIb) when the response to diet and other nonpharmacological measures alone has been inadequate,NA,Priority,No,N/A,N/A,N/A,N/A,N/A,N/A,NA,1986-11-14,1987-08-31,290,5.66988092298052,Pre-PDUFA
Cipro,ciprofloxacin hydrochloride,Miles,NDA,19537,NA,NA,Tablet,Oral,NA,NA,NA,NA,3/25/1986,10/22/1987,1987,"indicated for treatment of infections caused by susceptible strains of designated microorganisms in the conditions listed: lower respiratory, skin and skin structure, bone and joint, and urinary tract infections; infectious diarrhea",NA,Priority,No,N/A,N/A,N/A,N/A,N/A,N/A,NA,1986-03-25,1987-10-22,576,6.3561076606958915,Pre-PDUFA
Activase,alteplase,Genentech,BLA,103172,NA,NA,Injectable,Injection,NA,NA,NA,NA,5/1/1986,11/13/1987,1987,"indicated for use in the management of acute myocardial infarction in adults for the lysis of thrombi obstructing coronary arteries, the improvement of ventricular function and reduction of the incidence of congestive heart failure",NA,Priority,No,N/A,N/A,N/A,N/A,N/A,N/A,NA,1986-05-01,1987-11-13,561,6.329720905522696,Pre-PDUFA
Novantrone,mitoxantrone hydrochloride,Lederle,NDA,19297,NA,NA,Injectable,Injection,NA,NA,NA,NA,5/24/1984,12/23/1987,1987,"indicated in the initial therapy of acute nonlymphocytic leukemia (ANLL) in adults.  This category includes myelogenous, promyelocytic, monocytic, and erythroid acute leukemias",NA,Standard,Yes,N/A,N/A,N/A,N/A,N/A,N/A,NA,1984-05-24,1987-12-23,1308,7.176254532017144,Pre-PDUFA
Parathar,teriparatide acetate,Rorer,NDA,19498,NA,NA,Injectable,Injection,NA,NA,NA,NA,6/28/1985,12/23/1987,1987,as a diagnostic agent to assist in establishing the diagnosis in patients presenting with evidence of hypocalcemia due to either hypoparathyroidism or pseudohypoparathyroidism,NA,Priority,Yes,N/A,N/A,N/A,N/A,N/A,N/A,NA,1985-06-28,1987-12-23,908,6.811244378601294,Pre-PDUFA
Ucephan,"sodium phenylacetate, sodium benzoate",Kendall McGaw,NDA,19530,NA,NA,Solution,Oral,NA,NA,NA,NA,10/2/1985,12/23/1987,1987,"indicated as adjunctive therapy for the prevention and treatment of hyperammonemia in chronic management of urea cycle enzymopathies involving partial or complete deficiencies of carbamylphosphate synthetase, ornithine transcarbmylase, or argininosuccinate synthetase",NA,Priority,Yes,N/A,N/A,N/A,N/A,N/A,N/A,NA,1985-10-02,1987-12-23,812,6.699500340161678,Pre-PDUFA
Rowasa,mesalamine,Reid-Rowell,NDA,19618,NA,NA,Enema,Rectal,NA,NA,NA,NA,6/13/1986,12/24/1987,1987,"treatment of active mild to moderate distal ulcerative colitis, proctosigmoiditis or proctitis",NA,Priority,No,N/A,N/A,N/A,N/A,N/A,N/A,NA,1986-06-13,1987-12-24,559,6.326149473155099,Pre-PDUFA
Spectamine,iofetamine hydrochloride  I 123,Medi-Physics,NDA,19432,NA,NA,Injectable,Injection,NA,NA,NA,NA,2/12/1985,12/24/1987,1987,evaluation of nonlucunar stroke especially when used within 96 hours of the first onset of neurological deficit,NA,Standard,No,N/A,N/A,N/A,N/A,N/A,N/A,NA,1985-02-12,1987-12-24,1045,6.951772164398911,Pre-PDUFA
Prozac,fluoxetine hydrochloride,Eli Lilly,NDA,18936,NA,NA,Capsule,Oral,NA,NA,NA,NA,9/6/1983,12/29/1987,1987,treatment of depression,NA,Priority,No,N/A,N/A,N/A,N/A,N/A,N/A,NA,1983-09-06,1987-12-29,1575,7.362010551259734,Pre-PDUFA
Prinivil,lisinopril,Merck Sharp & Dohme,NDA,19558,NA,NA,Tablet,Oral,NA,NA,NA,NA,4/17/1986,12/29/1987,1987,treatment of hypertension,NA,Standard,No,N/A,N/A,N/A,N/A,N/A,N/A,NA,1986-04-17,1987-12-29,621,6.431331081933479,Pre-PDUFA
Cefmax,cefmenoxime hydrochloride,TAP Pharmaceuticals,NDA,50571,NA,NA,Injectable,Injection,NA,NA,NA,NA,6/28/1983,12/30/1987,1987,"indicated for the treatment of infections caused by susceptible strains of designated microorganisms in:  Lower respiratory infections, urinary tract infections",NA,Standard,No,N/A,N/A,N/A,N/A,N/A,N/A,NA,1983-06-28,1987-12-30,1646,7.406103381237015,Pre-PDUFA
Levatol,penbutolol sulfate,Eli Lilly,NDA,18976,NA,NA,Tablet,Oral,NA,NA,NA,NA,9/6/1983,12/30/1987,1987,treatment of mild-to-moderate arterial hypertension,NA,Standard,No,N/A,N/A,N/A,N/A,N/A,N/A,NA,1983-09-06,1987-12-30,1576,7.362645270417825,Pre-PDUFA
Deursil,ursodiol,Gipharmex,NDA,19594,NA,NA,Capsule,Oral,NA,NA,NA,NA,2/24/1986,12/31/1987,1987,"patients with radiolucent, non-calcified, gallbladder stones <20mm in greatest diameter in whom elective cholecystectomy would be undertaken except for the presence of increased surgical risk due to systemic disease or age",NA,Priority,No,N/A,N/A,N/A,N/A,N/A,N/A,NA,1986-02-24,1987-12-31,675,6.51471269087253,Pre-PDUFA
Terazol 7,terconazole,Ortho,NDA,19579,NA,NA,Cream,Vaginal,NA,NA,NA,NA,5/22/1986,12/31/1987,1987,local treatment of vulvovaginal candidiasis (moniliasis),NA,Standard,No,N/A,N/A,N/A,N/A,N/A,N/A,NA,1986-05-22,1987-12-31,588,6.376726947898627,Pre-PDUFA
Corotrope,milrinone lactate,Sterling-Winthrop,NDA,19436,NA,NA,Injectable,Injection,NA,NA,NA,NA,6/27/1985,12/31/1987,1987,short-term  intravenous  treatment  of  patients  with  acute  decompensated  heart  failure,NA,Standard,No,N/A,N/A,N/A,N/A,N/A,N/A,NA,1985-06-27,1987-12-31,917,6.821107472256465,Pre-PDUFA
Bactroban,mupirocin,Beecham,NDA,50591,NA,NA,Ointment,Topical,NA,NA,NA,NA,3/26/1984,12/31/1987,1987,"indicated for the topical treatment of impetigo due to: Staphylococcus aureus, beta hemolytic Streptococcus, and Streptococcus pyogenes",NA,Standard,No,N/A,N/A,N/A,N/A,N/A,N/A,NA,1984-03-26,1987-12-31,1375,7.226209010100671,Pre-PDUFA
Iopidine,apraclonidine hydrochloride,Alcon,NDA,19779,NA,NA,Solution/Drops,Ophthalmic,NA,NA,NA,NA,10/5/1987,12/31/1987,1987,to control or prevent postsurgical elevations in intraocular pressure that occur in patients after argon laser trabeculoplasty or argon laser iridotomy,NA,Standard,No,N/A,N/A,N/A,N/A,N/A,N/A,NA,1987-10-05,1987-12-31,87,4.465908118654584,Pre-PDUFA
Rimadyl,carprofen,Hoffmann-La Roche,NDA,18550,NA,NA,Tablet,Oral,NA,NA,NA,NA,9/24/1980,12/31/1987,1987,"acute or long-term use for the relief of signs and symptoms of rheumatiod arthritis, osteoarthritis, and acute gouty arthritis",NA,Standard,No,N/A,N/A,N/A,N/A,N/A,N/A,NA,1980-09-24,1987-12-31,2654,7.8838232148921525,Pre-PDUFA
Naftin,naftifine hydrochloride,Herbert Labs,NDA,19599,NA,NA,Cream,Topical,NA,NA,NA,NA,3/18/1986,2/29/1988,1988,indicated for the topical treatment of tinea cruris and tinea corporis,NA,Standard,No,N/A,N/A,N/A,N/A,N/A,N/A,NA,1986-03-18,1988-02-29,713,6.569481420414296,Pre-PDUFA
Axid,nizatidine,Eli Lilly,NDA,19508,NA,NA,Capsule,Oral,NA,NA,NA,NA,5/15/1986,4/12/1988,1988,treatment of active duodenal ulcers for up to six weeks; maintenance therapy of duodenal ulcer patients at a reduced dosage after healing of an active duodenal ulcer,NA,Standard,No,N/A,N/A,N/A,N/A,N/A,N/A,NA,1986-05-15,1988-04-12,698,6.548219102762372,Pre-PDUFA
Magnevist,gadopentetate dimeglumine,Berlex,NDA,19596,NA,NA,Injectable,Injection,NA,NA,NA,NA,8/19/1986,6/2/1988,1988,"using magnetic resonance imaging in adult patients, gadopentetate dimeglumine provides contrast enhancement in those intracranial lesions with abnormal vascularity or those thought to cause an abnormal blood brain barrier",NA,Priority,No,N/A,N/A,N/A,N/A,N/A,N/A,NA,1986-08-19,1988-06-02,653,6.481577129276431,Pre-PDUFA
Voltaren,diclofenac sodium,Ciba,NDA,19201,NA,NA,"Tablet, Delayed Release",Oral,NA,NA,NA,NA,12/20/1983,7/28/1988,1988,"acute and chronic treatment of the signs and symptoms of rheumatoid arthritis, osteoarthritis, and ankylosing spondylitis",NA,Standard,No,N/A,N/A,N/A,N/A,N/A,N/A,NA,1983-12-20,1988-07-28,1682,7.427738840532894,Pre-PDUFA
Thiola,tiopronin,Mission Pharmacal,NDA,19569,NA,NA,Tablet,Oral,NA,NA,NA,NA,1/8/1986,8/11/1988,1988,"prevention of cystine (kidney) stone formation in patients with severe homozygous cystinuria with urinary cystine greater than 500 mg/day, who are resistant to treatment with conservative measures of high fluid intake, alkali and diet modification, or who have adverse reactions to d-penicillamine",NA,Priority,Yes,N/A,N/A,N/A,N/A,N/A,N/A,NA,1986-01-08,1988-08-11,946,6.852242569051878,Pre-PDUFA
Photoplex,"avobenzone, padimate-O",Herbert Labs,NDA,19459,NA,NA,Lotion,Topical,NA,NA,NA,NA,4/8/1985,9/30/1988,1988,protection from the acute and long-term risks associated with UVA and UVB light exposure,NA,Standard,No,N/A,N/A,N/A,N/A,N/A,N/A,NA,1985-04-08,1988-09-30,1271,7.147559271189454,Pre-PDUFA
Sandostatin,octreotide acetate,Sandoz,NDA,19667,NA,NA,Injectable,Injection,NA,NA,NA,NA,2/9/1987,10/21/1988,1988,treatment of chronic and severe diarrhea and flushing episodes associated with carcinoid tumors and vasoactive intestinal peptide-secreting tumors (VIPomas),NA,Priority,No,N/A,N/A,N/A,N/A,N/A,N/A,NA,1987-02-09,1988-10-21,620,6.429719478039138,Pre-PDUFA
Cardene,nicardipine hydrochloride,Syntex,NDA,19488,NA,NA,Capsule,Oral,NA,NA,NA,NA,11/20/1985,12/21/1988,1988,management of patients with chronic stable angina (effort-associated angina); management of hypertension,NA,Standard,No,N/A,N/A,N/A,N/A,N/A,N/A,NA,1985-11-20,1988-12-21,1127,7.027314514039777,Pre-PDUFA
Ethamolin,ethanolamine oleate,Glaxo,NDA,19357,NA,NA,Injectable,Injection,NA,NA,NA,NA,9/14/1984,12/22/1988,1988,"treatment of patients with esophageal varices that have recently bled, to prevent rebleeding",NA,Priority,Yes,N/A,N/A,N/A,N/A,N/A,N/A,NA,1984-09-14,1988-12-22,1560,7.352441100243583,Pre-PDUFA
Cytotec,misoprostol,Searle,NDA,19268,NA,NA,Tablet,Oral,NA,NA,NA,NA,5/23/1984,12/27/1988,1988,"prevention of NSAID (nonsteroidal anti-inflammatory drugs, including aspirin)- induced gastric ulcers in patients at high risk of complications from a gastric ulcer, e.g., the elderly and patients with concomitant disease, as well as patients at high risk of developing gastric ulceration, such as patients with a history of ulcer",NA,Priority,No,N/A,N/A,N/A,N/A,N/A,N/A,NA,1984-05-23,1988-12-27,1679,7.425953657077541,Pre-PDUFA
Nimotop,nimodipine,Miles,NDA,18869,NA,NA,Capsule,Oral,NA,NA,NA,NA,9/17/1982,12/28/1988,1988,for the improvement of neurological deficits due to spasm following subarachnoid hemorrhage from ruptured congenital intracranial aneurysms in patients who are in good neurological condition post-ictus (e.g. Hunt and Hess Grades I-III),NA,Priority,No,N/A,N/A,N/A,N/A,N/A,N/A,NA,1982-09-17,1988-12-28,2294,7.738052297689316,Pre-PDUFA
Cartrol,carteolol hydrochloride,Abbott Laboratories,NDA,19204,NA,NA,Tablet,Oral,NA,NA,NA,NA,10/3/1984,12/28/1988,1988,management of hypertension,NA,Standard,No,N/A,N/A,N/A,N/A,N/A,N/A,NA,1984-10-03,1988-12-28,1547,7.344072850573066,Pre-PDUFA
Hismanal,astemizole,Janssen,NDA,19402,NA,NA,Tablet,Oral,NA,NA,NA,NA,2/25/1985,12/29/1988,1988,relief of symptoms associated with seasonal allergic rhinitis and chronic idiopathic urticaria,NA,Standard,No,N/A,N/A,N/A,N/A,N/A,N/A,NA,1985-02-25,1988-12-29,1403,7.246368080102461,Pre-PDUFA
Oxistat,oxiconazole nitrate,Glaxo,NDA,19828,NA,NA,Cream,Topical,NA,NA,NA,NA,2/11/1988,12/30/1988,1988,"treatment of tinea pedis, tinea cruris and tinea corporis due to Trichophyton rubrum, Trichophyton mentagrophytes, or Epidermophyton floccosum",NA,Standard,No,N/A,N/A,N/A,N/A,N/A,N/A,NA,1988-02-11,1988-12-30,323,5.777652323222656,Pre-PDUFA
Optiray,ioversol,Mallinckrodt,NDA,19710,NA,NA,Injectable,Injection,NA,NA,NA,NA,6/26/1987,12/30/1988,1988,"Optiray-320 for angiography throughout the cardiovascular system including cerebral, coronary, peripheral, visceral and renal arteriography, aortography, and left ventriculography; contrast enhanced CT imaging of the head and body, and I.V. excretory urography. Optiray-240  indicated  for cerebral angiography and venography. Optiray-160 intra-arterial digital subtraction angiography",NA,Standard,No,N/A,N/A,N/A,N/A,N/A,N/A,NA,1987-06-26,1988-12-30,553,6.315358001522335,Pre-PDUFA
Ifex,ifosfamide,Bristol-Myers,NDA,19763,NA,NA,Injectable,Injection,NA,NA,NA,NA,12/10/1987,12/30/1988,1988,"used in combination with certain other approved antineoplastic agents is indicated for third-line chemotherapy of germ cell testicular cancer. It should ordinarily be used in combination with a prophylactic agent for hemorrhagic cystitis, such as mesna",NA,Priority,Yes,N/A,N/A,N/A,N/A,N/A,N/A,NA,1987-12-10,1988-12-30,386,5.955837369464831,Pre-PDUFA
Ceretec,technetium Tc-99m exametazime,Amersham,NDA,19829,NA,NA,Injectable,Injection,NA,NA,NA,NA,3/15/1988,12/30/1988,1988,use as an adjunct in the detection of altered regional cerebral perfusion in strokes,NA,Priority,No,N/A,N/A,N/A,N/A,N/A,N/A,NA,1988-03-15,1988-12-30,290,5.66988092298052,Pre-PDUFA
Mesnex,mesna,Asta,NDA,19884,NA,NA,Injectable,Intravenous,NA,NA,NA,NA,7/6/1988,12/30/1988,1988,prophylactic agent for reducing the incidence of ifosamide-induced hemorrhagic cystitis,NA,Priority,Yes,N/A,N/A,N/A,N/A,N/A,N/A,NA,1988-07-06,1988-12-30,177,5.176149732573829,Pre-PDUFA
Ceradon,cefotiam hydrochloride,Takeda,NDA,50601,NA,NA,Injectable,Injection,NA,NA,NA,NA,4/30/1985,12/30/1988,1988,"treatment of infections caused by susceptible strains of the designated microorganisms: lower respiratory tract infections, bronchitis, and pneumonia",NA,Standard,No,N/A,N/A,N/A,N/A,N/A,N/A,NA,1985-04-30,1988-12-30,1340,7.200424892944957,Pre-PDUFA
Permax,pergolide mesylate,Eli Lilly,NDA,19385,NA,NA,Tablet,Oral,NA,NA,NA,NA,9/13/1985,12/30/1988,1988,as adjunctive treatment to levodopa in the management of the signs and symptoms of Parkinson’s disease,NA,Priority,No,N/A,N/A,N/A,N/A,N/A,N/A,NA,1985-09-13,1988-12-30,1204,7.093404625868766,Pre-PDUFA
Eulexin,flutamide,Schering,NDA,18554,NA,NA,Capsule,Oral,NA,NA,NA,NA,9/30/1980,1/27/1989,1989,in combination with LHRH agonistic analogs (such as leuprolide acetate) for the treatment of metastatic prostatic carcinoma,NA,Priority,No,N/A,N/A,N/A,N/A,N/A,N/A,NA,1980-09-30,1989-01-27,3041,8.019941687677365,Pre-PDUFA
Cefpiramide,cefpiramide sodium,Wyeth-Ayerst,NDA,50633,NA,NA,Injectable,Injection,NA,NA,NA,NA,7/31/1987,1/31/1989,1989,"indicated for the treatment of the following infections when caused by susceptible strains of designated organisms:  lower respiratory infections including pneumonia, skin and skin structure infections",NA,Standard,No,N/A,N/A,N/A,N/A,N/A,N/A,NA,1987-07-31,1989-01-31,550,6.309918278226516,Pre-PDUFA
Paraplatin,carboplatin,Bristol-Myers,NDA,19880,NA,NA,Injectable,Injection,NA,NA,NA,NA,6/30/1988,3/3/1989,1989,"palliative treatment of patients with ovarian carcinoma recurrent after prior chemotherapy, including patients who have previously been treated with cisplatin",NA,Priority,No,N/A,N/A,N/A,N/A,N/A,N/A,NA,1988-06-30,1989-03-03,246,5.5053315359323625,Pre-PDUFA
Suprax,cefixime,Lederle,NDA,50621,50622,NA,Tablet,Oral,Suspension,Oral,NA,NA,6/27/1986,4/28/1989,1989,"indicated in the treatment of the following infections when caused by susceptible strains of the designated microorganisms: Uncomplicated Urinary Tract Infections, Otitis Media, Pharyngitis and tonsillitis, Acute Bronchitis and Acute Exacerbations of Chronic Bronchitis",NA,Standard,No,N/A,N/A,N/A,N/A,N/A,N/A,NA,1986-06-27,1989-04-28,1036,6.943122422819428,Pre-PDUFA
Lariam,mefloquine hydrochloride,Department of the Army,NDA,19578,NA,NA,Tablet,Oral,NA,NA,NA,NA,2/5/1986,5/2/1989,1989,"treatment of mild to moderate acute malaria caused by mefloquine-susceptible strains of P. falciparum (both chloroquine-susceptible and resistant strains) or by Plasmodium vivax; also indicated for the prophylaxis of P. falciparum and P. vivax malaria infections, including prophylaxis of chloroquine-resistant strains of P. falciparum.",NA,Priority,Yes,N/A,N/A,N/A,N/A,N/A,N/A,NA,1986-02-05,1989-05-02,1182,7.074963197966044,Pre-PDUFA
Epogen,epoetin alfa,Amgen,BLA,103234,NA,NA,Injectable,Injection,NA,NA,NA,NA,11/3/1987,6/1/1989,1989,"treatment of anemia associated with chronic renal failure, including patients on dialysis (end-stage renal disease) and patients not on dialysis",NA,Standard,Yes,N/A,N/A,N/A,N/A,N/A,N/A,NA,1987-11-03,1989-06-01,576,6.3561076606958915,Pre-PDUFA
Eldepryl,selegiline hydrochloride,Somerset,NDA,19334,NA,NA,Tablet,Oral,NA,NA,NA,NA,7/23/1984,6/5/1989,1989,indicated as an adjunct in the management of Parkinsonian patients being treated with levodopa/carbidopa who exhibit deterioration in the quality of their response to this therapy,NA,Priority,Yes,N/A,N/A,N/A,N/A,N/A,N/A,NA,1984-07-23,1989-06-05,1778,7.48324441607385,Pre-PDUFA
Cytovene,ganciclovir sodium,Syntex,NDA,19661,NA,NA,Injectable,Injection,NA,NA,NA,NA,12/29/1986,6/23/1989,1989,"treatment of CMV retinitis in immunocompromised 
patients, including patients with acquired immunodeficiency syndrome (AIDS)",NA,Priority,Yes,N/A,N/A,N/A,N/A,N/A,N/A,NA,1986-12-29,1989-06-23,907,6.810142450115136,Pre-PDUFA
Losec,omeprazole,Merck Sharp & Dohme,NDA,19810,NA,NA,"Capsule, Delayed Release Pellets",Oral,NA,NA,NA,NA,7/1/1988,9/14/1989,1989,"short-term treatment (four to eight weeks) of severe erosive esophagitis; short-term treatment of symptomatic gastroesophageal reflux disease (GERD) poorly responsive to customary medical treatment, usually including an adequate course of a histamine H2 receptor antagonist;  long-term treatment of Zollinger-Ellison syndrome",NA,Priority,No,N/A,N/A,N/A,N/A,N/A,N/A,NA,1988-07-01,1989-09-14,440,6.0867747269123065,Pre-PDUFA
Clozaril,clozapine,Sandoz,NDA,19758,NA,NA,Tablet,Oral,NA,NA,NA,NA,9/1/1987,9/26/1989,1989,treatment of severely ill schizophrenic patients who fail to respond to standard drug therapies,NA,Priority,No,N/A,N/A,N/A,N/A,N/A,N/A,NA,1987-09-01,1989-09-26,756,6.628041376179533,Pre-PDUFA
Diprivan,propofol,ICI,NDA,19627,NA,NA,Injectable,Injection,NA,NA,NA,NA,8/1/1986,10/2/1989,1989,induction and maintenance of anesthesia,NA,Standard,No,N/A,N/A,N/A,N/A,N/A,N/A,NA,1986-08-01,1989-10-02,1158,7.05444965813294,Pre-PDUFA
Alferon N,interferon alfa-n3,Interferon Sciences,BLA,103158,NA,NA,Injectable,Injection,NA,NA,NA,NA,12/16/1985,10/10/1989,1989,treatment of condyloma acuminata (genital warts),NA,Standard,No,N/A,N/A,N/A,N/A,N/A,N/A,NA,1985-12-16,1989-10-10,1394,7.2399325913204695,Pre-PDUFA
Adenocard,adenosine,Medco,NDA,19937,NA,NA,Injectable,Injection,NA,NA,NA,NA,12/28/1988,10/30/1989,1989,"indicated for conversion to sinus rhythm of paroxysmal supraventricular tachycardia (PSVT), including that associated with accessory bypass tracts (Wolff-Parkinson-White Syndrome)",NA,Priority,No,N/A,N/A,N/A,N/A,N/A,N/A,NA,1988-12-28,1989-10-30,306,5.723585101952381,Pre-PDUFA
Eminase,anistreplase,Beecham,BLA,103273,NA,NA,Injectable,Injection,NA,NA,NA,NA,6/8/1988,11/27/1989,1989,"indicated for use in the management of acute myocardial infarction (AMI) in adults, for the lysis of thrombi obstructing coronary arteries, the reduction of infarct size, the improvement of ventricular function following AMI, and the reduction of mortality associated with AMI",NA,Standard,No,N/A,N/A,N/A,N/A,N/A,N/A,Biologic product assigned new license number and now referenced by BLA 103674,1988-06-08,1989-11-27,537,6.285998094508865,Pre-PDUFA
Rythmol,propafenone hydrochloride,Knoll,NDA,19151,NA,NA,Tablet,Oral,NA,NA,NA,NA,10/26/1983,11/27/1989,1989,"treatment of documented ventricular arrhythmias, such as sustained ventricular tachycardia, that in the judgment of the physician, are life-threatening",NA,Standard,No,N/A,N/A,N/A,N/A,N/A,N/A,NA,1983-10-26,1989-11-27,2224,7.707062655370473,Pre-PDUFA
Toradol,ketorolac tromethamine,Syntex,NDA,19698,NA,NA,Injectable,Injection,NA,NA,NA,NA,6/22/1987,11/30/1989,1989,indicated for the short-term management of pain,NA,Priority,No,N/A,N/A,N/A,N/A,N/A,N/A,NA,1987-06-22,1989-11-30,892,6.79346613258001,Pre-PDUFA
Osmovist,iotrolan,Berlex,NDA,19580,NA,NA,Injectable,Intrathecal,NA,NA,NA,NA,2/10/1986,12/7/1989,1989,"indicated for lumbar, thoracic, cervical, and total columnar myelography, and computerized tomography (CT) of spinal and subarachnoid spaces, in adults",NA,Standard,No,N/A,N/A,N/A,N/A,N/A,N/A,NA,1986-02-10,1989-12-07,1396,7.241366283322318,Pre-PDUFA
Oculinum,botulinum toxin type A,Allergan,BLA,103000,NA,NA,Injectable,Injection,NA,NA,NA,NA,3/28/1985,12/9/1989,1989,"for the treatment of strabismus  in patients 12 years of age and above;
blepharospasm associated with dystonia, including benign essential blepharospasm or [seventh] nerve disorders in patients 12 years of age and above",NA,Standard,Yes,N/A,N/A,N/A,N/A,N/A,N/A,NA,1985-03-28,1989-12-09,1717,7.448333860897476,Pre-PDUFA
Zefazone,cefmetazole sodium,Upjohn,NDA,50637,NA,NA,Injectable,Injection,NA,NA,NA,NA,12/31/1987,12/11/1989,1989,"treatment of serious infections caused by susceptible strains of the designated microorganisms in the following diseases: Urinary Tract Infections; Lower Respiratory Tract Infections; Skin and Skin Structure Infections; Intraabdominal Infections; reduce the incidence of certain postoperative infections in patients who undergo caesarean section, abdominal or vaginal hysterectomy, cholecystectomy (high risk patients), and colorectal surgery",NA,Standard,No,N/A,N/A,N/A,N/A,N/A,N/A,NA,1987-12-31,1989-12-11,711,6.566672429803241,Pre-PDUFA
Pindac,pinacidil,Eli Lilly,NDA,19456,NA,NA,"Capsule, Extended Release",Oral,NA,NA,NA,NA,7/31/1985,12/28/1989,1989,treatment of hypertension,NA,Standard,No,N/A,N/A,N/A,N/A,N/A,N/A,NA,1985-07-31,1989-12-28,1611,7.384610383176974,Pre-PDUFA
Anafranil,clomipramine hydrochloride,Ciba-Geigy,NDA,19906,NA,NA,Capsule,Oral,NA,NA,NA,NA,6/16/1989,12/29/1989,1989,"treatment of obsessions and compulsions in patients with Obsessive Compulsive Disorder (OCD). The obsessions or compulsions must cause marked distress, be time-consuming, or significantly interfere with social or occupational functioning, in order to meet the DSM III-R (circa 1989) diagnosis of OCD",NA,Priority,No,N/A,N/A,N/A,N/A,N/A,N/A,NA,1989-06-16,1989-12-29,196,5.278114659230517,Pre-PDUFA
Zoladex,goserelin acetate,ICI,NDA,19726,NA,NA,Implant,Implantation,NA,NA,NA,NA,8/14/1987,12/29/1989,1989,palliative treatment of advanced carcinoma of the prostate,NA,Standard,No,N/A,N/A,N/A,N/A,N/A,N/A,NA,1987-08-14,1989-12-29,868,6.7661917146603505,Pre-PDUFA
Dalgan,dezocine,Wyeth-Ayerst,NDA,19082,NA,NA,Injectable,Injection,NA,NA,NA,NA,7/29/1983,12/29/1989,1989,indicated for the management of pain when the use of an opioid analgesic is appropriate,NA,Standard,No,N/A,N/A,N/A,N/A,N/A,N/A,NA,1983-07-29,1989-12-29,2345,7.76004068088038,Pre-PDUFA
Cardiogen-82,rubidium Rb 82 chloride,Bristol-Myers Squibb,NDA,19414,NA,NA,Injectable,Injection,NA,NA,NA,NA,12/28/1984,12/29/1989,1989,indicated for assessing regional myocardial perfusion in the diagnosis and localization of myocardial infarction,NA,Standard,No,N/A,N/A,N/A,N/A,N/A,N/A,NA,1984-12-28,1989-12-29,1827,7.510430556378006,Pre-PDUFA
Betamet,metipranolol hydrochloride,Bausch & Lomb,NDA,19907,NA,NA,Solution/Drops,Ophthalmic,NA,NA,NA,NA,10/21/1988,12/29/1989,1989,has been shown to be effective in lowering intraocular pressure and may be used in patients with chronic open-angle glaucoma or intraocular hypertension,NA,Standard,No,N/A,N/A,N/A,N/A,N/A,N/A,NA,1988-10-21,1989-12-29,434,6.073044534100405,Pre-PDUFA
Ortho Cyclen,"norgestimate, ethinyl estradiol",RW Johnson,NDA,19653,NA,NA,Tablet,Oral,NA,NA,NA,NA,3/24/1987,12/29/1989,1989,prevention of pregnancy in women who elect to use oral contraceptives as a method of contraception,NA,Standard,No,N/A,N/A,N/A,N/A,N/A,N/A,NA,1987-03-24,1989-12-29,1011,6.918695219020472,Pre-PDUFA
Decabid,indecainide hydrochloride,Eli Lilly,NDA,19693,NA,NA,"Tablet, Extended Release",Oral,NA,NA,NA,NA,1/5/1988,12/29/1989,1989,"treatment of documented ventricular arrhythmias, such as sustained ventricular tachycardia, that in the judgment of the physician, are life-threatening",NA,Standard,No,N/A,N/A,N/A,N/A,N/A,N/A,NA,1988-01-05,1989-12-29,724,6.584791392385716,Pre-PDUFA
Diflucan,fluconazole,Pfizer,NDA,19949,19950,NA,Tablet,Oral,Injectable,Injection,NA,NA,3/2/1989,1/29/1990,1990,"treatment of oropharyngeal and esophageal candidiasis; serious systemic candidal infections, including urinary tract infection, peritonitis, and pneumonia; also indicated for treatment of cryptococcal meningitis",NA,Priority,No,N/A,N/A,N/A,N/A,N/A,N/A,NA,1989-03-02,1990-01-29,333,5.808142489980444,Pre-PDUFA
Synarel,nafarelin acetate,Syntex,NDA,19886,NA,NA,"Spray, Metered",Nasal,NA,NA,NA,NA,11/16/1988,2/13/1990,1990,"management of endometriosis, including pain relief and reduction of endometriotic lesions",NA,Standard,No,N/A,N/A,N/A,N/A,N/A,N/A,NA,1988-11-16,1990-02-13,454,6.118097198041348,Pre-PDUFA
Adagen,pegademase bovine,Enzon,BLA,19818,NA,NA,Injectable,Injection,NA,NA,NA,NA,1/13/1988,3/21/1990,1990,indicated for enzyme replacement therapy for adenosine deaminase (ADA) deficiency  in  patients  with  severe  combined  immunodeficiency  disease  (SCID)  who  are  not  suitable  candidates  for  –  or  who  have  failed  –  bone  marrow  transplantation,NA,Priority,Yes,N/A,N/A,N/A,N/A,N/A,N/A,Transition Product from NDA to BLA due to BPCI : Please see page 2 of data dictionary for more information.,1988-01-13,1990-03-21,798,6.682108597449809,Pre-PDUFA
TechneScan MAG3,technetium Tc-99m mertiatide,Mallinckrodt,NDA,19882,NA,NA,Injectable,Injection,NA,NA,NA,NA,10/18/1988,6/15/1990,1990,"indicated as a renal imaging agent for use in the diagnosis of congenital and acquired abnormalities, renal failure, urinary tract obstruction, and calculi",NA,Standard,No,N/A,N/A,N/A,N/A,N/A,N/A,NA,1988-10-18,1990-06-15,605,6.405228458030842,Pre-PDUFA
Ergamisol,levamisole hydrochloride,Janssen,NDA,20035,NA,NA,Tablet,Oral,NA,NA,NA,NA,11/1/1989,6/18/1990,1990,indicated as adjuvant treatment in combination with 5-fluorouracil after surgical resection in patients with Dukes' stage C colon cancer,NA,Priority,No,N/A,N/A,N/A,N/A,N/A,N/A,NA,1989-11-01,1990-06-18,229,5.43372200355424,Pre-PDUFA
Ethmozine,moricizine hydrochloride,DuPont,NDA,19753,NA,NA,Tablet,Oral,NA,NA,NA,NA,9/1/1987,6/19/1990,1990,"indicated for the treatment of documented ventricular arrhythmias, such as sustained ventricular tachycardia, that in the judgment of the physician are life-threatening",NA,Priority,No,N/A,N/A,N/A,N/A,N/A,N/A,NA,1987-09-01,1990-06-19,1022,6.92951677076365,Pre-PDUFA
Arduan,pipecuronium bromide,Organon,NDA,19638,NA,NA,Injectable,Injection,NA,NA,NA,NA,12/29/1987,6/26/1990,1990,"indicated as an adjunct to general anesthesia, to provide skeletal muscle relaxation during surgery; can also be used to provide skeletal muscle relaxation for endotracheal intubation",NA,Standard,No,N/A,N/A,N/A,N/A,N/A,N/A,NA,1987-12-29,1990-06-26,910,6.813444599510896,Pre-PDUFA
Dipentum,olsalazine sodium,Pharmacia,NDA,19715,NA,NA,Capsule,Oral,NA,NA,NA,NA,9/1/1987,7/31/1990,1990,indicated for the maintenance of remission of ulcerative colitis in patients who are intolerant of sulfasalazine,NA,Priority,No,N/A,N/A,N/A,N/A,N/A,N/A,NA,1987-09-01,1990-07-31,1064,6.96979066990159,Pre-PDUFA
Exosurf,"colfosceril palmitate, cetyl alcohol, tyloxapol",Burroughs Wellcome,NDA,20044,NA,NA,For Suspension,Intratracheal,NA,NA,NA,NA,2/16/1990,8/2/1990,1990,"indicated for prophylactic treatment of infants with birth weight less than 1350 grams who are at risk of developing RDS, prophylactic treatment of infants with birth weight greater than 1350 grams who have evidence of pulmonary immaturity, and rescue treatment of infants who have developed RDS",NA,Priority,Yes,N/A,N/A,N/A,N/A,N/A,N/A,NA,1990-02-16,1990-08-02,167,5.117993812416755,Pre-PDUFA
Idamycin,idarubicin hydrochloride,Adria,NDA,50661,NA,NA,Injectable,Injection,NA,NA,NA,NA,8/31/1989,9/27/1990,1990,in combination with other approved antileukemic drugs for the treatment of acute myeloid leukemia (AML) in adults,NA,Priority,Yes,N/A,N/A,N/A,N/A,N/A,N/A,NA,1989-08-31,1990-09-27,392,5.971261839790462,Pre-PDUFA
Cardura,doxazosin mesylate,Pfizer,NDA,19668,NA,NA,Tablet,Oral,NA,NA,NA,NA,3/11/1987,11/2/1990,1990,treatment of hypertension,NA,Standard,No,N/A,N/A,N/A,N/A,N/A,N/A,NA,1987-03-11,1990-11-02,1332,7.194436851100335,Pre-PDUFA
Ornidyl,eflornithine hydrochloride,Marion Merrell Dow,NDA,19879,NA,NA,Injectable,Injection,NA,NA,NA,NA,8/2/1988,11/28/1990,1990,treatment of meningoencephalitic stage of Trypanosoma brucei gambiense infection (sleeping sickness),NA,Priority,Yes,N/A,N/A,N/A,N/A,N/A,N/A,NA,1988-08-02,1990-11-28,848,6.742880635791903,Pre-PDUFA
Cutivate,fluticasone propionate,Glaxo,NDA,19957,NA,NA,Ointment,Topical,NA,NA,NA,NA,10/26/1989,12/14/1990,1990,indicated for the relief of the inflammatory and pruritic manifestations of corticosteroid-responsive dermatoses,NA,Standard,No,N/A,N/A,N/A,N/A,N/A,N/A,NA,1989-10-26,1990-12-14,414,6.025865973825314,Pre-PDUFA
Ultravate,halobetasol propionate,Bristol-Myers Squibb,NDA,19968,NA,NA,Ointment,Topical,NA,NA,NA,NA,4/3/1989,12/17/1990,1990,indicated for the relief of the inflammatory and pruritic manifestations of corticosteroid-responsive dermatoses,NA,Standard,No,N/A,N/A,N/A,N/A,N/A,N/A,NA,1989-04-03,1990-12-17,623,6.434546518787453,Pre-PDUFA
Cardiotec,technetium Tc-99m teboroxime,Squibb,NDA,19928,NA,NA,Injectable,Injection,NA,NA,NA,NA,12/23/1988,12/19/1990,1990,"indicated as a myocardial perfusion agent that is useful in distinguishing normal from abnormal myocardium in patients with suspected coronary artery disease, using rest and stress techniques",NA,Priority,No,N/A,N/A,N/A,N/A,N/A,N/A,NA,1988-12-23,1990-12-19,726,6.587550014824796,Pre-PDUFA
Dynacirc,isradipine,Sandoz,NDA,19546,NA,NA,Capsule,Oral,NA,NA,NA,NA,4/25/1986,12/20/1990,1990,indicated for the management of hypertension,NA,Standard,No,N/A,N/A,N/A,N/A,N/A,N/A,NA,1986-04-25,1990-12-20,1700,7.438383530044307,Pre-PDUFA
Actimmune,interferon gamma-1b,Genentech,BLA,103348,NA,NA,Injectable,Injection,NA,NA,NA,NA,12/22/1989,12/20/1990,1990,treatment of chronic granulomatous disease,NA,Priority,Yes,N/A,N/A,N/A,N/A,N/A,N/A,Biologic product assigned new license number and now referenced by BLA 103836,1989-12-22,1990-12-20,363,5.8944028342648505,Pre-PDUFA
Cardiolite,technetium Tc-99m sestamibi,DuPont,NDA,19785,NA,NA,Injectable,Injection,NA,NA,NA,NA,12/12/1988,12/21/1990,1990,"indicated as a myocardial perfusion agent that is useful in distinguishing normal from abnormal myocardium, and in the localization of the abnormality, in patients with suspected myocardial infarction",NA,Standard,No,N/A,N/A,N/A,N/A,N/A,N/A,NA,1988-12-12,1990-12-21,739,6.6052979209482015,Pre-PDUFA
Hexalen,altretamine,US Bioscience,NDA,19926,NA,NA,Capsule,Oral,NA,NA,NA,NA,12/19/1988,12/26/1990,1990,palliative treatment of patients with persistent or recurrent ovarian cancer following first-line therapy with cisplatin and/or alkylating agent based combination,NA,Priority,Yes,N/A,N/A,N/A,N/A,N/A,N/A,NA,1988-12-19,1990-12-26,737,6.602587892189336,Pre-PDUFA
ProSom,estazolam,Abbott Laboratories,NDA,19080,NA,NA,Tablet,Oral,NA,NA,NA,NA,12/19/1983,12/26/1990,1990,short term treatment of insomnia,NA,Standard,No,N/A,N/A,N/A,N/A,N/A,N/A,NA,1983-12-19,1990-12-26,2564,7.849323818040561,Pre-PDUFA
Geref,sermorelin acetate,Serono,NDA,19863,NA,NA,Injectable,Injection,NA,NA,NA,NA,5/5/1988,12/28/1990,1990,for evaluating the ability of the somatotroph of the pituitary gland to secrete growth hormone (GH),NA,Standard,No,N/A,N/A,N/A,N/A,N/A,N/A,NA,1988-05-05,1990-12-28,967,6.874198495453294,Pre-PDUFA
Vascor,bepridil hydrochloride,McNeil Laboratories,NDA,19002,NA,NA,Tablet,Oral,NA,NA,NA,NA,12/28/1983,12/28/1990,1990,treatment of chronic stable angina (classic effort-associated angina) in patients failing to respond adequately to other therapy,NA,Priority,No,N/A,N/A,N/A,N/A,N/A,N/A,NA,1983-12-28,1990-12-28,2557,7.846589975291186,Pre-PDUFA
Floxin,ofloxacin,RW Johnson,NDA,19735,NA,NA,Tablet,Oral,NA,NA,NA,NA,12/22/1987,12/28/1990,1990,"treatment for the following infections caused by susceptible strains of designated microorganisms; lower respiratory tract infections (acute bacterial exacerbations of chronic bronchitis and pneumonia); sexually transmitted diseases (acute, uncomplicated urethral and cervical gonorrhea, nongonococcal urethritis and cervicitis, and mixed infections of the urethra and cervix); skin and skin structure infections (mild to moderate skin and skin structure infections); urinary tract infections (uncomplicated cystitis, and complicated urinary tract infections); and prostatitis",NA,Standard,No,N/A,N/A,N/A,N/A,N/A,N/A,NA,1987-12-22,1990-12-28,1102,7.004881989712859,Pre-PDUFA
Rev-Eyes,dapiprazole hydrochloride,Angelini,NDA,19849,NA,NA,Solution/Drops,Ophthalmic,NA,NA,NA,NA,5/27/1988,12/31/1990,1990,treatment of iatrogenically induced mydriasis produced by adrenergic (phenylephrine) or parasmypatholytic (tropicamide) agents,NA,Priority,No,N/A,N/A,N/A,N/A,N/A,N/A,NA,1988-05-27,1990-12-31,948,6.854354502255021,Pre-PDUFA
Zofran,ondansetron hydrochloride,Glaxo,NDA,20007,NA,NA,Injectable,Injection,NA,NA,NA,NA,10/12/1989,1/4/1991,1991,prevention of nausea and vomiting associated with initial and repeat courses of emetogenic cancer chemotherapy including high-dose cisplatin,NA,Priority,No,N/A,N/A,N/A,N/A,N/A,N/A,NA,1989-10-12,1991-01-04,449,6.1070228877422545,Pre-PDUFA
Ganite,gallium nitrate,Fujisawa,NDA,19961,NA,NA,Injectable,Injection,NA,NA,NA,NA,3/20/1989,1/17/1991,1991,for the treatment of clearly symptomatic cancer-related hypercalcemia that has not responded to adequate hydration,NA,Priority,Yes,N/A,N/A,N/A,N/A,N/A,N/A,NA,1989-03-20,1991-01-17,668,6.504288173536645,Pre-PDUFA
Altace,ramipril,Hoechst-Roussel,NDA,19901,NA,NA,Capsule,Oral,NA,NA,NA,NA,11/7/1988,1/28/1991,1991,for the treatment of hypertension,NA,Standard,No,N/A,N/A,N/A,N/A,N/A,N/A,NA,1988-11-07,1991-01-28,812,6.699500340161678,Pre-PDUFA
Chemet,succimer,McNeil,NDA,19998,NA,NA,Capsule,Oral,NA,NA,NA,NA,8/22/1989,1/30/1991,1991,treatment of lead poisoning in children with blood lead levels above 45 mug/dL,NA,Priority,Yes,N/A,N/A,N/A,N/A,N/A,N/A,NA,1989-08-22,1991-01-30,526,6.26530121273771,Pre-PDUFA
Lodine,etodolac,Wyeth-Ayerst,NDA,18922,NA,NA,Capsule,Oral,NA,NA,NA,NA,12/30/1982,1/31/1991,1991,indicated for the treatment of osteoarthritis; management of pain,NA,Standard,No,N/A,N/A,N/A,N/A,N/A,N/A,NA,1982-12-30,1991-01-31,2954,7.9909154630913255,Pre-PDUFA
Neupogen,filgrastim,Amgen,BLA,103353,NA,NA,Injectable,Injection,NA,NA,NA,NA,1/5/1990,2/20/1991,1991,"to decrease the incidence of infection, as manifested in febrile neutropenia, in patients with non-myeloid malignancies receiving myelosuppressive anti-cancer drugs associated with a significant incidence of severe neutropenia with fever",NA,Priority,No,N/A,N/A,N/A,N/A,N/A,N/A,NA,1990-01-05,1991-02-20,411,6.018593214496234,Pre-PDUFA
Leukine,sargramostim,Immunex,BLA,103362,NA,NA,Injectable,Injection,NA,NA,NA,NA,2/24/1990,3/5/1991,1991,approved for use following induction chemotherapy in older adults with acute myelogenous leukemia (AML) to shorten the time to neutrophil recovery and reduce the incidence of severe and life-threatening infections and infections resulting in death,NA,Priority,Yes,N/A,N/A,N/A,N/A,N/A,N/A,NA,1990-02-24,1991-03-05,374,5.924255797414532,Pre-PDUFA
Nuromax,doxacurium chloride,Burroughs Wellcome,NDA,19946,NA,NA,Injectable,Injection,NA,NA,NA,NA,3/21/1989,3/7/1991,1991,"indicated as an adjunct to general anesthesia, to provide skeletal muscle relaxation during surgery; also be used to provide skeletal muscle relaxation for endotracheal intubation",NA,Standard,No,N/A,N/A,N/A,N/A,N/A,N/A,NA,1989-03-21,1991-03-07,716,6.573680166960646,Pre-PDUFA
Ceredase,alglucerase,Genzyme,NDA,20057,NA,NA,Injectable,Injection,NA,NA,NA,NA,4/24/1990,4/5/1991,1991,"indicated for use as long-term enzyme replacement therapy for patients with a confirmed diagnosis of Type 1 Gaucher disease who exhibit signs and symptoms that are severe enough to result in one of the following conditions:  moderate to severe anemia, thrombocytopenia with bleeding tendency, bone disease, significant hepatomegaly or splenomegaly",NA,Priority,Yes,N/A,N/A,N/A,N/A,N/A,N/A,NA,1990-04-24,1991-04-05,346,5.846438775057725,Pre-PDUFA
Fludara,fludarabine phosphate,Berlex,NDA,20038,NA,NA,Injectable,Injection,NA,NA,NA,NA,11/24/1989,4/18/1991,1991,treatment of patients with B-cell chronic lymphocytic leukemia (CLL) who have not responded to other treatments or whose disease has progressed during treatment with at least one standard alkylating agent-containing regimen,NA,Priority,Yes,N/A,N/A,N/A,N/A,N/A,N/A,NA,1989-11-24,1991-04-18,510,6.234410725718371,Pre-PDUFA
Monopril,fosinopril sodium,Bristol-Myers Squibb,NDA,19915,NA,NA,Tablet,Oral,NA,NA,NA,NA,11/15/1988,5/16/1991,1991,treatment of hypertension,NA,Standard,No,N/A,N/A,N/A,N/A,N/A,N/A,NA,1988-11-15,1991-05-16,912,6.815639990074331,Pre-PDUFA
Lotensin,benazepril hydrochloride,Ciba,NDA,19851,NA,NA,Tablet,Oral,NA,NA,NA,NA,7/6/1988,6/25/1991,1991,treatment of hypertension,NA,Standard,No,N/A,N/A,N/A,N/A,N/A,N/A,NA,1988-07-06,1991-06-25,1084,6.988413181999592,Pre-PDUFA
Survanta,beractant,Ross,BLA,20032,NA,NA,Suspension,Intratracheal,NA,NA,NA,NA,1/2/1990,7/1/1991,1991,"prevention of RDS (hyaline membrane disease) in premature infants less than 1250 grams birthweight or with evidence of surfactant deficiency; treatment of (""rescue"") of premature infants with RDS confirmed by x-ray and requiring mechanical ventilation",NA,Standard,Yes,N/A,N/A,N/A,N/A,N/A,N/A,Transition Product from NDA to BLA due to BPCI : Please see page 2 of data dictionary for more information.,1990-01-02,1991-07-01,545,6.300785794663244,Pre-PDUFA
Plendil,felodipine,Merck Sharp & Dohme,NDA,19834,NA,NA,"Tablet, Extended Release",Oral,NA,NA,NA,NA,2/26/1988,7/25/1991,1991,treatment of hypertension,NA,Standard,No,N/A,N/A,N/A,N/A,N/A,N/A,NA,1988-02-26,1991-07-25,1245,7.126890808898808,Pre-PDUFA
Foscavir,foscarnet sodium,Astra,NDA,20068,NA,NA,Injectable,Injection,NA,NA,NA,NA,9/20/1990,9/27/1991,1991,treatment of CMV retinitis in patients with acquired immunodeficiency syndrome (AIDS),NA,Priority,No,N/A,N/A,N/A,N/A,N/A,N/A,NA,1990-09-20,1991-09-27,372,5.918893854273146,Pre-PDUFA
Videx,didanosine,Bristol-Myers Squibb,NDA,20154,20155,20156,"Tablet, Chewable",Oral,Solution,Oral,Solution,Oral,4/2/1991,10/9/1991,1991,adult and pediatric patients over six months of age with advanced HIV infection who are intolerant of zidovudine [AZT] therapy or who have demonstrated significant clinical or immunologic deterioration during zidovudine therapy,NA,Priority,No,N/A,N/A,N/A,N/A,N/A,N/A,NA,1991-04-02,1991-10-09,190,5.247024072160486,Pre-PDUFA
Nipent,pentostatin,Parke-Davis,NDA,20122,NA,NA,Injectable,Injection,NA,NA,NA,NA,2/11/1991,10/11/1991,1991,treatment for adult patients with alpha-interferon-refractory hairy cell leukemia,NA,Priority,Yes,N/A,N/A,N/A,N/A,N/A,N/A,NA,1991-02-11,1991-10-11,242,5.488937726156687,Pre-PDUFA
Aredia,pamidronate disodium,Ciba-Geigy,NDA,20036,NA,NA,Injectable,Injection,NA,NA,NA,NA,12/21/1989,10/31/1991,1991,treatment of hypercalcemia associate with malignancy,NA,Priority,No,N/A,N/A,N/A,N/A,N/A,N/A,NA,1989-12-21,1991-10-31,679,6.520621127558696,Pre-PDUFA
Pravachol,pravastatin sodium,Bristol-Myers Squibb,NDA,19898,NA,NA,Tablet,Oral,NA,NA,NA,NA,1/31/1989,10/31/1991,1991,as an adjunct to diet for the reduction of elevated total and LDL-cholesterol levels in patients with primary hypercholesterolemia (Type IIa and IIb) when the response to a diet restricted in saturated fat and cholesterol has not been adequate,NA,Standard,No,N/A,N/A,N/A,N/A,N/A,N/A,NA,1989-01-31,1991-10-31,1003,6.910750787961936,Pre-PDUFA
Ticlid,ticlopidine hydrochloride,Syntex,NDA,19979,NA,NA,Tablet,Oral,NA,NA,NA,NA,11/15/1989,10/31/1991,1991,"indicated to reduce the risk of thrombotic stroke (fatal 
or nonfatal) in patients who have experienced stroke precursors,
and in patients who have had a completed thrombotic stroke",NA,Priority,No,N/A,N/A,N/A,N/A,N/A,N/A,NA,1989-11-15,1991-10-31,715,6.5722825426940075,Pre-PDUFA
Biaxin,clarithromycin,Abbott Laboratories,NDA,50662,NA,NA,Tablet,Oral,NA,NA,NA,NA,12/20/1989,10/31/1991,1991,indicated for the treatment of mild to moderate infections caused by susceptible strains of designated microorganisms in the conditions listed below:  pharyngitis/tonsillitis; sinusitis; acute bacterial exacerbations of chronic bronchitis; pneumonia; uncomplicated skin and skin structure infections,NA,Priority,No,N/A,N/A,N/A,N/A,N/A,N/A,NA,1989-12-20,1991-10-31,680,6.522092798170152,Pre-PDUFA
Zithromax,azithromycin,Pfizer,NDA,50670,NA,NA,Capsule,Oral,NA,NA,NA,NA,4/11/1990,11/1/1991,1991,"indicated for the treatment of individuals 16 years of age and older with mild to moderate infections caused by susceptible strains of designated microorganisms in the conditions listed below: acute bacterial exacerbations of chronic obstructive pulmonary disease; pneumonia; streptococcal pharyngitis/tonsillitis, as an alternative to first line therapy in individuals who cannot use first line therapy; uncomplicated skin and skin structure infections; non-gonococal urethritis and cervicitis",NA,Priority,No,N/A,N/A,N/A,N/A,N/A,N/A,NA,1990-04-11,1991-11-01,569,6.343880434126331,Pre-PDUFA
Accupril,quinapril hydrochloride,Parke-Davis,NDA,19885,NA,NA,Tablet,Oral,NA,NA,NA,NA,1/26/1989,11/19/1991,1991,treatment of hypertension,NA,Standard,No,N/A,N/A,N/A,N/A,N/A,N/A,NA,1989-01-26,1991-11-19,1027,6.934397209928558,Pre-PDUFA
Romazicon,flumazenil,Roche,NDA,20073,NA,NA,Injectable,Injection,NA,NA,NA,NA,12/10/1990,12/20/1991,1991,"the complete or partial reversal of the sedative effects of benzodiazepines in cases where general anesthesia has been induced and/or maintained with benzodiazepines, where sedation has been produced with benzodiazepines for diagnostic and therapeutic procedures, and for the management of benzodiazepine overdose",NA,Priority,No,N/A,N/A,N/A,N/A,N/A,N/A,NA,1990-12-10,1991-12-20,375,5.926926025970411,Pre-PDUFA
Zocor,simvastatin,Merck Sharp & Dohme,NDA,19766,NA,NA,Tablet,Oral,NA,NA,NA,NA,10/16/1987,12/23/1991,1991,as an adjunct to diet for the reduction of elevated total and LDL cholesterol levels in patients with primary hypercholesterolemia (Types IIa and IIb) when the response to a diet restricted in saturated fat and cholesterol and other nonpharmacological measures alone has not been adequate,NA,Standard,No,N/A,N/A,N/A,N/A,N/A,N/A,NA,1987-10-16,1991-12-23,1529,7.332369205929062,Pre-PDUFA
Cefzil,cefprozil,Bristol-Myers Squibb,NDA,50664,50665,NA,Tablet,Oral,Suspension,Oral,NA,NA,3/30/1990,12/23/1991,1991,indicated for the treatment of patients with mild to moderate infections caused by susceptible strains of designated microorganisms in the conditions listed below: pharyngitis/tonsillitis; otitis media; secondary bacterial infection of acute bronchitis and acute bacterial exacerbations of chronic bronchitis; uncomplicated skin and skin structure infections,NA,Standard,No,N/A,N/A,N/A,N/A,N/A,N/A,NA,1990-03-30,1991-12-23,633,6.450470422144176,Pre-PDUFA
Supprelin,histrelin acetate,Johnson & Johnson,NDA,19836,NA,NA,Injectable,Injection,NA,NA,NA,NA,5/22/1989,12/24/1991,1991,treatment of central precocious puberty,NA,Priority,Yes,N/A,N/A,N/A,N/A,N/A,N/A,NA,1989-05-22,1991-12-24,946,6.852242569051878,Pre-PDUFA
Relafen,nabumetone,SmithKline Beecham,NDA,19583,NA,NA,Tablet,Oral,NA,NA,NA,NA,2/10/1986,12/24/1991,1991,acute and chronic treatment of signs and symptoms of osteoarthritis and rheumatoid arthritis,NA,Standard,No,N/A,N/A,N/A,N/A,N/A,N/A,NA,1986-02-10,1991-12-24,2143,7.669961995473577,Pre-PDUFA
Ismo,isosorbide mononitrate,Wyeth,NDA,19091,NA,NA,Tablet,Oral,NA,NA,NA,NA,12/30/1983,12/30/1991,1991,prevention and control of stable angina pectoris due to coronary artery disease,NA,Standard,No,N/A,N/A,N/A,N/A,N/A,N/A,NA,1983-12-30,1991-12-30,2922,7.980023592310645,Pre-PDUFA
Zoloft,sertraline hydrochloride,Pfizer,NDA,19839,NA,NA,Tablet,Oral,NA,NA,NA,NA,4/13/1988,12/30/1991,1991,treatment of depression,NA,Standard,No,N/A,N/A,N/A,N/A,N/A,N/A,NA,1988-04-13,1991-12-30,1356,7.212294468500341,Pre-PDUFA
Lorabid,loracarbef,Eli Lilly,NDA,50667,50668,NA,For Suspension,Oral,Capsule,Oral,NA,NA,8/27/1990,12/31/1991,1991,indicated for the treatment of patients with mild to moderate infections caused by susceptible strains of designated microorganisms in the conditions listed: Secondary Bacterial Infection of Acute Bronchitis; Acute Bacterial Exacerbations of Chronic Bronchitis; Pneumonia; Acute Otitis Media; Acute Maxillary Sinusitis; Pharyngitis and Tonsillitis; Uncomplicated Skin and Skin Structure Infections; Uncomplicated Urinary Tract Infections; Uncomplicated Pyelonephritis,NA,Standard,No,N/A,N/A,N/A,N/A,N/A,N/A,NA,1990-08-27,1991-12-31,491,6.19644412779452,Pre-PDUFA
Penetrex,enoxacin,Warner-Lambert,NDA,19616,NA,NA,Tablet,Oral,NA,NA,NA,NA,10/24/1986,12/31/1991,1991,"indicated for the treatment of infections caused by susceptible strains of designated microorganisms in the infections listed: urinary tract infections (uncomplicated and complicated), uncomplicated urethritis or endocervicitis due to susceptible strains of Neisseria gonorrhoea, including non-penicillinase- and penicillinase-producing strains",NA,Standard,No,N/A,N/A,N/A,N/A,N/A,N/A,NA,1986-10-24,1991-12-31,1894,7.546446273746024,Pre-PDUFA
Mivacron,mivacurium chloride,Burroughs Wellcome,NDA,20098,NA,NA,Solution,Intravenous,NA,NA,NA,NA,8/30/1990,1/22/1992,1992,"for inpatients and outpatients, as an adjunct to general anesthesia, to facilitate tracheal intubation and to provide skeletal muscle relaxation during surgery or mechanical ventilation",NA,Priority,No,N/A,N/A,N/A,N/A,N/A,N/A,NA,1990-08-30,1992-01-22,510,6.234410725718371,Pre-PDUFA
Omniflox,temafloxacin hydrochloride,Abbott Laboratories,NDA,20043,NA,NA,Tablet,Oral,NA,NA,NA,NA,11/30/1989,1/30/1992,1992,"treatment of adults with mild to moderate infections caused by susceptible strains of designated microorganisms in the conditions listed: Lower Respiratory Tract Infections (acute bacterial exacerbation of chronic bronchitis and pneumonia), uncomplicated skin and skin structure infections, prostatitis, uncomplicated and complicated urinary tract infections",NA,Standard,No,N/A,N/A,N/A,N/A,N/A,N/A,NA,1989-11-30,1992-01-30,791,6.673297967767654,Pre-PDUFA
Maxaquin,lomefloxacin hydrochloride,Searle,NDA,20013,NA,NA,Tablet,Oral,NA,NA,NA,NA,7/31/1990,2/21/1992,1992,indicated  for  the  treatment  of  adults  with  mild  to moderate  infections  caused  by  susceptible  strains  of  the  designated  microorganisms  in  the  conditions listed: complicated and uncomplicated urinary tract infections; acute bacterial exacerbations of chronic bronchitis; indicated pre-operatively to reduce the incidence of urinary tract infections in the early postoperative period in patients undergoing transurethral surgical procedures,NA,Standard,No,N/A,N/A,N/A,N/A,N/A,N/A,NA,1990-07-31,1992-02-21,570,6.345636360828596,Pre-PDUFA
Proleukin,aldesleukin,Chiron,BLA,103293,NA,NA,Injectable,Injection,NA,NA,NA,NA,12/1/1988,5/5/1992,1992,treatment of adults (>18 years old) with metastatic renal cell carcinoma,NA,Standard,Yes,No,N/A,N/A,N/A,N/A,N/A,NA,1988-12-01,1992-05-05,1251,7.1316985104669115,Pre-PDUFA
Proscar,finasteride,Merck Sharp & Dohme,NDA,20180,NA,NA,Tablet,Oral,NA,NA,NA,NA,4/15/1991,6/19/1992,1992,treatment of symptomatic benign prostatic hyperplasia,NA,Priority,No,No,N/A,N/A,N/A,N/A,N/A,NA,1991-04-15,1992-06-19,431,6.066108090103747,Pre-PDUFA
Hivid,zalcitabine,Roche,NDA,20199,NA,NA,Tablet,Oral,NA,NA,NA,NA,10/31/1991,6/19/1992,1992,indicated for the treatment of adult patients with advanced HIV infection who have demonstrated significant clinical or immunological deterioration,NA,Priority,Yes,Yes,N/A,N/A,N/A,N/A,N/A,NA,1991-10-31,1992-06-19,232,5.44673737166631,Pre-PDUFA
Vumon,teniposide,Bristol-Myers Squibb,NDA,20119,NA,NA,Injectable,Injection,NA,NA,NA,NA,9/28/1990,7/14/1992,1992,indicated for induction therapy in patients with refractory childhood acute lymphoblastic leukemia,NA,Priority,Yes,No,N/A,N/A,N/A,N/A,N/A,NA,1990-09-28,1992-07-14,655,6.484635235635252,Pre-PDUFA
Halfan,halofantrine hydrochloride,SmithKline Beecham,NDA,20250,NA,NA,Tablet,Oral,NA,NA,NA,NA,1/7/1992,7/24/1992,1992,treatment of adults who can tolerate oral medication and who have mild to moderate malaria caused by Plasmodium falciparum or Plasmodium vivax,NA,Priority,Yes,No,N/A,N/A,N/A,N/A,N/A,NA,1992-01-07,1992-07-24,199,5.293304824724492,Pre-PDUFA
Norvasc,amlodipine besylate,Pfizer,NDA,19787,NA,NA,Tablet,Oral,NA,NA,NA,NA,12/23/1987,7/31/1992,1992,"treatment of hypertension, alone or in combination with other antihypertensive agents, treatment of chronic stable angina alone or in combination with other antianginal agents, treatment of confirmed or suspected vasospastic angina, as monotherapy or in combination with other antianginal drugs",NA,Standard,No,No,N/A,N/A,N/A,N/A,N/A,NA,1987-12-23,1992-07-31,1682,7.427738840532894,Pre-PDUFA
Zebeta,bisoprolol fumarate,Lederle,NDA,19982,NA,NA,Tablet,Oral,NA,NA,NA,NA,8/1/1989,7/31/1992,1992,management of hypertension,NA,Standard,No,No,N/A,N/A,N/A,N/A,N/A,NA,1989-08-01,1992-07-31,1095,6.9985096422506015,Pre-PDUFA
Vantin,cefpodoxime proxetil,Upjohn,NDA,50674,50675,NA,Tablet,Oral,Suspension,Oral,NA,NA,3/29/1991,8/7/1992,1992,"treatment of patients with mild to moderate infections caused by susceptible strains of designated microorganisms in the conditions listed:  Acute, community-acquired pneumonia; acute, uncomplicated urethral and cervical gonorrhea; acute, uncomplicated ano-rectal infections in women due to Neisseria gonorrhoeae; uncomplicated skin and skin structure infections; acute otitis media; pharyngitis/tonsillitis; uncomplicated urinary tract infections",NA,Standard,No,No,N/A,N/A,N/A,N/A,N/A,NA,1991-03-29,1992-08-07,497,6.208590026096629,Pre-PDUFA
Actinex,masoprocol,Block,NDA,19940,NA,NA,Cream,Topical,NA,NA,NA,NA,4/10/1989,9/4/1992,1992,topical treatment of actinic (solar) keratoses,NA,Standard,No,No,N/A,N/A,N/A,N/A,N/A,NA,1989-04-10,1992-09-04,1243,7.1252830915107115,Pre-PDUFA
Sporanox,itraconazole,Janssen,NDA,20083,NA,NA,Capsule,Oral,NA,NA,NA,NA,5/31/1990,9/11/1992,1992,"treatment of the following fungal infections in immunocompromised and non-immunocompromised patients: blastomycosis, pulmonary and extrapulmonary; histoplasmosis, including chronic cavitary pulmonary disease and disseminated, non-meningeal histoplasmosis",NA,Priority,No,No,N/A,N/A,N/A,N/A,N/A,NA,1990-05-31,1992-09-11,834,6.726233402358747,Pre-PDUFA
Suprane,desflurane,Anaquest,NDA,20118,NA,NA,Liquid,Inhalation,NA,NA,NA,NA,1/30/1991,9/18/1992,1992,indicated as an inhalation agent for induction and/or maintenance of anesthesia for inpatient and outpatient surgery in adults,NA,Standard,No,No,N/A,N/A,N/A,N/A,N/A,NA,1991-01-30,1992-09-18,597,6.391917113392602,Pre-PDUFA
Betapace,sotalol hydrochloride,Bristol-Myers Squibb,NDA,19865,NA,NA,Tablet,Oral,NA,NA,NA,NA,6/30/1988,10/30/1992,1992,"treatment of documented ventricular arrhythmias, such as sustained ventricular tachycardia, that in the judgment of the physician are life-threatening",NA,Priority,Yes,No,N/A,N/A,N/A,N/A,N/A,NA,1988-06-30,1992-10-30,1583,7.367077059881012,Pre-PDUFA
ProHance,gadoteridol,Squibb,NDA,20131,NA,NA,Injectable,Injection,NA,NA,NA,NA,1/23/1991,11/16/1992,1992,"provides contrast enhancement of the brain, spine, and surrounding tissues resulting in improved visualization of lesions with abnormal vascularity or those thought to cause a disruption of the normal blood-brain barrier",NA,Standard,No,No,N/A,N/A,N/A,N/A,N/A,NA,1991-01-23,1992-11-16,663,6.4967749901858625,Pre-PDUFA
Mepron,atovaquone,Burroughs Wellcome,NDA,20259,NA,NA,Tablet,Oral,NA,NA,NA,NA,4/24/1992,11/25/1992,1992,treatment of mild to moderate Pneumocystis carinii pneumonia in patients who are intolerant to trimethoprim-sulfamethoxazole,NA,Priority,Yes,No,N/A,N/A,N/A,N/A,N/A,NA,1992-04-24,1992-11-25,215,5.3706380281276624,Pre-PDUFA
Desogen,"desogestrel, ethinyl estradiol",Organon,NDA,20071,NA,NA,Tablet,Oral,NA,NA,NA,NA,12/31/1990,12/10/1992,1992,prevention of pregnancy in women who elect to use oral contraceptives as a method of contraception,NA,Standard,No,No,N/A,N/A,N/A,N/A,N/A,NA,1990-12-31,1992-12-10,710,6.565264970035361,Pre-PDUFA
Ambien,zolpidem tartrate,Lorex,NDA,19908,NA,NA,Tablet,Oral,NA,NA,NA,NA,1/30/1989,12/16/1992,1992,short-term treatment of insomnia,NA,Standard,No,No,N/A,N/A,N/A,N/A,N/A,NA,1989-01-30,1992-12-16,1416,7.255591274253665,Pre-PDUFA
Mycobutin,rifabutin,Adria,NDA,50689,NA,NA,Capsule,Oral,NA,NA,NA,NA,1/17/1992,12/23/1992,1992,prevention of disseminated Mycobacterium avium complex (MAC) disease in patients with advanced HIV infection,NA,Priority,Yes,No,N/A,N/A,N/A,N/A,N/A,NA,1992-01-17,1992-12-23,341,5.831882477283517,Pre-PDUFA
Imitrex,sumatriptan succinate,Glaxo,NDA,20080,NA,NA,Injectable,Subcutaneous,NA,NA,NA,NA,7/2/1990,12/28/1992,1992,acute treatment of migraine attacks with or without aura,NA,Priority,No,No,N/A,N/A,N/A,N/A,N/A,NA,1990-07-02,1992-12-28,910,6.813444599510896,Pre-PDUFA
Indiclor,indium In 111 chloride,Amersham,NDA,19862,NA,NA,Injectable,Injection,NA,NA,NA,NA,5/2/1988,12/29/1992,1992,indicated for radiolabeling of monoclonal antibodies in preparations used for in vivo diagnostic imaging procedures,NA,Standard,No,No,N/A,N/A,N/A,N/A,N/A,NA,1988-05-02,1992-12-29,1702,7.43955930913332,Pre-PDUFA
Taxol,paclitaxel,Bristol-Myers Squibb,NDA,20262,NA,NA,Injectable,Injection,NA,NA,NA,NA,7/22/1992,12/29/1992,1992,treatment of patients with metastatic carcinoma of the ovary after failure of first-line or subsequent chemotherapy,NA,Priority,No,No,N/A,N/A,N/A,N/A,N/A,NA,1992-07-22,1992-12-29,160,5.075173815233827,Pre-PDUFA
OncoScint,satumomab pendetide,Cytogen,BLA,103336,NA,NA,Injectable,Injection,NA,NA,NA,NA,9/28/1989,12/29/1992,1992,"indicated for determining the extent and location of extrahepatic malignant disease in the following:
[A] in patients with known colorectal cancer 
[B] in patients with known ovarian cancer",NA,Standard,Yes (indication [B] only),No,N/A,N/A,N/A,N/A,N/A,Biologic product assigned new license number and now referenced by BLA 103673,1989-09-28,1992-12-29,1188,7.080026499922591,Pre-PDUFA
Paxil,paroxetine hydrochloride,SmithKline Beecham,NDA,20031,NA,NA,Tablet,Oral,NA,NA,NA,NA,11/21/1989,12/29/1992,1992,treatment of depression,NA,Standard,No,No,N/A,N/A,N/A,N/A,N/A,NA,1989-11-21,1992-12-29,1134,7.033506484287697,Pre-PDUFA
Tilade,nedocromil sodium,Fisons,NDA,19660,NA,NA,"Aerosol, Metered",Inhalation,NA,NA,NA,NA,3/3/1987,12/30/1992,1992,indicated for maintenance therapy in the management of patients with mild to moderate bronchial asthma,NA,Standard,No,No,N/A,N/A,N/A,N/A,N/A,NA,1987-03-03,1992-12-30,2129,7.663407664893479,Pre-PDUFA
Lamisil,terbinafine hydrochloride,Sandoz,NDA,20192,NA,NA,Cream,Topical,NA,NA,NA,NA,7/3/1991,12/30/1992,1992,"treatment of the following dermatologic infections: interdigital tinea pedis, tinea cruris, or tinea corporis due to Epidermophyton floccosum, Trichophyton mentagrophytes, or Trichophyton rubrum",NA,Standard,No,No,N/A,N/A,N/A,N/A,N/A,NA,1991-07-03,1992-12-30,546,6.302618975744905,Pre-PDUFA
Manoplax,flosequinan,Boots,NDA,19960,NA,NA,Tablet,Oral,NA,NA,NA,NA,10/1/1990,12/30/1992,1992,management of congestive heart failure in patients not responding adequately to diuretics,NA,Standard,No,No,N/A,N/A,N/A,N/A,N/A,NA,1990-10-01,1992-12-30,821,6.710523109452428,Pre-PDUFA
Omniscan,gadodiamide,Sterling-Winthrop,NDA,20123,NA,NA,Injectable,Injection,NA,NA,NA,NA,10/12/1990,1/8/1993,1993,intravenous administration with magnetic resonance imaging in adult patients to provide contrast enhancement in those central nervous system lesions with abnormal vascularity or those thought to cause abnormalities in the blood brain barrier,NA,Standard,No,No,N/A,N/A,N/A,N/A,N/A,NA,1990-10-12,1993-01-08,819,6.70808408385307,Early-PDUFA
Leustatin,cladribine,Johnson & Johnson,NDA,20229,NA,NA,Injectable,Injection,NA,NA,NA,NA,12/31/1991,2/26/1993,1993,treatment of active hairy cell leukemia,NA,Priority,Yes,No,N/A,N/A,N/A,N/A,N/A,NA,1991-12-31,1993-02-26,423,6.0473721790462776,Early-PDUFA
Lovenox,enoxaparin sodium,Rhone-Poulenc Rorer,NDA,20164,NA,NA,Injectable,Subcutaneous,NA,NA,NA,NA,12/31/1991,3/29/1993,1993,"prevention of deep vein thrombosis (DVT), which may lead to pulmonary embolism, following hip replacement surgery",NA,Priority,No,No,N/A,N/A,N/A,N/A,N/A,NA,1991-12-31,1993-03-29,454,6.118097198041348,Early-PDUFA
Claritin,loratadine,Schering,NDA,19658,NA,NA,Tablet,Oral,NA,NA,NA,NA,10/31/1986,4/12/1993,1993,for the relief of nasal and non-nasal symptoms of seasonal allergic rhinitis,NA,Standard,No,No,N/A,N/A,N/A,N/A,N/A,NA,1986-10-31,1993-04-12,2355,7.764296006450518,Early-PDUFA
Metastron,strontium 89 chloride,Medi Physics,NDA,20134,NA,NA,Injectable,Injection,NA,NA,NA,NA,10/2/1992,6/18/1993,1993,for the relief of bone pain in patients with painful skeletal metastases,NA,Priority,No,No,N/A,N/A,N/A,N/A,N/A,NA,1992-10-02,1993-06-18,259,5.556828061699537,Early-PDUFA
Orlaam,levomethadyl acetate hydrochloride,Biometric Res,NDA,20315,NA,NA,Concentrate,Oral,NA,NA,NA,NA,6/21/1993,7/9/1993,1993,indicated for the management of opiate dependence,NA,Priority,Yes,No,N/A,N/A,N/A,N/A,N/A,NA,1993-06-21,1993-07-09,18,2.8903717578961645,Early-PDUFA
Betaseron,interferon beta-1b,Chiron,BLA,103471,NA,NA,Injectable,Injection,NA,NA,NA,NA,6/18/1992,7/23/1993,1993,for use in ambulatory patients with relapse-remitting multiple sclerosis (MS) to reduce the frequency of clinical exacerbations,NA,Priority,Yes,Yes,N/A,N/A,N/A,N/A,N/A,NA,1992-06-18,1993-07-23,400,5.991464547107982,Early-PDUFA
Felbatol,felbamate,Wallace,NDA,20189,NA,NA,Suspension,Oral,NA,NA,NA,NA,9/30/1991,7/29/1993,1993,"[A] as monotherapy and adjunctive therapy in the treatment of partial seizures with and without generalization in adults with epilepsy
[B] as adjunctive therapy in the treatment of partial and generalized seizures associated with the Lennox-Gastaut syndrome in children",NA,Priority,Yes (indication [B] only),No,N/A,N/A,N/A,N/A,N/A,NA,1991-09-30,1993-07-29,668,6.504288173536645,Early-PDUFA
Propulsid,cisapride monohydrate,Janssen,NDA,20210,NA,NA,Tablet,Oral,NA,NA,NA,NA,8/29/1991,7/29/1993,1993,symptomatic treatment of patients with nocturnal heartburn due to gastroesophageal reflux disease,NA,Standard,No,No,N/A,N/A,N/A,N/A,N/A,NA,1991-08-29,1993-07-29,700,6.551080335043404,Early-PDUFA
Imagent GI,perflubron,Alliance,NDA,20091,NA,NA,Liquid,Oral,NA,NA,NA,NA,10/25/1990,8/13/1993,1993,Indicated for use with magnetic resonance imaging to enhance the delineation of the bowel in order to distinguish it from adjacent organs and areas of suspected pathology,NA,Priority,No,No,N/A,N/A,N/A,N/A,N/A,NA,1990-10-25,1993-08-13,1023,6.930494765951626,Early-PDUFA
Demadex,torsemide,Boehringer Mannheim,NDA,20136,20137,NA,Tablet,Oral,Injectable,Injection,NA,NA,2/28/1991,8/23/1993,1993,"treatment of edema associated with congestive heart failure (CHF), renal disease, or hepatic disease; treatment of hypertension",NA,Standard,No,No,N/A,N/A,N/A,N/A,N/A,NA,1991-02-28,1993-08-23,907,6.810142450115136,Early-PDUFA
Cognex,tacrine hydrochloride,Parke-Davis,NDA,20070,NA,NA,Capsule,Oral,NA,NA,NA,NA,6/4/1990,9/9/1993,1993,treatment of mild to moderate dementia of the Alzheimer's type,NA,Priority,No,No,N/A,N/A,N/A,N/A,N/A,NA,1990-06-04,1993-09-09,1193,7.084226422097916,Early-PDUFA
Flumadine,rimantadine hydrochloride,Forest,NDA,19649,19650,NA,Tablet,Oral,Syrup,Oral,NA,NA,11/14/1986,9/17/1993,1993,prophylaxis and treatment of illness caused by various strains of influenza A virus in adults; indicated for prophylaxis against influenza A virus in children,NA,Priority,No,No,N/A,N/A,N/A,N/A,N/A,NA,1986-11-14,1993-09-17,2499,7.823645930834952,Early-PDUFA
Alomide,lodoxamide tromethamine,Alcon,NDA,20191,NA,NA,Solution/Drops,Ophthalmic,NA,NA,NA,NA,6/10/1991,9/23/1993,1993,"treatment of the ocular disorders referred to by the terms vernal keratoconjunctivitis, vernal conjunctivitis, and vernal keratitis",NA,Standard,Yes,No,N/A,N/A,N/A,N/A,N/A,NA,1991-06-10,1993-09-23,836,6.728628613084702,Early-PDUFA
Zosyn,"tazobactam sodium, pipercillin sodium",Lederle,NDA,50684,NA,NA,Injectable,Injection,NA,NA,NA,NA,9/3/1991,10/22/1993,1993,"treatment of moderate to severe infections cased by piperacillin-resistant, piperacillin/tazobactam-susceptible, beta-lactamase producing strains of designated microorganisms in: appendicitis and peritonitis; uncomplicated and complicated skin and skin structures infections; postpartum endometritis or pelvic inflammatory disease; community-acquired pneumonia (moderate severity only)",NA,Standard,No,No,N/A,N/A,N/A,N/A,N/A,NA,1991-09-03,1993-10-22,780,6.659293919683638,Early-PDUFA
Livostin,levocabastine hydrochloride,Iolab,NDA,20219,NA,NA,Suspension/Drops,Ophthalmic,NA,NA,NA,NA,9/24/1991,11/10/1993,1993,temporary relief of the signs and symptoms of seasonal allergic conjunctivitis,NA,Priority,No,No,N/A,N/A,N/A,N/A,N/A,NA,1991-09-24,1993-11-10,778,6.656726524178391,Early-PDUFA
Neutrexin,trimetrexate glucuronate,US BioScience,NDA,20326,NA,NA,Injectable,Injection,NA,NA,NA,NA,2/1/1993,12/17/1993,1993,"for use with concurrent leucovorin administration is indicated as an alternative therapy for the treatment of moderate-to-severe Pneumocystis carnii pneumonia (PCP) in immunocompromised patients, including patients with acquired immunodeficiency syndrome (AIDS), who are intolerant of, or are refractory to, trimethoprim-sulfamethoxazole (TMP/SMX) therapy or for whom TMP/SMX is contraindicated",NA,Priority,Yes,No,N/A,N/A,N/A,N/A,N/A,NA,1993-02-01,1993-12-17,319,5.765191102784844,Early-PDUFA
Effexor,venlafaxine hydrochloride,Wyeth-Ayerst,NDA,20151,NA,NA,Tablet,Oral,NA,NA,NA,NA,4/26/1991,12/28/1993,1993,treatment of depression,NA,Standard,No,No,N/A,N/A,N/A,N/A,N/A,NA,1991-04-26,1993-12-28,977,6.884486652042782,Early-PDUFA
Kytril,granisetron hydrochloride,SmithKline Beecham,NDA,20239,NA,NA,Injectable,Injection,NA,NA,NA,NA,4/14/1992,12/29/1993,1993,"prevention of nausea and/or vomiting associated with initial and repeat courses of emetogenic cancer therapy, including high-dose cisplatin",NA,Standard,No,No,N/A,N/A,N/A,N/A,N/A,NA,1992-04-14,1993-12-29,624,6.436150368369428,Early-PDUFA
Trasylol,aprotinin,Miles,BLA,20304,NA,NA,Injectable,Injection,NA,NA,NA,NA,11/24/1992,12/29/1993,1993,"prophylactic use to reduce perioperative blood loss and the homologous blood transfusion requirement in patients undergoing cardiopulmonary bypass surgery in the course of repeat coronary artery bypass graft surgery, and in selected cases
of primary coronary artery bypass graft surgery where the risk of bleeding is especially high (impaired hemostasis) or where transfusion is unavailable or unacceptable",NA,Priority,Yes,No,N/A,N/A,N/A,N/A,N/A,Transition Product from NDA to BLA due to BPCI : Please see page 2 of data dictionary for more information.,1992-11-24,1993-12-29,400,5.991464547107982,Early-PDUFA
Dovonex,calcipotriene,Bristol-Myers,NDA,20273,NA,NA,Ointment,Topical,NA,NA,NA,NA,3/31/1992,12/29/1993,1993,treatment of moderate plaque psoriasis,NA,Standard,No,No,N/A,N/A,N/A,N/A,N/A,NA,1992-03-31,1993-12-29,638,6.45833828334479,Early-PDUFA
Risperdal,risperidone,Janssen,NDA,20272,NA,NA,Tablet,Oral,NA,NA,NA,NA,4/15/1992,12/29/1993,1993,management of the manifestations of psychotic disorders,NA,Priority,No,No,N/A,N/A,N/A,N/A,N/A,NA,1992-04-15,1993-12-29,623,6.434546518787453,Early-PDUFA
Pulmozyme,dornase alfa,Genentech,BLA,103532,NA,NA,"Aerosol, Metered",Inhalation,NA,NA,NA,NA,3/29/1993,12/30/1993,1993,management of cystic fibrosis patients to reduce the frequency of respiratory infections requiring parenteral antibiotics and to improve pulmonary function,NA,Priority,Yes,No,N/A,N/A,N/A,N/A,N/A,NA,1993-03-29,1993-12-30,276,5.62040086571715,Early-PDUFA
Neurontin,gabapentin,Parke-Davis,NDA,20235,NA,NA,Capsule,Oral,NA,NA,NA,NA,1/31/1992,12/30/1993,1993,indicated as adjunctive therapy in the treatment of partial seizures with and without secondary generalization in adults with epilepsy,NA,Priority,No,No,N/A,N/A,N/A,N/A,N/A,NA,1992-01-31,1993-12-30,699,6.54965074223381,Early-PDUFA
Aceon,perindopril erbumine,RW Johnson Pharmaceutical Development,NDA,20184,NA,NA,Tablet,Oral,NA,NA,NA,NA,6/28/1991,12/30/1993,1993,treatment of patients with essential hypertension,NA,Standard,No,No,N/A,N/A,N/A,N/A,N/A,NA,1991-06-28,1993-12-30,916,6.82001636467413,Early-PDUFA
Lipidil,fenofibrate,Fournier,NDA,19304,NA,NA,Capsule,Oral,NA,NA,NA,NA,6/4/1984,12/31/1993,1993,adjunctive therapy to diet for treatment of adult patients with very high elevations of serum triglyceride levels (types IV and V hyperlipidemia) who are at risk of pancreatitis and who do not respond adequately to a determined dietary effort to control them,NA,Standard,No,No,N/A,N/A,N/A,N/A,N/A,NA,1984-06-04,1993-12-31,3497,8.159660737063376,Early-PDUFA
Lescol,fluvastatin sodium,Sandoz,NDA,20261,NA,NA,Capsule,Oral,NA,NA,NA,NA,3/31/1992,12/31/1993,1993,as an adjunct to diet in the treatment of elevated total cholesterol (total-C) and LDL-C levels in patients with primary hypercholesteremia (type IIa and IIb) whose response to dietary restriction of saturated fat and cholesterol and other non-pharmacological measures has not been adequate,NA,Standard,No,No,N/A,N/A,N/A,N/A,N/A,NA,1992-03-31,1993-12-31,640,6.461468176353717,Early-PDUFA
Oncaspar,pegaspargase,Enzon,BLA,103411,NA,NA,Injectable,Injection,NA,NA,NA,NA,1/15/1991,2/1/1994,1994,Treatment of acute lymphocytic leukemia (ALL) in patients who require L-asparaginase in their treatment regimen but have developed hypersensitivity to the native forms of L-asparaginase,NA,Standard,Yes,No,N/A,N/A,N/A,N/A,N/A,NA,1991-01-15,1994-02-01,1113,7.014814351275545,Early-PDUFA
Serevent,salmeterol xinafoate,Glaxo,NDA,20236,NA,NA,"Aerosol, Metered",Inhalation,NA,NA,NA,NA,12/20/1991,2/4/1994,1994,maintenance treatment of asthma and prevention of bronchospasm in patients 12 years old and above,NA,Priority,No,No,N/A,N/A,N/A,N/A,N/A,NA,1991-12-20,1994-02-04,777,6.655440350367647,Early-PDUFA
Rhinocort,budesonide,GH Besselaar,NDA,20233,NA,NA,"Aerosol, Metered",Nasal,NA,NA,NA,NA,12/31/1992,2/14/1994,1994,management of symptoms of seasonal or perennial allergic rhinitis in adults and children and nonallergic perennial rhinitis in adults,NA,Standard,No,No,N/A,N/A,N/A,N/A,N/A,NA,1992-12-31,1994-02-14,410,6.016157159698354,Early-PDUFA
Zemuron,rocuronium bromide,Organon,NDA,20214,NA,NA,Injectable,Injection,NA,NA,NA,NA,6/29/1993,3/17/1994,1994,"indicated for inpatients and outpatients as an adjunct to general anesthesia to facilitate both rapid sequence and routine tracheal intubation, and to provide skeletal muscle relaxation during surgery or mechanical ventilation",NA,Standard,No,No,N/A,N/A,N/A,N/A,N/A,NA,1993-06-29,1994-03-17,261,5.564520407322694,Early-PDUFA
Semprex-D,"acrivastine, pseudoephedrine hydrochloride",Burroughs Wellcome,NDA,19806,NA,NA,Capsule,Oral,NA,NA,NA,NA,12/29/1987,3/25/1994,1994,"indicated for relief of symptoms associated with seasonal allergic rhinitis such as sneezing, rhinorrhea, pruritus, lacrimation, and nasal congestion",NA,Standard,No,No,N/A,N/A,N/A,N/A,N/A,NA,1987-12-29,1994-03-25,2278,7.731053144007127,Early-PDUFA
[drug marketed without a proprietary name],iobenguane sulfate I 131,CIS US,NDA,20084,NA,NA,Injectable,Injection,NA,NA,NA,NA,11/15/1991,3/25/1994,1994,indicated as an adjunctive diagnostic agent in the localization of primary or metastatic pheochromocytomas and neuroblastomas,NA,Priority,No,No,N/A,N/A,N/A,N/A,N/A,NA,1991-11-15,1994-03-25,861,6.7580945044277305,Early-PDUFA
Prograf,tacrolimus,Fujisawa,NDA,50708,50709,NA,Capsule,Oral,Injectable,Injection,NA,NA,7/26/1993,4/8/1994,1994,indicated for the prophylaxis of organ rejection in patients receiving allogeneic liver transplants,NA,Priority,No,No,N/A,N/A,N/A,N/A,N/A,NA,1993-07-26,1994-04-08,256,5.545177444479562,Early-PDUFA
Cerezyme,imiglucerase,Genzyme,BLA,20367,NA,NA,Injectable,Injection,NA,NA,NA,NA,5/21/1993,5/23/1994,1994,"indicated for long-term enzyme replacement therapy for patients with a confirmed diagnosis of Type 1 Gaucher disease that results in one or more of the following conditions: anemia, thrombocytopenia, bone disease, hepatomegaly, or splenomegaly",NA,Priority,Yes,No,N/A,N/A,N/A,N/A,N/A,Transition Product from NDA to BLA due to BPCI : Please see page 2 of data dictionary for more information.,1993-05-21,1994-05-23,367,5.905361848054571,Early-PDUFA
Octreoscan,indium In 111 pentetreotide,Mallinckrodt Medical,NDA,20314,NA,NA,Injectable,Injection,NA,NA,NA,NA,10/23/1992,6/2/1994,1994,for the scintigraphic localization of primary and metastatic neuroendocrine tumors bearing somatostatin receptors,NA,Priority,No,No,N/A,N/A,N/A,N/A,N/A,NA,1992-10-23,1994-06-02,587,6.375024819828097,Early-PDUFA
Zerit,stavudine,Bristol-Myers Squibb,NDA,20412,NA,NA,Capsule,Oral,NA,NA,NA,NA,12/28/1993,6/24/1994,1994,indicated for the treatment of adults with advanced HIV infection who are intolerant of approved therapies with proven clinical benefit or who have experienced significant clinical or immunologic deterioration while receiving these therapies or for whom such therapies are contraindicated,NA,Priority,No,Yes,N/A,N/A,N/A,N/A,N/A,NA,1993-12-28,1994-06-24,178,5.181783550292085,Early-PDUFA
Famvir,famciclovir,SmithKline Beecham,NDA,20363,NA,NA,Tablet,Oral,NA,NA,NA,NA,6/30/1993,6/29/1994,1994,management of acute herpes zoster (shingles),NA,Standard,No,No,N/A,N/A,N/A,N/A,N/A,NA,1993-06-30,1994-06-29,364,5.8971538676367405,Early-PDUFA
Cystagon,cysteamine bitartrate,Mylan,NDA,20392,NA,NA,Capsule,Oral,NA,NA,NA,NA,11/23/1993,8/15/1994,1994,indicated for the management of nephropathic cystinosis in children and adults,NA,Priority,Yes,No,N/A,N/A,N/A,N/A,N/A,NA,1993-11-23,1994-08-15,265,5.579729825986222,Early-PDUFA
[drug marketed without a proprietary name],fludeoxyglucose F 18,Downstate Clinical Center,NDA,20306,NA,NA,Injectable,Injection,NA,NA,NA,NA,1/19/1993,8/19/1994,1994,indicated in positron emission tomography for the identification of regions of abnormal glucose metabolism associated with foci of epileptic seizures,NA,Priority,No,No,N/A,N/A,N/A,N/A,N/A,NA,1993-01-19,1994-08-19,577,6.3578422665081,Early-PDUFA
Neurolite,technetium Tc-99m bicisate,Dupont Merck,NDA,20256,NA,NA,Injectable,Injection,NA,NA,NA,NA,3/6/1992,11/23/1994,1994,indicated as an adjunct to conventional CT or MRI imaging in the localization of stroke in patients in whom stroke has already been diagnosed,NA,Standard,No,No,N/A,N/A,N/A,N/A,N/A,NA,1992-03-06,1994-11-23,992,6.899723107284872,Early-PDUFA
Luvox,fluvoxamine maleate,Solvay,NDA,20243,NA,NA,Tablet,Oral,NA,NA,NA,NA,12/30/1991,12/5/1994,1994,treatment of obsessions and compulsions in patients with obsessive-compulsive disorder,NA,Standard,No,No,N/A,N/A,N/A,N/A,N/A,NA,1991-12-30,1994-12-05,1071,6.976348070447749,Early-PDUFA
Trusopt,dorzolamide hydrochloride,Merck,NDA,20408,NA,NA,Solution/Drops,Ophthalmic,NA,NA,NA,NA,12/10/1993,12/9/1994,1994,treatment of elevated intraocular pressure in patients with ocular hypertension or open-angle glaucoma,NA,Priority,No,No,N/A,N/A,N/A,N/A,N/A,NA,1993-12-10,1994-12-09,364,5.8971538676367405,Early-PDUFA
Fragmin,dalteparin sodium,Pharmacia,NDA,20287,NA,NA,Injectable,Subcutaneous,NA,NA,NA,NA,12/30/1992,12/22/1994,1994,prophylaxis against deep vein thrombosis (DVT) which may lead to pulmonary embolism (PE) in patients undergoing abdominal surgery who are at risk for thromboembolic complications,NA,Standard,No,No,N/A,N/A,N/A,N/A,N/A,NA,1992-12-30,1994-12-22,722,6.582025138892826,Early-PDUFA
ReoPro,abciximab,Centocor,BLA,103575,NA,NA,Injectable,Injection,NA,NA,NA,NA,12/16/1993,12/22/1994,1994,indicated as an adjunct to percutaneous transluminal coronary angioplasty or atherectomy (PTCA) for the prevention of acute cardiac ischemic complications in patients at high risk for abrupt closure of the treated coronary vessel,NA,Priority,No,No,N/A,N/A,N/A,N/A,N/A,NA,1993-12-16,1994-12-22,371,5.916202062607435,Early-PDUFA
Serzone,nefazodone hydrochloride,Bristol-Myers,NDA,20152,NA,NA,Tablet,Oral,NA,NA,NA,NA,9/6/1991,12/22/1994,1994,treatment of depression,NA,Standard,No,No,N/A,N/A,N/A,N/A,N/A,NA,1991-09-06,1994-12-22,1203,7.0925737159746784,Early-PDUFA
Navelbine,vinorelbine tartrate,Burroughs Wellcome,NDA,20388,NA,NA,Injectable,Injection,NA,NA,NA,NA,8/27/1993,12/23/1994,1994,"as a single agent or in combination with cisplatin for the first-line treatment of ambulatory patients with unresectable, advanced non-small cell lung cancer (NSCLC)",NA,Priority,No,No,N/A,N/A,N/A,N/A,N/A,NA,1993-08-27,1994-12-23,483,6.180016653652572,Early-PDUFA
Lamictal,lamotrigine,Burroughs Wellcome,NDA,20241,NA,NA,Tablet,Oral,NA,NA,NA,NA,3/23/1992,12/27/1994,1994,indicated as adjunctive therapy in the treatment of partial seizures in adults with epilepsy,NA,Priority,No,No,N/A,N/A,N/A,N/A,N/A,NA,1992-03-23,1994-12-27,1009,6.9167150203536085,Early-PDUFA
Renormax,spirapril hydrochloride,Sandoz,NDA,20240,NA,NA,Tablet,Oral,NA,NA,NA,NA,12/31/1991,12/29/1994,1994,treatment of hypertension,NA,Standard,No,No,N/A,N/A,N/A,N/A,N/A,NA,1991-12-31,1994-12-29,1094,6.9975959829819265,Early-PDUFA
Vexol,rimexalone,Alcon,NDA,20474,NA,NA,Suspension/Drops,Ophthalmic,NA,NA,NA,NA,6/1/1994,12/30/1994,1994,treatment of postoperative inflammation following ocular surgery and in the treatment of anterior uveitis,NA,Priority,No,No,N/A,N/A,N/A,N/A,N/A,NA,1994-06-01,1994-12-30,212,5.356586274672012,Early-PDUFA
Sular,nisoldipine,Miles,NDA,20356,NA,NA,"Tablet, Extended Release",Oral,NA,NA,NA,NA,4/1/1993,2/2/1995,1995,treatment of hypertension,NA,Standard,No,No,N/A,N/A,N/A,N/A,N/A,NA,1993-04-01,1995-02-02,672,6.5102583405231496,Early-PDUFA
Ultram,tramadol hydrochloride,RW Johnson,NDA,20281,NA,NA,Tablet,Oral,NA,NA,NA,NA,11/18/1993,3/3/1995,1995,management of moderate to moderately severe pain,NA,Standard,No,No,N/A,N/A,N/A,N/A,N/A,NA,1993-11-18,1995-03-03,470,6.152732694704104,Early-PDUFA
Glucophage,metformin hydrochloride,Lipha,NDA,20357,NA,NA,Tablet,Oral,NA,NA,NA,NA,9/29/1993,3/3/1995,1995,indicated as an adjunct to diet to lower blood glucose in patients with non-insulin-dependent diabetes mellitus whose hyperglycemia cannot be satisfactorily managed on diet alone,NA,Priority,No,No,N/A,N/A,N/A,N/A,N/A,NA,1993-09-29,1995-03-03,520,6.253828811575473,Early-PDUFA
Cozaar,losartan potassium,Merck,NDA,20386,NA,NA,Tablet,Oral,NA,NA,NA,NA,12/3/1993,4/14/1995,1995,treatment of hypertension,NA,Standard,No,No,N/A,N/A,N/A,N/A,N/A,NA,1993-12-03,1995-04-14,497,6.208590026096629,Early-PDUFA
Revex,nalmefene hydrochloride,Ohmeda,NDA,20459,NA,NA,Injectable,Injection,NA,NA,NA,NA,4/29/1994,4/17/1995,1995,"indicated for the complete or partial reversal of opioid drug effects, including respiratory depression, induced by either natural or synthetic opioids, and in the management of known or suspected opioid overdose",NA,Standard,No,No,N/A,N/A,N/A,N/A,N/A,NA,1994-04-29,1995-04-17,353,5.8664680569332965,Early-PDUFA
Univasc,moexipril hydrochloride,Schwarz Pharma,NDA,20312,NA,NA,Tablet,Oral,NA,NA,NA,NA,12/18/1992,4/19/1995,1995,treatment of hypertension,NA,Standard,No,No,N/A,N/A,N/A,N/A,N/A,NA,1992-12-18,1995-04-19,852,6.747586526829315,Early-PDUFA
Cellcept,mycophenolate mofetil,Syntex,NDA,50722,NA,NA,Capsule,Oral,NA,NA,NA,NA,11/10/1994,5/3/1995,1995,prophylaxis of organ rejection in patients receiving allogeneic renal transplants,NA,Priority,No,No,N/A,N/A,N/A,N/A,N/A,NA,1994-11-10,1995-05-03,174,5.159055299214529,Early-PDUFA
Prevacid,lansoprazole,TAP Holdings,NDA,20406,NA,NA,"Capsule, Delayed Release Pellets",Oral,NA,NA,NA,NA,11/15/1993,5/10/1995,1995,short-term treatment (up to four weeks) for healing and symptom relief of active duodenal ulcer; short-term treatment (up to eight weeks) for healing and symptom relief of all grades of erosive esophagitis; long-term treatment of pathological hypersecretory conditions including Zollinger-Ellison syndrome,NA,Standard,No,No,N/A,N/A,N/A,N/A,N/A,NA,1993-11-15,1995-05-10,541,6.293419278846481,Early-PDUFA
Ultravist,iopromide,Berlex Laboratories,NDA,20220,NA,NA,Injectable,Injection,NA,NA,NA,NA,3/2/1992,5/10/1995,1995,"intra-arterial Ultravist is indicated for intra-arterial digital subtraction angiography, cerebral arteriography, and peripheral arteriography, and coronary arteriography and left ventriculography, visceral angiography, and aortography; intravenous Ultravist is indicated for peripheral venography and for contrast enhanced computed tomographic (CECT) imaging of the head and body, and excretory urography",NA,Standard,No,No,N/A,N/A,N/A,N/A,N/A,NA,1992-03-02,1995-05-10,1164,7.059617628291383,Early-PDUFA
Zinecard,dexrazoxane,Pharmacia,NDA,20212,NA,NA,Injectable,Injection,NA,NA,NA,NA,2/10/1992,5/26/1995,1995,"for reducing the incidence and severity of cardiomyopathy associated with doxorubicin administration in women with metastatic breast cancer who have received a cumulative dose of 300 mg/m2 and who, in their physician's opinion, would benefit from continuing therapy with doxorubicin",NA,Priority,Yes,Yes,N/A,N/A,N/A,N/A,N/A,NA,1992-02-10,1995-05-26,1201,7.0909098220799835,Early-PDUFA
Ultane,sevoflurane,Abbott Laboratories,NDA,20478,NA,NA,Liquid,Inhalation,NA,NA,NA,NA,7/11/1994,6/7/1995,1995,induction and maintenance of general anesthesia in adult and pediatric patients for inpatient and outpatient surgery,NA,Standard,No,No,N/A,N/A,N/A,N/A,N/A,NA,1994-07-11,1995-06-07,331,5.802118375377063,Early-PDUFA
Dynabac,dirithromycin,Lilly,NDA,50678,NA,NA,"Tablet, Delayed Release",Oral,NA,NA,NA,NA,4/29/1993,6/19/1995,1995,"treatment of individuals 12 years of age or older with mild-to-moderate infections caused by susceptible strains of designated microorganisms in the following specific conditions: acute bacterial exacerbation of chronic bronchitis, secondary bacterial infection of acute bronchitis, community-acquired pneumonia, pharyngitis/tonsillitis, uncomplicated skin and skin structure infections,",NA,Standard,No,No,N/A,N/A,N/A,N/A,N/A,NA,1993-04-29,1995-06-19,781,6.660575149839686,Early-PDUFA
Precose,acarbose,Bayer,NDA,20482,NA,NA,Tablet,Oral,NA,NA,NA,NA,9/6/1994,9/6/1995,1995,adjunct to diet to lower blood glucose in patients with non-insulin-dependent diabetes mellitus whose hyperglycemia cannot be managed alone.  It may also be used in combination with a sulfonylurea when diet plus Precose or a sulfonurea do not result in adequate glycemic control,NA,Standard,No,No,N/A,N/A,N/A,N/A,N/A,NA,1994-09-06,1995-09-06,365,5.8998973535824915,Early-PDUFA
Azelex,azelaic acid,Allergan,NDA,20428,NA,NA,Cream,Topical,NA,NA,NA,NA,2/28/1994,9/13/1995,1995,treatment of mild-to-moderate inflammatory acne vulgaris,NA,Standard,No,No,N/A,N/A,N/A,N/A,N/A,NA,1994-02-28,1995-09-13,562,6.331501849893691,Early-PDUFA
Coreg,carvedilol,SmithKline Beecham,NDA,20297,NA,NA,Tablet,Oral,NA,NA,NA,NA,3/31/1993,9/14/1995,1995,treatment of hypertension,NA,Standard,No,No,N/A,N/A,N/A,N/A,N/A,NA,1993-03-31,1995-09-14,897,6.799055862058796,Early-PDUFA
Flolan,epoprostenol sodium,Burroughs Wellcome,NDA,20444,NA,NA,Injectable,Injection,NA,NA,NA,NA,2/28/1994,9/20/1995,1995,long-term intravenous treatment of primary pulmonary hypertension and pulmonary hypertension in NYHA Class III and Class IV patients,NA,Priority,Yes,No,N/A,N/A,N/A,N/A,N/A,NA,1994-02-28,1995-09-20,569,6.343880434126331,Early-PDUFA
Eprex,epoetin alfa,Johnson & Johnson,BLA,103310,NA,NA,Injectable,Injection,NA,NA,NA,NA,2/28/1989,9/29/1995,1995,"indicated for the treatment of anemia associated with chronic renal  failure, including patients on dialysis (ESRD) and patients not on dialysis",NA,Priority,No,No,N/A,N/A,N/A,N/A,N/A,Biologic product assigned new license number and now referenced by BLA 103839,1989-02-28,1995-09-29,2404,7.784889295655098,Early-PDUFA
Fosamax,alendronate sodium,Merck,NDA,20560,NA,NA,Tablet,Oral,NA,NA,NA,NA,3/31/1995,9/29/1995,1995,treatment of osteoporosis in postmenopausal women; treatment of Paget's disease of the bone.,NA,Priority,No,No,N/A,N/A,N/A,N/A,N/A,NA,1995-03-31,1995-09-29,182,5.204006687076795,Early-PDUFA
Casodex,bicalutamide,Zeneca,NDA,20498,NA,NA,Tablet,Oral,NA,NA,NA,NA,9/14/1994,10/4/1995,1995,use in combination therapy with a luteinizing-hormone releasing hormone (LHRH) analogue for the treatment of advanced prostate cancer,NA,Standard,No,Yes,N/A,N/A,N/A,N/A,N/A,NA,1994-09-14,1995-10-04,385,5.953243334287785,Early-PDUFA
Epivir,lamivudine,Glaxo Wellcome,NDA,20564,20596,NA,Tablet,Oral,Solution,Oral,NA,NA,7/7/1995,11/17/1995,1995,in combination with Retrovir (zidovudine) for the treatment of HIV infection when therapy is warranted based on clinical and/or immunological evidence of disease progression,NA,Priority,No,Yes,N/A,N/A,N/A,N/A,N/A,NA,1995-07-07,1995-11-17,133,4.890349128221754,Early-PDUFA
Amaryl,glimepiride,Hoechst-Roussel,NDA,20496,NA,NA,Tablet,Oral,NA,NA,NA,NA,8/30/1994,11/30/1995,1995,indicated as an adjunct to diet and exercise to lower blood glucose levels in patients with noninsulin-dependent (Type 2) diabetes mellitus (NIDDM) whose hyperglycemia cannot be controlled by diet and exercise alone; in combination with insulin to lower the blood glucose in patients whose hyperglycemia cannot be controlled by diet and exercise in conjunction with an oral hypoglycemic agent,NA,Standard,No,No,N/A,N/A,N/A,N/A,N/A,NA,1994-08-30,1995-11-30,457,6.124683390894205,Early-PDUFA
Invirase,saquinavir,Roche,NDA,20628,NA,NA,Capsule,Oral,NA,NA,NA,NA,8/31/1995,12/6/1995,1995,in combination with nucleoside analogues for the treatment of advanced HIV infection in selected patients,NA,Priority,No,Yes,N/A,N/A,N/A,N/A,N/A,NA,1995-08-31,1995-12-06,97,4.574710978503383,Early-PDUFA
Ethyol,amifostine,US Bioscience,NDA,20221,NA,NA,Injectable,Injection,NA,NA,NA,NA,9/30/1991,12/8/1995,1995,indicated to reduce the cumulative renal toxicity associated with repeated administration of cisplatin in patients with advanced ovarian cancer,NA,Priority,Yes,No,N/A,N/A,N/A,N/A,N/A,NA,1991-09-30,1995-12-08,1530,7.333023014386481,Early-PDUFA
Zyrtec,cetirizine,Pfizer,NDA,19835,NA,NA,Tablet,Oral,NA,NA,NA,NA,7/1/1988,12/8/1995,1995,"relief of symptoms associated with seasonal allergic rhinitis, perennial allergic rhinitis, and chronic urticaria",NA,Standard,No,No,N/A,N/A,N/A,N/A,N/A,NA,1988-07-01,1995-12-08,2716,7.906915488678587,Early-PDUFA
Rilutek,riluzole,Rhone-Poulenc,NDA,20599,NA,NA,Tablet,Oral,NA,NA,NA,NA,6/29/1995,12/12/1995,1995,treatment of patients with amyotrophic lateral sclerosis (ALS),NA,Priority,Yes,No,N/A,N/A,N/A,N/A,N/A,NA,1995-06-29,1995-12-12,166,5.111987788356544,Early-PDUFA
Cedax,ceftibuten,Schering Plough,NDA,50685,50686,NA,Capsule,Oral,Suspension,Oral,NA,NA,12/20/1991,12/20/1995,1995,"indicated for the treatment of individuals with mild-to-moderate infections caused by susceptible strains of designated microorganisms in the following conditions: acute bacterial exacerbations of chronic bronchitis, acute bacterial otitis media, pharyngitis and tonsillitis",NA,Standard,No,No,N/A,N/A,N/A,N/A,N/A,NA,1991-12-20,1995-12-20,1461,7.2868764117507,Early-PDUFA
Oxilan,ioxilan,Cook Imaging,NDA,20316,NA,NA,Injectable,Injection,NA,NA,NA,NA,12/4/1992,12/21/1995,1995,"indicated for intra-arterial use in cerebral arteriography, coronary arteriography and left ventriculography, visceral angiography, aortography and peripheral arteriography;  indicated for intravenous use in excretory urography and contrast enhanced computed tomographic imaging of the head and body",NA,Standard,No,No,N/A,N/A,N/A,N/A,N/A,NA,1992-12-04,1995-12-21,1112,7.013915474810528,Early-PDUFA
Photofrin,porfimer sodium,QLT Phototherapeutics,NDA,20451,NA,NA,Injectable,Injection,NA,NA,NA,NA,4/13/1994,12/27/1995,1995,"palliation of patients with completely obstructing esophageal cancer, or of patients with partially obstructing esophageal cancer who, in the opinion of their physician, cannot be satisfactorily treated with Nd:YAG laser therapy",NA,Priority,Yes,No,N/A,N/A,N/A,N/A,N/A,NA,1994-04-13,1995-12-27,623,6.434546518787453,Early-PDUFA
Arimidex,anastrozole,Zeneca,NDA,20541,NA,NA,Tablet,Oral,NA,NA,NA,NA,3/29/1995,12/27/1995,1995,treatment of advanced breast cancer in postmenopausal women with disease progression following tamoxifen therapy,NA,Standard,No,No,N/A,N/A,N/A,N/A,N/A,NA,1995-03-29,1995-12-27,273,5.60947179518496,Early-PDUFA
Corvert,ibutilide fumurate,Upjohn,NDA,20491,NA,NA,Injectable,Injection,NA,NA,NA,NA,10/28/1994,12/28/1995,1995,indicated for the rapid conversion of atrial fibrillation or atrial flutter of recent onset to sinus rhythm,NA,Standard,No,No,N/A,N/A,N/A,N/A,N/A,NA,1994-10-28,1995-12-28,426,6.054439346269371,Early-PDUFA
Maxipime,cefepime hydrochloride,Bristol-Myers Squibb,NDA,50679,NA,NA,Injectable,Injection,NA,NA,NA,NA,7/1/1992,1/18/1996,1996,"indicated in the treatment of the following infections when caused by susceptible strains of designated microorganisms: uncomplicated and complicated urinary tract infections, including pyelonephritis; uncomplicated skin and skin structure infections; pneumonia",NA,Standard,No,No,N/A,N/A,N/A,N/A,N/A,NA,1992-07-01,1996-01-18,1296,7.16703787691222,Early-PDUFA
Myoview,technetium Tc-99m tetrofosmin,Medi Physics,NDA,20372,NA,NA,Injectable,Injection,NA,NA,NA,NA,6/7/1993,2/9/1996,1996,indicated for scientific imaging of the myocardium following separate administrations under exercise and resting conditions to enhance the delineation of regions of reversible myocardial ischemia in the presence or absence of infarcted myocardium,NA,Standard,No,No,N/A,N/A,N/A,N/A,N/A,NA,1993-06-07,1996-02-09,977,6.884486652042782,Early-PDUFA
Norvir,ritonavir,Abbott Laboratories,NDA,20659,20680,NA,Solution,Oral,Capsule,Oral,NA,NA,12/21/1995,3/1/1996,1996,in combination with nucleoside analogues or as monotherapy for the treatment of HIV infection when therapy is warranted,NA,Priority,No,Yes,N/A,N/A,N/A,N/A,N/A,NA,1995-12-21,1996-03-01,71,4.2626798770413155,Early-PDUFA
Crixivan,indinavir sulfate,Merck,NDA,20685,NA,NA,Capsule,Oral,NA,NA,NA,NA,1/31/1996,3/13/1996,1996,treatment of HIV infection in adults when antiretroviral therapy is warranted,NA,Priority,No,Yes,N/A,N/A,N/A,N/A,N/A,NA,1996-01-31,1996-03-13,42,3.7376696182833684,Early-PDUFA
Visipaque,iodixanol,Nycomed,NDA,20351,NA,NA,Injectable,Injection,NA,NA,NA,NA,3/5/1993,3/22/1996,1996,"indicated for intra-arterial use in visceral intra-arterial digital subtraction angiography, angiocardiography (left ventriculography and selective coronary arteriography), peripheral arteriography, visceral arteriography, cerebral arteriography; indicated for intravenous use in contrast enhancement computed tomography imaging of the head and body, excretory urography, and peripheral venography",NA,Standard,No,No,N/A,N/A,N/A,N/A,N/A,NA,1993-03-05,1996-03-22,1113,7.014814351275545,Early-PDUFA
Mavik,trandolapril,Knoll,NDA,20528,NA,NA,Tablet,Oral,NA,NA,NA,NA,9/29/1994,4/26/1996,1996,treatment of hypertension,NA,Standard,No,No,N/A,N/A,N/A,N/A,N/A,NA,1994-09-29,1996-04-26,575,6.354370040797351,Early-PDUFA
Buphenyl,sodium phenylbutyrate,Ucyclyd,NDA,20573,NA,NA,Powder,Oral,NA,NA,NA,NA,2/17/1995,4/30/1996,1996,"indicated as adjunctive therapy in the chronic management of patients with urea cycle disorders involving deficiencies of carbamylphosphate synthetase, ornithine transcarbamylase or argininosuccinic acid synthetase",NA,Priority,Yes,No,N/A,N/A,N/A,N/A,N/A,NA,1995-02-17,1996-04-30,438,6.082218910376446,Early-PDUFA
Taxotere,docetaxel,Rhone-Poulenc,NDA,20449,NA,NA,Injectable,Injection,NA,NA,NA,NA,7/27/1994,5/14/1996,1996,treatment of patients with locally advanced or metastatic breast cancer who have progressed during anthracycline-based therapy or have relapsed during anthracycline-based adjuvant therapy,NA,Priority,No,Yes,N/A,N/A,N/A,N/A,N/A,NA,1994-07-27,1996-05-14,657,6.48768401848461,Early-PDUFA
Gemzar,gemcitabine hydrochloride,Lilly,NDA,20509,NA,NA,Injectable,Injection,NA,NA,NA,NA,2/2/1995,5/15/1996,1996,first-line treatment for patients with locally advanced (nonresectable stage II or III) or metastatic (stage IV) adenocarcinoma of the pancreas; also indicated for patients previously treated with 5-fluorouracil,NA,Priority,No,No,N/A,N/A,N/A,N/A,N/A,NA,1995-02-02,1996-05-15,468,6.148468295917647,Early-PDUFA
Avonex,interferon beta-1a,Biogen,BLA,103628,NA,NA,Injectable,Injection,NA,NA,NA,NA,5/22/1995,5/17/1996,1996,indicated for the treatment of relapsing forms of multiple sclerosis to slow the accumulation of physical disability and decrease the frequency of clinical exacerbations,NA,Priority,Yes,No,N/A,N/A,N/A,N/A,N/A,NA,1995-05-22,1996-05-17,361,5.8888779583328805,Early-PDUFA
Acthrel,corticorelin ovine triflutate,Ferring Pharmaceuticals,BLA,20162,NA,NA,Injectable,Injection,NA,NA,NA,NA,2/19/1991,5/23/1996,1996,indicated for use in differentiating pituitary and ectopic production of ACTH in patients with ACTH-dependent Cushing’s syndrome,NA,Priority,Yes,No,N/A,N/A,N/A,N/A,N/A,Transition Product from NDA to BLA due to BPCI : Please see page 2 of data dictionary for more information.,1991-02-19,1996-05-23,1920,7.560080465021827,Early-PDUFA
Hycamtin,topotecan hydrochloride,SmithKline Beecham,NDA,20671,NA,NA,Injectable,Injection,NA,NA,NA,NA,12/22/1995,5/28/1996,1996,treatment of patients with metastatic carcinoma of the ovary after failure of initial or subsequent chemotherapy,NA,Priority,No,No,N/A,N/A,N/A,N/A,N/A,NA,1995-12-22,1996-05-28,158,5.062595033026967,Early-PDUFA
Differin,adapalene,Galderma,NDA,20338,20380,NA,Solution,Topical,Gel,Topical,NA,NA,3/26/1993,5/31/1996,1996,indicated for the topical treatment of acne vulgaris,NA,Standard,No,No,N/A,N/A,N/A,N/A,N/A,NA,1993-03-26,1996-05-31,1162,7.057897937411856,Early-PDUFA
Xalatan,latanoprost,Pharmacia and Upjohn,NDA,20597,NA,NA,Solution/Drops,Ophthalmic,NA,NA,NA,NA,6/16/1995,6/5/1996,1996,indicated for the reduction of elevated intraocular pressure (IOP) in patients with open-angle glaucoma and/or ocular hypertension who were intolerant of other IOP-lowering medications or insufficiently responsive (failed to achieve target IOP determined after multiple measurements over time) to another IOP-lowering medication,NA,Priority,No,No,N/A,N/A,N/A,N/A,N/A,NA,1995-06-16,1996-06-05,355,5.872117789475416,Early-PDUFA
Albenza,albendazole,SmithKline Beecham,NDA,20666,NA,NA,Tablet,Oral,NA,NA,NA,NA,12/11/1995,6/11/1996,1996,"indicated for the treatment of parenchymal neurocysticercosis due to active lesions caused by larval forms of the pork tapeworm, Taenia solium; also indicated for the treatment of cystic hydatid disease of the liver, lung, and peritoneum, caused by the larval form of the dog tapeworm, Echinococcus granulosus",NA,Priority,Yes,No,N/A,N/A,N/A,N/A,N/A,NA,1995-12-11,1996-06-11,183,5.209486152841421,Early-PDUFA
Humalog,lispro insulin,Lilly,BLA,20563,NA,NA,Injectable,Injection,NA,NA,NA,NA,3/14/1995,6/14/1996,1996,treatment of diabetes mellitus in patients requiring insulin,NA,Standard,No,No,N/A,N/A,N/A,N/A,N/A,Transition Product from NDA to BLA due to BPCI : Please see page 2 of data dictionary for more information.,1995-03-14,1996-06-14,458,6.126869184114185,Early-PDUFA
Camptosar,irinotecan hydrochloride,Pharmacia and Upjohn,NDA,20571,NA,NA,Injectable,Injection,NA,NA,NA,NA,12/28/1995,6/14/1996,1996,treatment of patients with metastatic carcinoma of the colon or rectum whose disease has recurred or progressed following 5-FU-based therapy,NA,Priority,No,Yes,N/A,N/A,N/A,N/A,N/A,NA,1995-12-28,1996-06-14,169,5.1298987149230735,Early-PDUFA
Remeron,mirtazapine,Organon,NDA,20415,NA,NA,Tablet,Oral,NA,NA,NA,NA,1/30/1995,6/14/1996,1996,treatment of depression,NA,Standard,No,No,N/A,N/A,N/A,N/A,N/A,NA,1995-01-30,1996-06-14,501,6.2166061010848646,Early-PDUFA
Merrem,meropenem,Zeneca,NDA,50706,NA,NA,Injectable,Injection,NA,NA,NA,NA,11/30/1993,6/21/1996,1996,indicated as single agent therapy for the treatment of the following infections when caused by susceptible strains of the designated microorganisms: complicated intra-abdominal infections (appendicitis and peritonitis); pediatric bacterial meningitis,NA,Standard,No,No,N/A,N/A,N/A,N/A,N/A,NA,1993-11-30,1996-06-21,934,6.839476438228843,Early-PDUFA
Viramune,nevirapine,Boehringer Ingelheim Pharmaceuticals,NDA,20636,NA,NA,Tablet,Oral,NA,NA,NA,NA,2/23/1996,6/21/1996,1996,indicated for use in combination with nucleoside analogues to treat adults with HIV infection who have experienced clinical and/or immunological deterioration,NA,Priority,No,Yes,N/A,N/A,N/A,N/A,N/A,NA,1996-02-23,1996-06-21,119,4.77912349311153,Early-PDUFA
Vistide,cidofovir,Gilead Sciences,NDA,20638,NA,NA,Injectable,Injection,NA,NA,NA,NA,10/4/1995,6/26/1996,1996,treatment of cytomegalovirus (CMV) retinitis in patients with acquired immunodeficiency syndrome (AIDS),NA,Standard,No,No,N/A,N/A,N/A,N/A,N/A,NA,1995-10-04,1996-06-26,266,5.583496308781699,Early-PDUFA
CEA-Scan,arcitumomab,Immunomedics,BLA,103425,NA,NA,Injectable,Injection,NA,NA,NA,NA,4/15/1991,6/28/1996,1996,for use in conjunction with computerized tomography scans to detect recurrent or metastatic colorectal cancer,NA,Standard,No,No,N/A,N/A,N/A,N/A,N/A,NA,1991-04-15,1996-06-28,1901,7.550135342488429,Early-PDUFA
Myoscint,imciromab pentetate,Centocor,BLA,103634,NA,NA,Injectable,Injection,NA,NA,NA,NA,7/7/1995,7/3/1996,1996,indicated for the preparation of Indium In 111 Imciromab pentetate to be used as a cardiac imaging agent for detecting the presence and/or identifying the location of myocardial injury in patients with suspected myocardial infarction,NA,Priority,No,No,N/A,N/A,N/A,N/A,N/A,NA,1995-07-07,1996-07-03,362,5.8916442118257715,Early-PDUFA
Ultiva,remifentanil hydrochloride,Glaxo Wellcome,NDA,20630,NA,NA,Injectable,Injection,NA,NA,NA,NA,9/15/1995,7/12/1996,1996,"indicated for induction and maintenance of general anesthesia for inpatient and outpatient procedures, and for continuation as an analgesic into the immediate postoperative period under the direct supervision of an anesthesia practitioner in a postoperative anesthesia care unit or intensive care setting; also provides an analgesic component of monitored anesthesia care",NA,Standard,No,No,N/A,N/A,N/A,N/A,N/A,NA,1995-09-15,1996-07-12,301,5.707110264748875,Early-PDUFA
Allegra,fexofenadine hydrochloride,Hoechst Marion Roussel,NDA,20625,NA,NA,Capsule,Oral,NA,NA,NA,NA,7/31/1995,7/25/1996,1996,relief of symptoms associated with seasonal allergic rhinitis in adults and children 12 years of age and older,NA,Standard,No,No,N/A,N/A,N/A,N/A,N/A,NA,1995-07-31,1996-07-25,360,5.886104031450156,Early-PDUFA
Cerebyx,fosphenytoin sodium,Parke-Davis,NDA,20450,NA,NA,Injectable,Injection,NA,NA,NA,NA,2/23/1995,8/5/1996,1996,"for short-term parenteral administration when other means of phenytoin administration are unavailable, inappropriate or deemed less advantageous, indicated for the following:
[A] control of generalized convulsive status epilepticus
[B] prevention and treatment of seizures occurring during neuorsurgery
[C] as a substitute, short-term, for oral phenytoin",NA,Standard,Yes (indication [A] only),No,N/A,N/A,N/A,N/A,N/A,NA,1995-02-23,1996-08-05,529,6.270988431858299,Early-PDUFA
Verluma,nofetumomab,Boehringer Ingelheim Pharmaceuticals,BLA,103582,NA,NA,Injectable,Injection,NA,NA,NA,NA,3/30/1994,8/20/1996,1996,"detection of extensive stage disease in patients with biopsy-confirmed, previously untreated, small cell lung cancer",NA,Standard,No,No,N/A,N/A,N/A,N/A,N/A,Biologic product assigned new license number and now referenced by  BLA 103769,1994-03-30,1996-08-20,874,6.773080375655535,Early-PDUFA
Ivy Block,bentoquatam,Enviroderm,NDA,20532,NA,NA,Lotion,Topical,NA,NA,NA,NA,9/29/1994,8/26/1996,1996,"indicated as a skin protectant against poison ivy, poison oak, poison sumac",NA,Priority,No,No,N/A,N/A,N/A,N/A,N/A,NA,1994-09-29,1996-08-26,697,6.546785410760524,Early-PDUFA
Feridex,ferumoxides,Advanced Magnetics,NDA,20416,NA,NA,Injectable,Injection,NA,NA,NA,NA,2/7/1994,8/30/1996,1996,"indicated for detection of lesions of the liver and spleen manifested by an alteration in RES distribution, to facilitate visualization and detection of hepatosplenic lesions, including, but not limited to, tumors",NA,Standard,No,No,N/A,N/A,N/A,N/A,N/A,NA,1994-02-07,1996-08-30,935,6.840546529288687,Early-PDUFA
Alphagan,brimonidine tartrate,Allergan,NDA,20613,NA,NA,Solution/Drops,Ophthalmic,NA,NA,NA,NA,9/7/1995,9/6/1996,1996,indicated for the reduction of elevated intraocular pressure in patients with open-angle glaucoma or ocular hypertension,NA,Standard,No,No,N/A,N/A,N/A,N/A,N/A,NA,1995-09-07,1996-09-06,365,5.8998973535824915,Early-PDUFA
ProAmatine,midodrine hydrochloride,Roberts,NDA,19815,NA,NA,Tablet,Oral,NA,NA,NA,NA,4/28/1988,9/6/1996,1996,treatment of symptomatic or orthostatic hypotension,NA,Priority,Yes,Yes,N/A,N/A,N/A,N/A,N/A,NA,1988-04-28,1996-09-06,3053,8.023879992734878,Early-PDUFA
Meretek UBT,13 C Urea,Meretek,NDA,20586,NA,NA,For Solution,Oral,NA,NA,NA,NA,5/11/1995,9/17/1996,1996,for the detection of the presence of absence of active Helicobactor pylori infection of the stomach,NA,Standard,No,No,N/A,N/A,N/A,N/A,N/A,NA,1995-05-11,1996-09-17,495,6.20455776256869,Early-PDUFA
Nilandron,nilutamide,Roussel UCLAF,NDA,20169,NA,NA,Tablet,Oral,NA,NA,NA,NA,3/7/1994,9/19/1996,1996,in combination with surgical castration for the treatment of stage D2 metastatic carcinoma of the prostate,NA,Standard,No,No,N/A,N/A,N/A,N/A,N/A,NA,1994-03-07,1996-09-19,927,6.831953565565855,Early-PDUFA
Denavir,penciclovir,SmithKline Beecham,NDA,20629,NA,NA,Cream,Topical,NA,NA,NA,NA,10/16/1995,9/24/1996,1996,treatment of recurrent herpes labialis (cold sores) in adults,NA,Standard,No,No,N/A,N/A,N/A,N/A,N/A,NA,1995-10-16,1996-09-24,344,5.840641657373398,Early-PDUFA
Naropin,ropivacaine hydrochloride monohydrate,Astra,NDA,20533,NA,NA,Solution,Injection,NA,NA,NA,NA,3/31/1995,9/24/1996,1996,"production of local or regional anesthesia for surgery, for postoperative pain management and for obstetrical procedures",NA,Standard,No,No,N/A,N/A,N/A,N/A,N/A,NA,1995-03-31,1996-09-24,543,6.297109319933935,Early-PDUFA
Elmiron,pentosan polysulfate sodium,Baker Norton,NDA,20193,NA,NA,Capsule,Oral,NA,NA,NA,NA,6/19/1991,9/26/1996,1996,indicated for the relief of bladder pain or discomfort associated with interstitial cystitis,NA,Standard,Yes,No,N/A,N/A,N/A,N/A,N/A,NA,1991-06-19,1996-09-26,1926,7.563200592358071,Early-PDUFA
Accolate,zafirlukast,Zeneca,NDA,20547,NA,NA,Tablet,Oral,NA,NA,NA,NA,6/26/1995,9/26/1996,1996,prophylaxis and chronic treatment of asthma in adults and children 12 years of age and older,NA,Standard,No,No,N/A,N/A,N/A,N/A,N/A,NA,1995-06-26,1996-09-26,458,6.126869184114185,Early-PDUFA
Zyprexa,olanzapine,Lilly,NDA,20592,NA,NA,Tablet,Oral,NA,NA,NA,NA,9/22/1995,9/30/1996,1996,treatment of the manifestations of psychotic disorders,NA,Standard,No,No,N/A,N/A,N/A,N/A,N/A,NA,1995-09-22,1996-09-30,374,5.924255797414532,Early-PDUFA
Mentax,butenafine hydrochloride,Penederm,NDA,20524,NA,NA,Cream,Topical,NA,NA,NA,NA,4/5/1995,10/18/1996,1996,treatment of interdigital tinea pedis,NA,Standard,No,No,N/A,N/A,N/A,N/A,N/A,NA,1995-04-05,1996-10-18,562,6.331501849893691,Early-PDUFA
Cystadane,betaine anhydrous,Orphan Medical,NDA,20576,NA,NA,For Solution,Oral,NA,NA,NA,NA,10/25/1995,10/25/1996,1996,treatment of homocystinuria to decrease elevated homocysteine blood levels,NA,Priority,Yes,No,N/A,N/A,N/A,N/A,N/A,NA,1995-10-25,1996-10-25,366,5.902633333401366,Early-PDUFA
ProstaScint,capromab pendetide,Cytogen,BLA,103608,NA,NA,Injectable,Injection,NA,NA,NA,NA,1/13/1995,10/28/1996,1996,"indicated for the preparation of lndium In 111 Capromab Pendetide to be used as a diagnostic imaging agent in newly diagnosed patients with biopsy-proven prostate cancer, thought to be clinically localized after standard diagnostic evaluation, who are at high risk for pelvic lymph node metastases, and in post-prostatectomy patients with a rising PSA and a negative or equivocal standard metastatic evaluation in whom there is a high clinical suspicion of occult metastatic disease",NA,Priority,No,No,N/A,N/A,N/A,N/A,N/A,NA,1995-01-13,1996-10-28,654,6.483107351457199,Early-PDUFA
Retavase,reteplase,Boehringer Mannheim,BLA,103632,NA,NA,Injectable,Injection,NA,NA,NA,NA,6/30/1995,10/30/1996,1996,"indicated in the management of acute myocardial infarction (AMI) in adults for the improvement of ventricular function following AMI, the reduction of the incidence of congestive heart failure and the reduction of mortality associated with AMI",NA,Standard,No,No,N/A,N/A,N/A,N/A,N/A,Biologic product assigned new license number and now referenced by BLA 103786,1995-06-30,1996-10-30,488,6.1903154058531475,Early-PDUFA
Astelin,azelastine hydrochloride,Wallace Lab,NDA,20114,NA,NA,"Spray, Metered",Nasal,NA,NA,NA,NA,3/26/1991,11/1/1996,1996,"treatment of the symptoms of seasonal allergic rhinitis such as rhinorrhea, sneezing, and nasal pruritus in adults and children 12 years and older",NA,Standard,No,No,N/A,N/A,N/A,N/A,N/A,NA,1991-03-26,1996-11-01,2047,7.624130585661289,Early-PDUFA
Stromectol,ivermectin,Merck,NDA,50742,NA,NA,Tablet,Oral,NA,NA,NA,NA,4/1/1996,11/22/1996,1996,indicated for the treatment of intestinal strongyloidiasis due to the nematode parasite Strongyloides stercoralis; also indicated for the treatment of onchocerciasis due to the nematode parasite Onchocerca volvulus,NA,Priority,No,No,N/A,N/A,N/A,N/A,N/A,NA,1996-04-01,1996-11-22,235,5.459585514144159,Early-PDUFA
Aricept,donepezil hydrochloride,Eisai,NDA,20690,NA,NA,Tablet,Oral,NA,NA,NA,NA,4/5/1996,11/25/1996,1996,treatment of mild to moderate dementia of the Alzheimer's type,NA,Priority,No,No,N/A,N/A,N/A,N/A,N/A,NA,1996-04-05,1996-11-25,234,5.455321115357702,Early-PDUFA
Zanaflex,tizanidine hydrochloride,Athena Neuroscience,NDA,20397,NA,NA,Tablet,Oral,NA,NA,NA,NA,12/6/1993,11/27/1996,1996,acute and intermittent management of increased muscle tone associated with spasticity,NA,Standard,No,No,N/A,N/A,N/A,N/A,N/A,NA,1993-12-06,1996-11-27,1087,6.99117688712121,Early-PDUFA
Gastromark,ferumoxsil,Advanced Magnetics,NDA,20410,NA,NA,Suspension,Oral,NA,NA,NA,NA,11/23/1993,12/6/1996,1996,for oral use with magnetic resonance imaging to enhance the delineation of the bowel to distinguish it from organs and tissues that are adjacent to the upper regions of the gastrointestinal tract,NA,Standard,No,No,N/A,N/A,N/A,N/A,N/A,NA,1993-11-23,1996-12-06,1109,7.011213987350367,Early-PDUFA
Zyflo,zileuton,Abbott Laboratories,NDA,20471,NA,NA,Tablet,Oral,NA,NA,NA,NA,7/19/1994,12/9/1996,1996,prophylaxis and chronic treatment of asthma in adults and children 12 years of age and older,NA,Standard,No,No,N/A,N/A,N/A,N/A,N/A,NA,1994-07-19,1996-12-09,874,6.773080375655535,Early-PDUFA
Aphthasol,amlexanox,Block Drug,NDA,20511,NA,NA,Paste,Oral,NA,NA,NA,NA,4/19/1995,12/17/1996,1996,the treatment of aphthous ulcers in people with normal immune systems,NA,Priority,No,No,N/A,N/A,N/A,N/A,N/A,NA,1995-04-19,1996-12-17,608,6.410174881966167,Early-PDUFA
Lipitor,atorvastatin calcium,Parke-Davis,NDA,20702,NA,NA,Tablet,Oral,NA,NA,NA,NA,6/17/1996,12/17/1996,1996,"indicated as an adjunct to diet to reduce elevated total-C, LDL-C, apo B, and TG levels in patients with primary hypercholesterolemia (heterozygous familial and non familial) and mixed dyslipidemia (Fredrickson Types IIa and IIb); to reduce total-C and LDL-C in patients with homozygous familial hypercholesterolemia as an adjunct to other lipid-lowering treatments (e.g., LDL apheresis) or if such treatments are unavailable",NA,Priority,No,No,N/A,N/A,N/A,N/A,N/A,NA,1996-06-17,1996-12-17,183,5.209486152841421,Early-PDUFA
Patanol,olopatadine hydrochloride,Alcon,NDA,20688,NA,NA,Solution/Drops,Ophthalmic,NA,NA,NA,NA,1/29/1996,12/18/1996,1996,For the temporary prevention of itching of the eye due to allergic conjunctivitis,NA,Standard,No,No,N/A,N/A,N/A,N/A,N/A,NA,1996-01-29,1996-12-18,324,5.780743515792329,Early-PDUFA
Glyset,miglitol,Bayer,NDA,20682,NA,NA,Tablet,Oral,NA,NA,NA,NA,12/29/1995,12/18/1996,1996,indicated as adjunct to diet or diet plus sulfonylurea therapy to improve glycemic control in patients with non-insulin-dependent diabetes mellitus,NA,Standard,No,No,N/A,N/A,N/A,N/A,N/A,NA,1995-12-29,1996-12-18,355,5.872117789475416,Early-PDUFA
Monurol,fosfomycin tromethamine,Zambon,NDA,50717,NA,NA,For Solution,Oral,NA,NA,NA,NA,9/29/1994,12/19/1996,1996,treatment of uncomplicated urinary tract infections(acute cystitis) in women due to susceptible strains of Escherichia coli and Enterococcus faecalis,NA,Standard,No,No,N/A,N/A,N/A,N/A,N/A,NA,1994-09-29,1996-12-19,812,6.699500340161678,Early-PDUFA
Zagam,sparfloxacin,Rhone-Poulenc Rorer,NDA,20677,NA,NA,Tablet,Oral,NA,NA,NA,NA,12/27/1995,12/19/1996,1996,indicated for the treatment of adults with the following infections caused by susceptible strains of designated organisms: community-acquired pneumonia; acute bacterial exacerbations of chronic bronchitis,NA,Standard,No,No,N/A,N/A,N/A,N/A,N/A,NA,1995-12-27,1996-12-19,358,5.8805329864007,Early-PDUFA
Copaxone,glatiramer acetate,Teva,NDA,20622,NA,NA,For Solution,Subcutaneous,NA,NA,NA,NA,10/11/1995,12/20/1996,1996,indicated for the reduction of the frequency of relapses in patients with relapsing-remitting multiple sclerosis,NA,Standard,Yes,No,N/A,N/A,N/A,N/A,N/A,NA,1995-10-11,1996-12-20,436,6.077642243349034,Early-PDUFA
Diovan,valsartan,Ciba-Geigy,NDA,20665,NA,NA,Capsule,Oral,NA,NA,NA,NA,12/28/1995,12/23/1996,1996,treatment of hypertension,NA,Standard,No,No,N/A,N/A,N/A,N/A,N/A,NA,1995-12-28,1996-12-23,361,5.8888779583328805,Early-PDUFA
Dostinex,cabergoline,Pharmacia and Upjohn,NDA,20664,NA,NA,Tablet,Oral,NA,NA,NA,NA,12/27/1995,12/23/1996,1996,"treatment of hyperprolactinemic disorders, either idiopathic or due to pituitary adenomas",NA,Standard,No,No,N/A,N/A,N/A,N/A,N/A,NA,1995-12-27,1996-12-23,362,5.8916442118257715,Early-PDUFA
Orgaran,danaparoid sodium,Organon,NDA,20430,NA,NA,Injectable,Injection,NA,NA,NA,NA,12/30/1994,12/24/1996,1996,indicated for the prophylaxis of post-operative deep venous thrombosis (DVT) which may lead to pulmonary embolism (PE) in patients undergoing elective hip replacement surgery,NA,Standard,No,No,N/A,N/A,N/A,N/A,N/A,NA,1994-12-30,1996-12-24,725,6.586171654854675,Early-PDUFA
Topamax,topiramate,RW Johnson,NDA,20505,NA,NA,Tablet,Oral,NA,NA,NA,NA,12/30/1994,12/24/1996,1996,adjunctive therapy for the treatment of adults with partial onset seizures,NA,Standard,No,No,N/A,N/A,N/A,N/A,N/A,NA,1994-12-30,1996-12-24,725,6.586171654854675,Early-PDUFA
Rezulin,troglitazone,Parke-Davis,NDA,20720,NA,NA,Tablet,Oral,NA,NA,NA,NA,8/1/1996,1/29/1997,1997,indicated for use in Type II diabetes patients whose hyperglycemia is inadequately controlled despite insulin therapy,NA,Priority,No,No,N/A,N/A,N/A,N/A,N/A,NA,1996-08-01,1997-01-29,181,5.198497031265826,Early-PDUFA
Aldara,imiquimod,3M,NDA,20723,NA,NA,Cream,Topical,NA,NA,NA,NA,7/26/1996,2/27/1997,1997,treatment of external genital and perianal warts/condyloma acuminata in adults,NA,Standard,No,No,N/A,N/A,N/A,N/A,N/A,NA,1996-07-26,1997-02-27,216,5.375278407684165,Early-PDUFA
Skelid,tiludronate disodium,Sanofi Winthrop,NDA,20707,NA,NA,Tablet,Oral,NA,NA,NA,NA,2/28/1996,3/7/1997,1997,treatment of Paget's disease of bone,NA,Standard,No,No,N/A,N/A,N/A,N/A,N/A,NA,1996-02-28,1997-03-07,373,5.921578419643816,Early-PDUFA
Agrylin,anagrelide hydrochloride,Roberts,NDA,20333,NA,NA,Capsule,Oral,NA,NA,NA,NA,1/31/1996,3/14/1997,1997,treatment of patients with essential thrombocythemia to reduce the elevated platelet count and the risk of thrombosis and ameliorate associated systems,NA,Priority,Yes,No,N/A,N/A,N/A,N/A,N/A,NA,1996-01-31,1997-03-14,408,6.0112671744041615,Early-PDUFA
Viracept,nelfinavir mesylate,Agouron,NDA,20779,20778,NA,Tablet,Oral,Powder,Oral,NA,NA,12/23/1996,3/14/1997,1997,treatment of HIV infection when therapy is warranted,NA,Priority,No,Yes,N/A,N/A,N/A,N/A,N/A,NA,1996-12-23,1997-03-14,81,4.394449154672439,Early-PDUFA
Quadramet,samarium Sm 153 lexidronam,Cytogen,NDA,20570,NA,NA,Injectable,Injection,NA,NA,NA,NA,6/13/1995,3/28/1997,1997,indicated for the relief of pain in patients with confirmed osteoblastic metastatic bone lesions that enhance on radionuclide bone scan,NA,Standard,No,No,N/A,N/A,N/A,N/A,N/A,NA,1995-06-13,1997-03-28,654,6.483107351457199,Early-PDUFA
Rescriptor,delavirdine mesylate,Pharmacia and Upjohn,NDA,20705,NA,NA,Tablet,Oral,NA,NA,NA,NA,7/15/1996,4/4/1997,1997,treatment of HIV-1 infection in combination with appropriate antiretroviral agents when therapy is warranted,NA,Priority,No,Yes,N/A,N/A,N/A,N/A,N/A,NA,1996-07-15,1997-04-04,263,5.572154032177765,Early-PDUFA
Flomax,tamsulosin hydrochloride,Boehringer Ingelheim Pharmaceuticals,NDA,20579,NA,NA,Capsule,Oral,NA,NA,NA,NA,4/15/1996,4/15/1997,1997,indicated for the treatment of the signs and symptoms of benign prostatic hyperplasia,NA,Standard,No,No,N/A,N/A,N/A,N/A,N/A,NA,1996-04-15,1997-04-15,365,5.8998973535824915,Early-PDUFA
Pytest Kit,14 C Urea,TriMed,NDA,20617,NA,NA,Capsule,Oral,NA,NA,NA,NA,5/22/1995,5/9/1997,1997,indicated for the diagnosis of Helicobacter pylori infection of the stomach,NA,Priority,No,No,N/A,N/A,N/A,N/A,N/A,NA,1995-05-22,1997-05-09,718,6.576469569048224,Early-PDUFA
Normiflo,ardeparin sodium,Wyeth-Ayerst,NDA,20227,NA,NA,Injectable,Injection,NA,NA,NA,NA,12/16/1992,5/23/1997,1997,prevention of deep venous thrombosis which may lead to pulmonary embolism following knee replacement surgery,NA,Standard,No,No,N/A,N/A,N/A,N/A,N/A,NA,1992-12-16,1997-05-23,1619,7.389563953677635,Early-PDUFA
Fareston,toremifene citrate,Orion,NDA,20497,NA,NA,Tablet,Oral,NA,NA,NA,NA,1/3/1995,5/29/1997,1997,treatment of metastatic breast cancer in postmenopausal women with estrogen receptor positive or receptor unknown tumors,NA,Standard,Yes,No,N/A,N/A,N/A,N/A,N/A,NA,1995-01-03,1997-05-29,877,6.776506992372183,Early-PDUFA
Tazorac,tazarotene,Allergan,NDA,20600,NA,NA,Gel,Topical,NA,NA,NA,NA,6/19/1995,6/13/1997,1997,indicated for the topical treatment of patients with stable plaque psoriasis of up to 20% body surface area involvement and topical treatment of patients with facial acne vulgaris of mild to moderate severity,NA,Standard,No,No,N/A,N/A,N/A,N/A,N/A,NA,1995-06-19,1997-06-13,725,6.586171654854675,Early-PDUFA
Posicor,mibefradil dihydrochloride,Roche,NDA,20689,NA,NA,Tablet,Oral,NA,NA,NA,NA,3/11/1996,6/20/1997,1997,treatment of hypertension and chronic stable angina pectoris,NA,Standard,No,No,N/A,N/A,N/A,N/A,N/A,NA,1996-03-11,1997-06-20,466,6.1441856341256456,Early-PDUFA
Baycol,cerivastatin sodium,Bayer,NDA,20740,NA,NA,Tablet,Oral,NA,NA,NA,NA,6/26/1996,6/26/1997,1997,indicated as an adjunct to diet for the reduction of elevated total and LDL cholesterol levels in patients with primary hypercholesterolemia and mixed dyslipidemia (Frederickson Types IIa and IIb) when the response to dietary restriction of saturated fat and cholesterol and other non-pharmacological measures alone has been inadequate,NA,Standard,No,No,N/A,N/A,N/A,N/A,N/A,NA,1996-06-26,1997-06-26,365,5.8998973535824915,Early-PDUFA
Mirapex,pramipexole dihydrochloride,Pharmacia and Upjohn,NDA,20667,NA,NA,Tablet,Oral,NA,NA,NA,NA,12/28/1995,7/1/1997,1997,treatment of the signs and symptoms of idiopathic Parkinson's disease,NA,Standard,No,No,N/A,N/A,N/A,N/A,N/A,NA,1995-12-28,1997-07-01,551,6.311734809152915,Early-PDUFA
Duract,bromfenac sodium,Wyeth-Ayerst,NDA,20535,NA,NA,Capsule,Oral,NA,NA,NA,NA,12/30/1994,7/15/1997,1997,indicated for the short-term (generally less than 10 days) management of pain,NA,Standard,No,No,N/A,N/A,N/A,N/A,N/A,NA,1994-12-30,1997-07-15,928,6.833031732786201,Early-PDUFA
Femara,letrozole,Novartis Pharmaceuticals,NDA,20726,NA,NA,Tablet,Oral,NA,NA,NA,NA,7/25/1996,7/25/1997,1997,indicated for the treatment of advanced breast cancer in postmenopausal women,NA,Standard,No,No,N/A,N/A,N/A,N/A,N/A,NA,1996-07-25,1997-07-25,365,5.8998973535824915,Early-PDUFA
Anzemet,dolasetron mesylate,Hoechst Marion Roussel,NDA,20623,20624,NA,Tablet,Oral,Injectable,Injection,NA,NA,9/29/1995,9/11/1997,1997,prevention of chemotherapy-induced nausea and vomiting; prevention of postoperative nausea and vomiting,NA,Standard,No,No,N/A,N/A,N/A,N/A,N/A,NA,1995-09-29,1997-09-11,713,6.569481420414296,Early-PDUFA
Genesa,arbutamine hydrochloride,Gensia,NDA,20420,NA,NA,Injectable,Injection,NA,NA,NA,NA,1/6/1994,9/12/1997,1997,indicated for us as an aid in diagnosing the presence or absence of coronary artery disease in patients who cannot exercise adequately when used in conjunction with radionuclide myocardial perfusion imaging or echocardiography,NA,Standard,No,No,N/A,N/A,N/A,N/A,N/A,NA,1994-01-06,1997-09-12,1345,7.20414929203594,Early-PDUFA
Requip,ropinirole hydrochloride,SmithKline Beecham,NDA,20658,NA,NA,Tablet,Oral,NA,NA,NA,NA,1/2/1996,9/19/1997,1997,treatment of the signs and symptoms of idiopathic Parkinson's disease,NA,Standard,No,No,N/A,N/A,N/A,N/A,N/A,NA,1996-01-02,1997-09-19,626,6.439350371100098,Early-PDUFA
Corlopam,fenoldopam mesylate,Neurex,NDA,19922,NA,NA,Injectable,Injection,NA,NA,NA,NA,12/12/1988,9/23/1997,1997,"indicated for the in-hospital, short-term (up to 48 hours) use in the management of severe hypertension when rapid, but quickly reversible, emergency reduction of blood pressure is clinically indicated, including malignant hypertension with deteriorating end-organ function",NA,Standard,No,No,N/A,N/A,N/A,N/A,N/A,NA,1988-12-12,1997-09-23,3207,8.073091199693154,Early-PDUFA
Seroquel,quetiapine fumarate,Zeneca,NDA,20639,NA,NA,Tablet,Oral,NA,NA,NA,NA,7/29/1996,9/26/1997,1997,treatment of the manifestations of psychotic disorders,NA,Standard,No,No,N/A,N/A,N/A,N/A,N/A,NA,1996-07-29,1997-09-26,424,6.049733455231958,Early-PDUFA
Gabitril,tiagabine hydrochloride,Abbott Laboratories,NDA,20646,NA,NA,Tablet,Oral,NA,NA,NA,NA,11/6/1995,9/30/1997,1997,indicated as adjunctive therapy in adults and children 12 years and older in the treatment of partial seizures,NA,Standard,No,No,N/A,N/A,N/A,N/A,N/A,NA,1995-11-06,1997-09-30,694,6.542471960506805,Early-PDUFA
Avapro,irbesartan,Sanofi,NDA,20757,NA,NA,Tablet,Oral,NA,NA,NA,NA,9/26/1996,9/30/1997,1997,treatment of hypertension,NA,Standard,No,No,N/A,N/A,N/A,N/A,N/A,NA,1996-09-26,1997-09-30,369,5.910796644040527,Early-PDUFA
Infergen,interferon alfacon-1,Amgen,BLA,103663,NA,NA,Injectable,Injection,NA,NA,NA,NA,4/11/1996,10/6/1997,1997,treatment of chronic hepatitis C virus (HCV) infection in patients 18 years of age or older with compensated liver disease who have anti-HCV serum antibodies and/or the presence of HCV RNA,NA,Standard,No,No,N/A,N/A,N/A,N/A,N/A,NA,1996-04-11,1997-10-06,543,6.297109319933935,Early-PDUFA
Raxar,grepafloxacin hydrochloride,Glaxo Wellcome,NDA,20695,NA,NA,Tablet,Oral,NA,NA,NA,NA,11/8/1996,11/6/1997,1997,"treatment of adults with acute bacterial exacerbations of chronic bronchitis, community-acquired pneumonia, uncomplicated gonorrhea, and nongonococcal urethritis and cervicitis",NA,Standard,No,No,N/A,N/A,N/A,N/A,N/A,NA,1996-11-08,1997-11-06,363,5.8944028342648505,Early-PDUFA
Plavix,clopidogrel bisulfate,Sanofi,NDA,20839,NA,NA,Tablet,Oral,NA,NA,NA,NA,4/28/1997,11/17/1997,1997,"indicated for the reduction of atherosclerotic events (myocardial infarction, stroke, and vascular death) in patients with atherosclerosis documented by recent stroke, recent myocardial infarction, or established peripheral arterial disease",NA,Priority,No,No,N/A,N/A,N/A,N/A,N/A,NA,1997-04-28,1997-11-17,203,5.313205979041787,Early-PDUFA
Meridia,sibutramine hydrochloride,Knoll  Pharmacuticals,NDA,20632,NA,NA,Capsule,Oral,NA,NA,NA,NA,8/9/1995,11/22/1997,1997,"indicated for the management of obesity, including weight loss and maintenance of weight loss, and should be used in conjunction with a reduced calorie diet",NA,Standard,No,No,N/A,No,N/A,N/A,N/A,NA,1995-08-09,1997-11-22,836,6.728628613084702,Early-PDUFA
Neumega,oprelvekin,Genetics Institute,BLA,103694,NA,NA,Injectable,Injection,NA,NA,NA,NA,12/23/1996,11/25/1997,1997,indicated for the prevention of severe thrombocytopenia and the reduction of the need for platelet transfusions following myelosuppressive chemotherapy in patients with nonmyeloid malignancies who are at high risk of severe thrombocytopenia,NA,Standard,Yes,No,N/A,No,N/A,N/A,N/A,NA,1996-12-23,1997-11-25,337,5.820082930352362,Early-PDUFA
Zomig,zolmitriptan,Zeneca,NDA,20768,NA,NA,Tablet,Oral,NA,NA,NA,NA,11/26/1996,11/25/1997,1997,treatment of acute migraine,NA,Standard,No,No,N/A,No,N/A,N/A,N/A,NA,1996-11-26,1997-11-25,364,5.8971538676367405,Early-PDUFA
Teslascan,mangafodipir trisodium,Nycomed,NDA,20652,NA,NA,Injectable,Injection,NA,NA,NA,NA,9/15/1995,11/26/1997,1997,"indicated as an adjunct to MRI to enhance the T1-weighted images used in the detection, localization, characterization, and evaluation of lesions of the liver",NA,Standard,No,No,N/A,No,N/A,N/A,N/A,NA,1995-09-15,1997-11-26,803,6.688354713946762,Early-PDUFA
Rituxan,rituximab,Genentech,BLA,103705,NA,NA,Injectable,Injection,NA,NA,NA,NA,2/28/1997,11/26/1997,1997,"treatment of patients with relapsed or refractory low-grade or follicular, CD20 positive, B-cell non-Hodgkin’s lymphoma",NA,Priority,Yes,No,N/A,No,N/A,N/A,N/A,NA,1997-02-28,1997-11-26,271,5.602118820879701,Early-PDUFA
Antizol,fomepizole,Orphan Medical,NDA,20696,NA,NA,Injectable,Injection,NA,NA,NA,NA,12/6/1996,12/4/1997,1997,"indicated as an antidote to ethylene glycol (antifreeze) poisoning in patients who have ingested, or are suspected of having ingested ethylene glycol",NA,Standard,Yes,No,N/A,No,N/A,N/A,N/A,NA,1996-12-06,1997-12-04,363,5.8944028342648505,Early-PDUFA
Omnicef,cefdinir,Parke-Davis,NDA,50739,50749,NA,Capsule,Oral,Suspension,Oral,NA,NA,9/4/1996,12/4/1997,1997,"indicated for the treatment of patients with mild to moderate infections caused by susceptible strains of designated microorganisms in the following conditions:  community-acquired pneumonia, acute exacerbations of chronic bronchitis, acute bacterial otitis media, acute maxillary sinusitis, pharyngitis/tonsillitis and uncomplicated skin and skin structure infections",NA,Standard,No,No,N/A,No,N/A,N/A,N/A,NA,1996-09-04,1997-12-04,456,6.1224928095143865,Early-PDUFA
Evista,raloxifene hydrochloride,Lilly,NDA,20815,NA,NA,Tablet,Oral,NA,NA,NA,NA,6/9/1997,12/9/1997,1997,prevention of osteoporosis in postmenopausal women,NA,Priority,No,No,N/A,No,N/A,N/A,N/A,NA,1997-06-09,1997-12-09,183,5.209486152841421,Early-PDUFA
Zenapax,daclizumab,Roche,BLA,103749,NA,NA,Injectable,Injection,NA,NA,NA,NA,6/10/1997,12/10/1997,1997,"indicated for the prophylaxis of acute organ rejection in patients receiving renal transplants, to be used as a part of an immunosuppressive regimen that includes cyclosporine and corticosteroids",NA,Priority,Yes,No,N/A,No,N/A,N/A,N/A,NA,1997-06-10,1997-12-10,183,5.209486152841421,Early-PDUFA
Regranex,becaplermin,Johnson & Johnson,BLA,103691,NA,NA,Injectable,Injection,NA,NA,NA,NA,12/16/1996,12/16/1997,1997,"indicated for treatment of lower extremity diabetic neuropathic ulcers that extend into the subcutaneous tissue or beyond, and have adequate blood supply",NA,Standard,No,No,N/A,No,N/A,N/A,N/A,NA,1996-12-16,1997-12-16,365,5.8998973535824915,Early-PDUFA
Trovan,alatrofloxacin mesylate,Pfizer,NDA,20760,NA,NA,Injectable,Injection,NA,NA,NA,NA,12/30/1996,12/18/1997,1997,"indicated for the treatment of patients with mild to moderate infections caused by susceptible strains of designated microorganisms in the following conditions: nosocomial pneumonia, community acquired pneumonia, acute bacterial exacerbation of chronic bronchitis, acute sinusitis, complicated intra-abdominal infections including post-surgical infections, gynecologic and pelvic infections including endomyometritis, parametritis, septic abortion and post-partum infections, prophylaxis of infection associated with elective colorectal surgery, vaginal and abdominal hysterectomy, uncomplicated skin and skin structure infection including diabetic foot infections, uncomplicated urinary tract infections, chronic bacterial prostatitis, uncomplicate urethral gonorrhea in males and endocervical and rectal gonorrhea in females, pelvic inflammatory disease",NA,Standard,No,No,N/A,No,N/A,N/A,N/A,NA,1996-12-30,1997-12-18,353,5.8664680569332965,Early-PDUFA
Trovan,trovafloxacin mesylate,Pfizer,NDA,20759,NA,NA,Tablet,Oral,NA,NA,NA,NA,12/30/1996,12/18/1997,1997,indicated for the treatment of infections caused by susceptible strains of designated microorganisms in the following conditions:,NA,Standard,No,No,N/A,No,N/A,N/A,N/A,NA,1996-12-30,1997-12-18,353,5.8664680569332965,Early-PDUFA
Teveten,eprosartan mesylate,SmithKline Beecham,NDA,20738,NA,NA,Tablet,Oral,NA,NA,NA,NA,10/11/1996,12/22/1997,1997,treatment of hypertension,NA,Standard,No,No,N/A,No,N/A,N/A,N/A,NA,1996-10-11,1997-12-22,437,6.07993319509559,Early-PDUFA
Prandin,repaglinide,Novo Nordisk,NDA,20741,NA,NA,Tablet,Oral,NA,NA,NA,NA,7/1/1997,12/22/1997,1997,"indicated as an adjunct to diet and exercise to lower blood glucose in patients with non-insulin dependent (type 2) diabetes whose hyperglycemia cannot be controlled satisfactorily by diet and exercise alone; in combination with metformin to lower blood glucose in patients whose hyperglycemia cannot be controlled satisfactorily by exercise, diet, and either repaglinide or metformin alone",NA,Priority,No,No,N/A,No,N/A,N/A,N/A,NA,1997-07-01,1997-12-22,174,5.159055299214529,Early-PDUFA
Sclerosol,talc,Bryan,NDA,20587,NA,NA,"Aerosol, Metered",Inhalation,NA,NA,NA,NA,8/15/1995,12/24/1997,1997,for the prevention of the recurrence of malignant pleural effusions in symptomatic patients,NA,Priority,Yes,No,N/A,No,N/A,N/A,N/A,NA,1995-08-15,1997-12-24,862,6.759255270663693,Early-PDUFA
Emadine,emedastine difumarate,Alcon,NDA,20706,NA,NA,Solution/Drops,Ophthalmic,NA,NA,NA,NA,3/26/1996,12/29/1997,1997,for the temporary relief of the signs and symptoms of allergic conjunctivitis,NA,Standard,No,No,N/A,No,N/A,N/A,N/A,NA,1996-03-26,1997-12-29,643,6.466144724237619,Early-PDUFA
Tasmar,tolcapone,Roche,NDA,20697,NA,NA,Tablet,Oral,NA,NA,NA,NA,6/5/1996,1/29/1998,1998,indicated as an adjunct to levodopa and carbidopa for the treatment of the signs and symptoms of idiopathic Parkinson’s disease,NA,Standard,No,No,N/A,No,N/A,N/A,N/A,NA,1996-06-05,1998-01-29,603,6.401917196727186,Early-PDUFA
Amerge,naratriptan,Glaxo Wellcome,NDA,20763,NA,NA,Tablet,Oral,NA,NA,NA,NA,12/4/1996,2/10/1998,1998,acute treatment of migraine headache,NA,Standard,No,No,N/A,No,N/A,N/A,N/A,NA,1996-12-04,1998-02-10,433,6.07073772800249,Early-PDUFA
Singulair,montelukast sodium,Merck,NDA,20829,20830,NA,Tablet,Oral,Tablet,Oral,NA,NA,2/21/1997,2/20/1998,1998,prophylaxis and chronic treatment of asthma in patients 15 years and older,NA,Standard,No,No,N/A,No,N/A,N/A,N/A,NA,1997-02-21,1998-02-20,364,5.8971538676367405,Early-PDUFA
Refludan,lepirudin,Hoechst Marion Roussel,NDA,20807,NA,NA,Injectable,Injection,NA,NA,NA,NA,12/31/1996,3/6/1998,1998,anticoagulation in patients with heparin-induced thrombocytopenia (HIT) and thromboembolic disease in order to prevent further thromboembolic complications,NA,Priority,Yes,No,N/A,No,N/A,N/A,N/A,NA,1996-12-31,1998-03-06,430,6.063785208687608,Early-PDUFA
Lotemax; Alrex,loteprednol etabonate,Bausch & Lomb,NDA,20583,20841,20803,Suspension,Ophthalmic,Suspension,Ophthalmic,Suspension,Ophthalmic,3/31/1995,3/9/1998,1998,"Lotemax is indicated for treatment of steroid response inflammatory conditions of the palepebral and bulbar conjunctiva, cornea, and anterior segment of the eye; Lotemax is also indicated for treatment of post-operative inflammation following ocular surgery; Alrex is indicated for temporary relief of signs and symptoms of seasonal allergic conjunctivitis",NA,Standard,No,No,N/A,No,N/A,N/A,N/A,NA,1995-03-31,1998-03-09,1074,6.97914527506881,Early-PDUFA
Detrol,tolterodine tartrate,Pharmacia and Upjohn,NDA,20771,NA,NA,Tablet,Oral,NA,NA,NA,NA,3/25/1997,3/25/1998,1998,"treatment of patients with an overactive bladder with symptoms of urinary frequency, urgency, or urge incontinence",NA,Standard,No,No,N/A,No,N/A,N/A,N/A,NA,1997-03-25,1998-03-25,365,5.8998973535824915,Early-PDUFA
Actonel,risedronate sodium,Procter & Gamble,NDA,20835,NA,NA,Tablet,Oral,NA,NA,NA,NA,4/1/1997,3/27/1998,1998,treatment of Paget's disease of the bone,NA,Standard,No,No,N/A,No,N/A,N/A,N/A,NA,1997-04-01,1998-03-27,360,5.886104031450156,Early-PDUFA
Viagra,sildenafil citrate,Pfizer,NDA,20895,NA,NA,Tablet,Oral,NA,NA,NA,NA,9/29/1997,3/27/1998,1998,treatment of erectile dysfunction,NA,Priority,No,No,N/A,No,N/A,N/A,N/A,NA,1997-09-29,1998-03-27,179,5.187385805840755,Early-PDUFA
Azopt,brinzolamide,Alcon,NDA,20816,NA,NA,Suspension/Drops,Ophthalmic,NA,NA,NA,NA,1/28/1997,4/1/1998,1998,treatment of elevated intraocular pressure in patients with ocular hypertension or open angle glaucoma,NA,Standard,No,No,N/A,No,N/A,N/A,N/A,NA,1997-01-28,1998-04-01,428,6.059123195581797,Early-PDUFA
Sucraid,sacrosidase,Orphan Medical,BLA,20772,NA,NA,Solution,Oral,NA,NA,NA,NA,5/7/1997,4/9/1998,1998,"treatment of the genetically determined sucrase deficiency, which is part of congenital sucrase-isomaltase deficiency (CSID)",NA,Priority,Yes,No,N/A,No,N/A,N/A,N/A,Transition Product from NDA to BLA due to BPCI : Please see page 2 of data dictionary for more information.,1997-05-07,1998-04-09,337,5.820082930352362,Early-PDUFA
Zemplar,paricalcitol,Abbott Laboratories,NDA,20819,NA,NA,Solution,Intravenous,NA,NA,NA,NA,1/17/1997,4/17/1998,1998,prevention and treatment of secondary hyperparathyroidism encountered with chronic renal failure,NA,Standard,No,No,N/A,No,N/A,N/A,N/A,NA,1997-01-17,1998-04-17,455,6.12029741895095,Early-PDUFA
Xeloda,capecitabine,Roche,NDA,20896,NA,NA,Tablet,Oral,NA,NA,NA,NA,10/31/1997,4/30/1998,1998,"treatment of patients with metastatic breast cancer resistant to both paclitaxel and an anthracycline-containing chemotherapy regimen or resistant to paclitaxel and for whom further anthracycline therapy may be contraindicated, e.g., patients who have received cumulative doses of 400 mg/m2 of doxorubicin or doxorubicin equivalents",NA,Priority,No,Yes,N/A,No,N/A,N/A,N/A,NA,1997-10-31,1998-04-30,181,5.198497031265826,Early-PDUFA
Simulect,basiliximab,Novartis Pharmaceuticals,BLA,103764,NA,NA,Injectable,Injection,NA,NA,NA,NA,11/12/1997,5/12/1998,1998,indicated for the prophylaxis of acute organ rejection in patients receiving renal transplantation when used as part of an immunosuppressive regimen that includes cyclosporine and corticosteroids,NA,Priority,Yes,No,N/A,No,N/A,N/A,N/A,NA,1997-11-12,1998-05-12,181,5.198497031265826,Early-PDUFA
Aggrastat,tirofiban hydrochloride,Merck,NDA,20912,20913,NA,Injectable,Injection,Injectable,Injection,NA,NA,10/31/1997,5/14/1998,1998,"in combination with heparin, for the treatment of acute coronary syndrome, including patients who are to be managed medically and those undergoing PTCA or atherectomy",NA,Priority,No,No,N/A,No,N/A,N/A,N/A,NA,1997-10-31,1998-05-14,195,5.272999558563747,Early-PDUFA
Integrilin,eptifibatide,COR Therapeutics,NDA,20718,NA,NA,Injectable,Injection,NA,NA,NA,NA,4/2/1996,5/18/1998,1998,"treatment of patients with acute coronary syndrome (UA/NQMI), including patients who are to be managed medically and those undergoing percutaneous coronary intervention (PCI). In this setting, INTEGRILIN has been shown to decrease the rate of a combined endpoint of death or new myocardial infarction;  also indicated for treatment of patients undergoing PCI. In this setting, INTEGRILIN has been shown to decrease the rate of a combined endpoint of death, new myocardial infarction, or need for urgent intervention",NA,Priority,No,No,N/A,No,N/A,N/A,N/A,NA,1996-04-02,1998-05-18,776,6.654152520183219,Early-PDUFA
Atacand,candesartan cilexetil,Astra Merck,NDA,20838,NA,NA,Tablet,Oral,NA,NA,NA,NA,4/30/1997,6/4/1998,1998,treatment of hypertension,NA,Standard,No,No,N/A,No,N/A,N/A,N/A,NA,1997-04-30,1998-06-04,400,5.991464547107982,Early-PDUFA
Synagis,palivizumab,MedImmune,BLA,103770,NA,NA,Injectable,Injection,NA,NA,NA,NA,12/19/1997,6/19/1998,1998,"prophylaxis of serious lower respiratory tract disease, caused by respiratory syncytial virus, in pediatric patients at high risk of RSV disease",NA,Priority,No,No,N/A,No,N/A,N/A,N/A,NA,1997-12-19,1998-06-19,182,5.204006687076795,Early-PDUFA
Priftin,rifapentine,Hoechst Marion Roussel,NDA,21024,NA,NA,Tablet,Oral,NA,NA,NA,NA,12/22/1997,6/22/1998,1998,treatment of pulmonary tuberculosis,NA,Priority,Yes,Yes,N/A,No,N/A,N/A,N/A,NA,1997-12-22,1998-06-22,182,5.204006687076795,Early-PDUFA
Maxalt; Maxalt-MLT,rizatriptan benzoate,Merck,NDA,20864,20865,NA,Tablet,Oral,Tablet,Oral,NA,NA,6/30/1997,6/29/1998,1998,acute treatment of migraine headache,NA,Standard,No,No,N/A,No,N/A,N/A,N/A,NA,1997-06-30,1998-06-29,364,5.8971538676367405,Early-PDUFA
Infasurf,calfactant,Ony,BLA,20521,NA,NA,Suspension,Intratracheal,NA,NA,NA,NA,7/31/1995,7/1/1998,1998,prevention and treatment of Respiratory Distress Syndrome (RDS) in neonates,NA,Standard,Yes,No,N/A,No,N/A,N/A,N/A,Transition Product from NDA to BLA due to BPCI : Please see page 2 of data dictionary for more information.,1995-07-31,1998-07-01,1066,6.97166860472579,Early-PDUFA
Thalomid,thalidomide,Celgene,NDA,20785,NA,NA,Capsule,Oral,NA,NA,NA,NA,12/20/1996,7/16/1998,1998,acute treatment of the cutaneous manifestations of moderate to severe erythema nodosum leprosum (ENL) and as maintenance therapy for prevention and suppression of the cutaneous manifestations of ENL recurrences,NA,Priority,Yes,No,N/A,No,N/A,N/A,N/A,NA,1996-12-20,1998-07-16,573,6.35088571671474,Early-PDUFA
Celexa,citalopram hydrobromide,Forest Laboratories,NDA,20822,NA,NA,Tablet,Oral,NA,NA,NA,NA,5/12/1997,7/17/1998,1998,treatment of depression,NA,Standard,No,No,N/A,No,N/A,N/A,N/A,NA,1997-05-12,1998-07-17,431,6.066108090103747,Early-PDUFA
Remicade,infliximab,Centocor,BLA,103772,NA,NA,Injectable,Injection,NA,NA,NA,NA,12/30/1997,8/24/1998,1998,"indicated for the treatment of moderately to severely active Crohn’s disease for the reduction of the signs and symptoms, in patients who have an inadequate response to conventional therapies; and treatment of patients with fistulizing Crohn’s disease for the reduction in the number of draining enterocutaneous fistula(s)",NA,Priority,Yes,Yes,N/A,No,N/A,N/A,N/A,NA,1997-12-30,1998-08-24,237,5.4680601411351315,Early-PDUFA
Vitravene,fomivirsen sodium,Isis Pharm,NDA,20961,NA,NA,Injectable,Injection,NA,NA,NA,NA,4/9/1998,8/26/1998,1998,local treatment of cytomegalovirus (CMV) retinitis in patients with acquired immunodeficiency syndrome (AIDS) who are intolerant or have a contraindication to other treatments for CMV retinitis or who were insufficiently responsive to previous treatment(s) for CMV retinitis,NA,Priority,No,No,N/A,No,N/A,N/A,N/A,NA,1998-04-09,1998-08-26,139,4.9344739331306915,Early-PDUFA
Arava,leflunomide,Quintiles,NDA,20905,NA,NA,Tablet,Oral,NA,NA,NA,NA,3/10/1998,9/10/1998,1998,treatment of active rheumatoid arthritis (RA) to reduce signs and symptoms and to retard structural damage as evidenced by X-ray erosions and joint space narrowing,NA,Priority,No,No,N/A,No,N/A,N/A,N/A,NA,1998-03-10,1998-09-10,184,5.214935757608986,Early-PDUFA
AcuTect,technetium Tc-99m apcitide,Diatide,NDA,20887,NA,NA,Injectable,Injection,NA,NA,NA,NA,8/20/1997,9/14/1998,1998,for scintigraphic imaging of acute venous thrombosis in the lower extremities of patients who have signs and symptoms of acute venous thrombosis,NA,Priority,No,No,N/A,No,N/A,N/A,N/A,NA,1997-08-20,1998-09-14,390,5.966146739123692,Early-PDUFA
Sustiva,efavirenz,Dupont Pharmaceuticals,NDA,20972,NA,NA,Capsule,Oral,NA,NA,NA,NA,6/11/1998,9/17/1998,1998,provides for the use of efavirenz in combination with other antiretroviral agents for the treatment of HIV-1 infection,NA,Priority,No,Yes,N/A,Yes,N/A,N/A,N/A,NA,1998-06-11,1998-09-17,98,4.584967478670572,Early-PDUFA
Herceptin,trastuzumab,Genentech,BLA,103792,NA,NA,Injectable,Injection,NA,NA,NA,NA,5/4/1998,9/25/1998,1998,treatment of patients with metastatic breast cancer whose tumors overexpress the HER2 protein and who have received one or more chemotherapy regimens for their metastatic disease; also indicated in combination with paclitaxel for treatment of patients with metastatic breast cancer whose tumors overexpress HER2 protein and who have not received chemotherapy for their metastatic disease,NA,Priority,No,No,N/A,Yes,N/A,N/A,N/A,NA,1998-05-04,1998-09-25,144,4.969813299576001,Early-PDUFA
Valstar,valrubicin,Anthra Pharm,NDA,20892,NA,NA,Solution,Intravesical,NA,NA,NA,NA,12/31/1997,9/25/1998,1998,indicated for intravesical therapy of BCG-refractory carcinoma in situ (CIS) of the urinary bladder in patients for whom immediate cystectomy would be associated with unacceptable morbidity or mortality,NA,Priority,Yes,No,N/A,No,N/A,N/A,N/A,NA,1997-12-31,1998-09-25,268,5.5909869805108565,Early-PDUFA
Renagel,sevelamer hydrochloride,GelTex Pharm,NDA,20926,NA,NA,Capsule,Oral,NA,NA,NA,NA,11/3/1997,10/30/1998,1998,indicated for the reduction of serum phosphorus in patients with end stage renal disease who are on hemodialysis,NA,Standard,No,No,N/A,No,N/A,N/A,N/A,NA,1997-11-03,1998-10-30,361,5.8888779583328805,Early-PDUFA
Enbrel,etanercept,Immunex,BLA,103795,NA,NA,Injectable,Injection,NA,NA,NA,NA,5/8/1998,11/2/1998,1998,indicated for reduction in signs and symptoms of moderately to severely active rheumatoid arthritis in patients who have had an inadequate response to one or more disease-modifying antirheumatic drugs (DMARDS); Etanercept can be used in combination with methotrexate in patients who do not respond adequately to methotrexate alone,NA,Priority,No,No,N/A,Yes,N/A,N/A,N/A,NA,1998-05-08,1998-11-02,178,5.181783550292085,Early-PDUFA
Micardis,telmisartan,Boehringer Ingelheim Pharmaceuticals,NDA,20850,NA,NA,Tablet,Oral,NA,NA,NA,NA,9/26/1997,11/10/1998,1998,treatment of hypertension,NA,Standard,No,No,N/A,No,N/A,N/A,N/A,NA,1997-09-26,1998-11-10,410,6.016157159698354,Early-PDUFA
Thyrogen,thyrotropin alfa,Genzyme,BLA,20898,NA,NA,Injectable,Injection,NA,NA,NA,NA,12/15/1997,11/30/1998,1998,indicated for use as an adjunctive diagnostic tool for serum thyroglobulin (Tg) testing with or without radioiodine imaging in the follow-up of patients with well-differentiated thyroid cancer,NA,Priority,Yes,No,N/A,No,N/A,N/A,N/A,Transition Product from NDA to BLA due to BPCI : Please see page 2 of data dictionary for more information.,1997-12-15,1998-11-30,350,5.857933154483459,Early-PDUFA
Ziagen,abacavir sulfate,Glaxo Wellcome,NDA,20977,20978,NA,Tablet,Oral,Solution,Oral,NA,NA,6/24/1998,12/17/1998,1998,"in combination with other antiretroviral agents, for the treatment of HIV-1 infection",NA,Priority,No,Yes,N/A,Yes,N/A,N/A,N/A,NA,1998-06-24,1998-12-17,176,5.170483995038151,Early-PDUFA
Provigil,modafinil,Cephalon,NDA,20717,NA,NA,Tablet,Oral,NA,NA,NA,NA,12/30/1996,12/24/1998,1998,indicated  to  improve  wakefulness  in  patients  with  excessive  daytime sleepiness associated with narcolepsy,NA,Standard,Yes,No,N/A,No,N/A,N/A,N/A,NA,1996-12-30,1998-12-24,724,6.584791392385716,Early-PDUFA
Celebrex,celecoxib,Searle,NDA,20998,NA,NA,Capsule,Oral,NA,NA,NA,NA,6/30/1998,12/31/1998,1998,indicated for relief of the signs and symptoms of osteoarthritis; also indicated for relief of signs and symptoms of rheumatoid arthritis in adults,NA,Priority,No,No,N/A,No,N/A,N/A,N/A,NA,1998-06-30,1998-12-31,184,5.214935757608986,Early-PDUFA
Pletal,cilostazol,Otsuka Pharmaceutical,NDA,20863,NA,NA,Tablet,Oral,NA,NA,NA,NA,9/19/1997,1/15/1999,1999,indicated for the reduction of symptoms of intermittent claudication,NA,Standard,No,No,N/A,No,N/A,N/A,N/A,NA,1997-09-19,1999-01-15,483,6.180016653652572,Early-PDUFA
Panretin,alitretinoin,Ligand Pharm,NDA,20886,NA,NA,Gel,Topical,NA,NA,NA,NA,5/27/1998,2/2/1999,1999,topical treatment of cutaneous lesions in patients with AIDS-related Kaposi’s sarcoma,NA,Priority,Yes,No,N/A,No,N/A,N/A,N/A,NA,1998-05-27,1999-02-02,251,5.5254529391317835,Early-PDUFA
Ontak,denileukin diftitox,Seragen,BLA,103767,NA,NA,Injectable,Injection,NA,NA,NA,NA,12/9/1997,2/5/1999,1999,treatment of patients with persistent or recurrent cutaneous T-cell lymphoma whose malignant cells express the CD25 component of the IL-2 receptor,NA,Priority,Yes,Yes,N/A,No,N/A,N/A,N/A,NA,1997-12-09,1999-02-05,423,6.0473721790462776,Early-PDUFA
Ferrlecit,sodium ferric gluconate complex,Makoff R&D Labs,NDA,20955,NA,NA,Injectable,Injection,NA,NA,NA,NA,12/30/1997,2/18/1999,1999,treatment of iron deficiency anemia in patients undergoing chronic hemodialysis who are receiving supplemental erythropoietin therapy,NA,Priority,No,No,N/A,No,N/A,N/A,N/A,NA,1997-12-30,1999-02-18,415,6.028278520230698,Early-PDUFA
Wellferon,interferon alfa-n1,Glaxo Wellcome,BLA,103760,NA,NA,Injectable,Injection,NA,NA,NA,NA,9/30/1997,3/25/1999,1999,treatment of chronic hepatitis C in patients 18 years of age or older without decompensated liver disease,NA,Standard,No,No,N/A,No,N/A,N/A,N/A,NA,1997-09-30,1999-03-25,541,6.293419278846481,Early-PDUFA
Agenerase,amprenavir,Glaxo Wellcome,NDA,21007,21039,NA,Capsule,Oral,Solution,Oral,NA,NA,10/16/1998,4/15/1999,1999,"in combination with other antiretroviral agents, for the treatment of HIV-1 infection",NA,Priority,No,Yes,N/A,Yes,N/A,N/A,N/A,NA,1998-10-16,1999-04-15,181,5.198497031265826,Early-PDUFA
Xenical,orlistat,Roche,NDA,20766,NA,NA,Capsule,Oral,NA,NA,NA,NA,11/27/1996,4/23/1999,1999,indicated for obesity management including weight loss and weight maintenance when used in conjunction with a reduced-calorie diet;  also indicated to reduce the risk for weight re-gain after prior loss,NA,Priority,No,No,N/A,No,N/A,N/A,N/A,NA,1996-11-27,1999-04-23,877,6.776506992372183,Early-PDUFA
Vioxx,rofecoxib,Merck Research Laboratories,NDA,21042,21052,NA,Tablet,Oral,Suspension,Oral,NA,NA,11/23/1998,5/20/1999,1999,"indicated for the relief of the signs and symptoms of osteoarthritis, for the management of acute pain, and for the treatment of primary dysmenorrhea",NA,Priority,No,No,N/A,No,N/A,N/A,N/A,NA,1998-11-23,1999-05-20,178,5.181783550292085,Early-PDUFA
Avandia,rosiglitazone maleate,SKB Pharms,NDA,21071,NA,NA,Tablet,Oral,NA,NA,NA,NA,11/25/1998,5/25/1999,1999,indicated as an adjunct to diet and exercise to improve glycemic control in patients with Type 2 diabetes mellitus as monotherapy or in combination with metformin,NA,Priority,No,No,N/A,No,N/A,N/A,N/A,NA,1998-11-25,1999-05-25,181,5.198497031265826,Early-PDUFA
Hectorol,doxercalciferol,Bone Care,NDA,20862,NA,NA,Capsule,Oral,NA,NA,NA,NA,3/9/1998,6/9/1999,1999,indicated for the reduction of elevated iPTH levels in the management of secondary hyperparathyroidism in patients undergoing chronic renal dialysis,NA,Standard,No,No,N/A,No,N/A,N/A,N/A,NA,1998-03-09,1999-06-09,457,6.124683390894205,Early-PDUFA
Zaditor,ketotifen fumarate,Ciba Vision,NDA,21066,NA,NA,Solution/Drops,Ophthalmic,NA,NA,NA,NA,1/4/1999,7/2/1999,1999,prevention of itching of the eye due to allergic conjunctivitis,NA,Priority,No,No,N/A,No,N/A,N/A,N/A,NA,1999-01-04,1999-07-02,179,5.187385805840755,Early-PDUFA
Actos,pioglitazone hydrochloride,Takeda America,NDA,21073,NA,NA,Tablet,Oral,NA,NA,NA,NA,1/15/1999,7/15/1999,1999,"indicated for the improvement of glycemic control in patients with type 2 diabetes as monotherapy, or in combination with a sulfonylurea, metformin or insulin when diet and the single agent does not result in adequate glycemic control",NA,Priority,No,No,N/A,No,N/A,N/A,N/A,NA,1999-01-15,1999-07-15,181,5.198497031265826,Early-PDUFA
Relenza,zanamivir,Glaxo Wellcome,NDA,21036,NA,NA,Powder,Inhalation,NA,NA,NA,NA,10/27/1998,7/26/1999,1999,treatment of uncomplicated acute illness due to influenza virus in adults and adolescents twelve years and older who have been symptomatic for no more than two days,NA,Priority,No,No,N/A,No,N/A,N/A,N/A,NA,1998-10-27,1999-07-26,272,5.605802066295998,Early-PDUFA
Antagon,ganirelix acetate,Organon,NDA,21057,NA,NA,Injectable,Injection,NA,NA,NA,NA,1/29/1999,7/29/1999,1999,indicated for the inhibition of premature LH surges in women undergoing controlled ovarian hyperstimulation,NA,Priority,No,No,N/A,No,N/A,N/A,N/A,NA,1999-01-29,1999-07-29,181,5.198497031265826,Early-PDUFA
NeoTect,technetium Tc 99m depreotide,Diatide,NDA,21012,NA,NA,Injectable,Injection,NA,NA,NA,NA,6/16/1998,8/3/1999,1999,indicated as a scintigraphic imaging agent that identifies somatostatin receptor-bearing pulmonary masses in patients presenting with pulmonary lesions on computed tomography and/or chest x-ray who have known malignancy or who are highly suspect for malignancy,NA,Priority,No,No,N/A,No,N/A,N/A,N/A,NA,1998-06-16,1999-08-03,413,6.023447592961033,Early-PDUFA
Temodar,temozolomide,Schering,NDA,21029,NA,NA,Capsule,Oral,NA,NA,NA,NA,8/13/1998,8/11/1999,1999,"treatment of adult patients with refractory anaplastic astrocytoma, i.e., patients at first relapse who have experienced disease progression on a drug regimen containing a nitrosourea and procarbazine",NA,Priority,Yes,Yes,N/A,No,N/A,N/A,N/A,NA,1998-08-13,1999-08-11,363,5.8944028342648505,Early-PDUFA
Sonata,zaleplon,Wyeth-Ayerst,NDA,20859,NA,NA,Capsule,Oral,NA,NA,NA,NA,1/6/1998,8/13/1999,1999,short-term treatment of insomnia,NA,Standard,No,No,N/A,No,N/A,N/A,N/A,NA,1998-01-06,1999-08-13,584,6.369900982828227,Early-PDUFA
Raplon,rapacuronium bromide,Organon,NDA,20984,NA,NA,Injectable,Injection,NA,NA,NA,NA,6/25/1998,8/18/1999,1999,"indicated for outpatients and inpatients as an adjunct to general anesthesia to facilitate tracheal intubation, and to provide skeletal muscle relaxation during surgical procedures",NA,Standard,No,No,N/A,No,N/A,N/A,N/A,NA,1998-06-25,1999-08-18,419,6.037870919922137,Early-PDUFA
Aciphex,rabeprazole sodium,Eisai,NDA,20973,NA,NA,"Tablet, Delayed Release",Oral,NA,NA,NA,NA,3/31/1998,8/19/1999,1999,"indicated for: healing of erosive or ulcerative gastroesophageal reflux disease (GERD); maintenance of healing of erosive or ulcerative GERD; healing of duodenal ulcer; treatment of pathological hypersecretory conditions, including Zollinger-Ellison Syndrome",NA,Standard,No,No,N/A,No,N/A,N/A,N/A,NA,1998-03-31,1999-08-19,506,6.226536669287466,Early-PDUFA
Ellence,epirubicin hydrochloride,Pharmacia and Upjohn,NDA,50778,NA,NA,Injectable,Injection,NA,NA,NA,NA,12/15/1998,9/15/1999,1999,indicated as a component of adjuvant therapy in patients with evidence of axillary node tumor involvement following resection of primary breast cancer,NA,Priority,Yes,No,N/A,No,N/A,N/A,N/A,NA,1998-12-15,1999-09-15,274,5.6131281063880705,Early-PDUFA
Rapamune,sirolimus,Wyeth Ayerst Research,NDA,21083,NA,NA,Solution,Oral,NA,NA,NA,NA,12/15/1998,9/15/1999,1999,prophylaxis of organ rejection in patients receiving renal transplants,NA,Priority,No,No,N/A,No,N/A,N/A,N/A,NA,1998-12-15,1999-09-15,274,5.6131281063880705,Early-PDUFA
Synercid,"dalfopristin, quinupristin",Rhone-Poulenc Rorer,NDA,50747,50748,NA,Injectable,Injection,Injectable,Injection,NA,NA,9/5/1997,9/21/1999,1999,"[A] treatment of vancomycin resistant Enterococcus faecium
[B] treatment of complicated skin and skin structure infections",NA,Priority (indication [A] only),No,Yes (indication [A] only),N/A,No,N/A,N/A,N/A,NA,1997-09-05,1999-09-21,746,6.61472560020376,Early-PDUFA
Alamast,pemirolast potassium,Santen,NDA,21079,NA,NA,Solution/Drops,Ophthalmic,NA,NA,NA,NA,3/26/1999,9/24/1999,1999,prevention of itching of the eye due to allergic conjunctivitis,NA,Priority,No,No,N/A,No,N/A,N/A,N/A,NA,1999-03-26,1999-09-24,182,5.204006687076795,Early-PDUFA
Tikosyn,dofetilide,Pfizer,NDA,20931,NA,NA,Capsule,Oral,NA,NA,NA,NA,3/9/1998,10/1/1999,1999,indicated for the maintenance of normal sinus rhythm (delay in time to recurrence of atrial fibrillation/atrial flutter) in patients with atrial fibrillation /atrial flutter of greater than one week duration who have been converted to normal sinus rhythm,NA,Standard,No,No,N/A,No,N/A,N/A,N/A,NA,1998-03-09,1999-10-01,571,6.3473892096560105,Early-PDUFA
Comtan,entacapone,Orion,NDA,20796,NA,NA,Tablet,Oral,NA,NA,NA,NA,1/2/1998,10/19/1999,1999,"indicated as an adjunct to levodopa/carbidopa to treat patients with idiopathic Parkinson’s Disease who experience the signs and symptoms of end-of-dose ""wearing-off"" (so called ""fluctuating"" patients)",NA,Standard,No,No,N/A,No,N/A,N/A,N/A,NA,1998-01-02,1999-10-19,655,6.484635235635252,Early-PDUFA
Aromasin,exemestane,Pharmacia and Upjohn,NDA,20753,NA,NA,Tablet,Oral,NA,NA,NA,NA,12/21/1998,10/21/1999,1999,treatment of advanced breast cancer in postmenopausal women whose disease has progressed following tamoxifen therapy,NA,Standard,Yes,No,N/A,No,N/A,N/A,N/A,NA,1998-12-21,1999-10-21,304,5.717027701406222,Early-PDUFA
Tamiflu,oseltamivir phosphate,Roche,NDA,21087,NA,NA,Capsule,Oral,NA,NA,NA,NA,4/29/1999,10/27/1999,1999,"treatment of uncomplicated acute illness due to influenza infections in adults who have been symptomatic for no more than
two days",NA,Priority,No,No,N/A,No,N/A,N/A,N/A,NA,1999-04-29,1999-10-27,181,5.198497031265826,Early-PDUFA
Curosurf,poractant,Dey Laboratories,BLA,20744,NA,NA,Suspension,Intratracheal,NA,NA,NA,NA,7/3/1996,11/18/1999,1999,treatment (rescue) of Respiratory Distress Syndrome (RDS) in premature infants,NA,Standard,Yes,No,N/A,No,N/A,N/A,N/A,Transition Product from NDA to BLA due to BPCI : Please see page 2 of data dictionary for more information.,1996-07-03,1999-11-18,1233,7.117205503164344,Early-PDUFA
Keppra,levetiracetam,UCP Pharma,NDA,21035,NA,NA,Tablet,Oral,NA,NA,NA,NA,2/1/1999,11/30/1999,1999,indicated as an adjunctive therapy in the treatment of partial onset seizures in adults with epilepsy,NA,Standard,No,No,N/A,No,N/A,N/A,N/A,NA,1999-02-01,1999-11-30,302,5.71042701737487,Early-PDUFA
Levulan Kerastick,aminolevulinic acid hydrochloride,Dusa,NDA,20965,NA,NA,Solution,Topical,NA,NA,NA,NA,7/1/1998,12/3/1999,1999,Levulan Kerastick plus blue light illumination using the BLU-U Blue Light Photodynamic Therapy Illuminator is indicated for the treatment of non-hyperkeratotic actinic keratoses of the face and scalp,NA,Standard,No,No,N/A,No,N/A,N/A,N/A,NA,1998-07-01,1999-12-03,520,6.253828811575473,Early-PDUFA
Optimark,gadoversetamide,Mallinckrodt,NDA,20937,20975,20976,Injectable,Injection,Injectable,Injection,Injectable,Injection,3/2/1998,12/8/1999,1999,"indicated for the use with magnetic resonance imaging (MRI) in patients with an abnormal blood barrier or abnormal vascularity of the brain, spine and associated tissues; and with MRI to provide contrast enhancement and facilitate visualization of lesions with abnormal vascularity in the liver in patients who are highly suspect for liver structural abnormalities identified on computerized tomography",NA,Standard,No,No,N/A,No,N/A,N/A,N/A,NA,1998-03-02,1999-12-08,646,6.470799503782602,Early-PDUFA
Solage,"mequinol, tretinoin",Bristol-Myers Squibb,NDA,20922,NA,NA,Solution,Topical,NA,NA,NA,NA,12/30/1997,12/10/1999,1999,treatment of solar lentigines,NA,Standard,No,No,N/A,No,N/A,N/A,N/A,NA,1997-12-30,1999-12-10,710,6.565264970035361,Early-PDUFA
Avelox,moxifloxacin hydrochloride,Bayer,NDA,21085,NA,NA,Tablet,Oral,NA,NA,NA,NA,12/10/1998,12/10/1999,1999,"indicated for the treatment of adults with infections caused by susceptible strains of  designated microorganisms in the
following conditions: acute bacterial sinusitis, acute bacterial exacerbation of chronic bronchitis, community-acquired pneumonia",NA,Standard,No,No,N/A,No,N/A,N/A,N/A,NA,1998-12-10,1999-12-10,365,5.8998973535824915,Early-PDUFA
Precedex,dexmedetomidine hydrochloride,Abbott Laboratories,NDA,21038,NA,NA,Injectable,Injection,NA,NA,NA,NA,12/18/1998,12/17/1999,1999,indicated for the sedation of initially intubated and mechanically ventilated adult patients in an intensive care unit setting,NA,Standard,No,No,N/A,No,N/A,N/A,N/A,NA,1998-12-18,1999-12-17,364,5.8971538676367405,Early-PDUFA
Tequin,gatifloxacin,Bristol-Myers Squibb,NDA,21061,21062,NA,Tablet,Oral,Injectable,Injection,NA,NA,12/28/1998,12/17/1999,1999,"indicated for the treatment of infections caused by susceptible strains of designated microorganisms in the
following conditions: acute bacterial exacerbation of chronic bronchitis, acute sinusitis, community-acquired pneumonia, uncomplicated and complicated urinary tract infections, pyelonephritis, and uncomplicated gonorrhea",NA,Standard,No,No,N/A,No,N/A,N/A,N/A,NA,1998-12-28,1999-12-17,354,5.869296913133774,Early-PDUFA
Inomax,nitric oxide,Ino Therapeutics,NDA,20845,NA,NA,Gas,Inhalation,NA,NA,NA,NA,6/16/1997,12/23/1999,1999,"indicated in conjunction with ventilatory support and other appropriate agents, is indicated for the treatment of term and near-term (>34 weeks) neonates with hypoxic respiratory failure associated with clinical or echocardiographic evidence or pulmonary hypertension, where it improves oxygenation and reduces the need for extracorporeal membrane oxygenation",NA,Priority,Yes,No,N/A,No,N/A,N/A,N/A,NA,1997-06-16,1999-12-23,920,6.824373670043086,Early-PDUFA
Targretin,bexarotene,Ligand Pharms,NDA,21055,NA,NA,Capsule,Oral,NA,NA,NA,NA,6/23/1999,12/29/1999,1999,treatment of cutaneous manifestations of cutaneous T-cell lymphoma in patients who are refractory to at least one prior systemic therapy,NA,Priority,Yes,No,N/A,No,N/A,N/A,N/A,NA,1999-06-23,1999-12-29,189,5.241747015059643,Early-PDUFA
Evoxac,cevimeline hydrochloride,Snowbrand Pharmaceuticals,NDA,20989,NA,NA,Capsule,Oral,NA,NA,NA,NA,8/27/1998,1/11/2000,2000,treatment of symptoms of dry mouth in patients with Sjögren's Syndrome,NA,Standard,No,No,N/A,No,N/A,N/A,N/A,NA,1998-08-27,2000-01-11,502,6.218600119691729,Early-PDUFA
Trileptal,oxcarbazepine,Novartis Pharmaceuticals,NDA,21014,NA,NA,Tablet,Oral,NA,NA,NA,NA,9/25/1998,1/14/2000,2000,indicated for use as monotherapy or adjunctive therapy in the treatment of partial seizures in adults with epilepsy and as adjunctive therapy in the treatment of partial seizures in children ages 4-16 with epilepsy,NA,Standard,No,No,N/A,No,N/A,N/A,N/A,NA,1998-09-25,2000-01-14,476,6.16541785423142,Early-PDUFA
Protonix,pantoprazole sodium,Wyeth-Ayerst Laboratories,NDA,20987,NA,NA,"Tablet, Delayed Release",Oral,NA,NA,NA,NA,6/30/1998,2/2/2000,2000,short-term treatment (up to 8 weeks) in the healing and symptomatic relief of erosive esophagitis,NA,Standard,No,No,N/A,No,N/A,N/A,N/A,NA,1998-06-30,2000-02-02,582,6.366470447731438,Early-PDUFA
Lotronex,alosetron hydrochloride,Glaxo Wellcome,NDA,21107,NA,NA,Tablet,Oral,NA,NA,NA,NA,6/30/1999,2/9/2000,2000,treatment of irritable bowel syndrome (IBS) in female patients whose predominant bowel symptom is diarrhea,NA,Priority,No,No,N/A,No,N/A,N/A,N/A,NA,1999-06-30,2000-02-09,224,5.4116460518550396,Early-PDUFA
Skin Exposure Reduction Paste Against Chemical Warfare Agents (SERPACWA),"perfluoroalkylpolyether, polytetrafluoroethylene",US Army Medical Research and Materiel Command,NDA,21084,NA,NA,Paste,Topical,NA,NA,NA,NA,8/19/1999,2/17/2000,2000,in conjunction with Mission Oriented Protective Posture (MOPP) gear to reduce or delay the absorption of chemical warfare agents through the skin when applied prior to exposure,NA,Priority,No,No,N/A,No,N/A,N/A,N/A,NA,1999-08-19,2000-02-17,182,5.204006687076795,Early-PDUFA
Zonegran,zonisamide,Elan Pharmaceuticals,NDA,20789,NA,NA,Capsule,Oral,NA,NA,NA,NA,3/19/1997,3/27/2000,2000,indicated as an adjunctive therapy in the treatment of partial seizures in adults with epilepsy,NA,Standard,No,No,N/A,No,N/A,N/A,N/A,NA,1997-03-19,2000-03-27,1104,7.00669522683704,Early-PDUFA
Septocaine,"articaine hydrochloride, ephinephrine",Deproco,NDA,20971,NA,NA,Injectable,Injection,NA,NA,NA,NA,3/30/1998,4/3/2000,2000,"indicated for local, infiltrative, or conductive anesthesia in both simple and complex dental and periodontal procedures",NA,Standard,No,No,N/A,No,N/A,N/A,N/A,NA,1998-03-30,2000-04-03,735,6.5998704992128365,Early-PDUFA
Visudyne,verteporfin,QLT Phototherapeutics,NDA,21119,NA,NA,Injectable,Injection,NA,NA,NA,NA,8/16/1999,4/12/2000,2000,treatment of age-related macular degeneration in patients with predominantly classic subfoveal choroidal neovascularization,NA,Priority,No,No,N/A,No,N/A,N/A,N/A,NA,1999-08-16,2000-04-12,240,5.480638923341991,Early-PDUFA
Mobic,meloxicam,Boehringer Ingelheim Pharmaceuticals,NDA,20938,NA,NA,Tablet,Oral,NA,NA,NA,NA,12/16/1998,4/13/2000,2000,indicated for the relief of the signs and symptoms of osteoarthritis,NA,Standard,No,No,N/A,No,N/A,N/A,N/A,NA,1998-12-16,2000-04-13,484,6.182084906716632,Early-PDUFA
Zyvox,linezolid,Pharmacia and Upjohn,NDA,21130,21131,21132,Tablet,Oral,Injectable,Injection,Suspension,Oral,10/18/1999,4/18/2000,2000,"treatment of adult patients with vancomycin-resistant Enterococcus faecium infections, nosocomial pneumonia, complicated and uncomplicated skin and skin structure infections, and community-acquired pneumonia",NA,Priority,No,No,N/A,No,N/A,N/A,N/A,NA,1999-10-18,2000-04-18,183,5.209486152841421,Early-PDUFA
Lantus,insulin glargine,Aventis Pharmaceuticals,BLA,21081,NA,NA,Injectable,Injection,NA,NA,NA,NA,4/23/1999,4/20/2000,2000,treatment of adult and pediatric patients with type 1 diabetes mellitus or adult patients with type 2 diabetes mellitus who require basal (long-acting) insulin for the control of hyperglycemia,NA,Standard,No,No,N/A,No,N/A,N/A,N/A,Transition Product from NDA to BLA due to BPCI : Please see page 2 of data dictionary for more information.,1999-04-23,2000-04-20,363,5.8944028342648505,Early-PDUFA
Exelon,rivastigmine tartrate,Novartis Pharmaceuticals,NDA,20823,21025,NA,Capsule,Oral,Solution,Oral,NA,NA,4/7/1997,4/21/2000,2000,treatment of mild to moderate dementia of the Alzheimer’s type,NA,Standard,No,No,N/A,No,N/A,N/A,N/A,NA,1997-04-07,2000-04-21,1110,7.01211529430638,Early-PDUFA
Mylotarg,gemtuzumab ozogamicin,Wyeth-Ayerst,NDA,21174,NA,NA,Injectable,Injection,NA,NA,NA,NA,10/29/1999,5/17/2000,2000,treatment of patients with CD33 positive acute myeloid leukemia in first relapse who are 60 years of age or older and who are not considered candidates for cytotoxic chemotherapy,NA,Priority,Yes,Yes,N/A,No,N/A,N/A,N/A,NA,1999-10-29,2000-05-17,201,5.303304908059076,Early-PDUFA
Welchol,colesevelam hydrochloride,GelTex,NDA,21176,21141,NA,Tablet,Oral,Capsule,Oral,NA,NA,7/30/1999,5/26/2000,2000,"alone or in combination with an HMG-CoA reductase inhibitor, for the reduction of elevated LDL-cholesterol in patients with primary hypercholesterolemia (Frederickson Type IIa)",NA,Standard,No,No,N/A,No,N/A,N/A,N/A,NA,1999-07-30,2000-05-26,301,5.707110264748875,Early-PDUFA
TNKase,tenecteplase,Genentech,BLA,103909,NA,NA,Injectable,Injection,NA,NA,NA,NA,8/2/1999,6/2/2000,2000,indicated for reduction of mortality associated with acute myocardial infarction (AMI),NA,Standard,No,No,N/A,No,N/A,N/A,N/A,NA,1999-08-02,2000-06-02,305,5.720311776607412,Early-PDUFA
Novolog,insulin aspart recombinant,Novo Nordisk,BLA,20986,NA,NA,Injectable,Subcutaneous,NA,NA,NA,NA,9/16/1998,6/7/2000,2000,"treatment of adult patients with diabetes mellitus, for the control of hyperglycemia",NA,Standard,No,No,N/A,No,N/A,N/A,N/A,Transition Product from NDA to BLA due to BPCI : Please see page 2 of data dictionary for more information.,1998-09-16,2000-06-07,630,6.4457198193855785,Early-PDUFA
Trelstar Depot,triptorelin pamoate,Debio Recherche,NDA,20715,NA,NA,Injectable,Intramuscular,NA,NA,NA,NA,6/26/1996,6/15/2000,2000,palliative treatment of advanced prostate cancer,NA,Standard,No,No,N/A,No,N/A,N/A,N/A,NA,1996-06-26,2000-06-15,1450,7.27931883541462,Early-PDUFA
Acova,argatroban,Texas Biotechnology Corporation,NDA,20883,NA,NA,Injectable,Injection,NA,NA,NA,NA,8/15/1997,6/30/2000,2000,indicated as an anticoagulant for prophylaxis or treatment of thrombosis in patients with heparin-induced thrombocytopenia,NA,Standard,No,No,N/A,No,N/A,N/A,N/A,NA,1997-08-15,2000-06-30,1050,6.956545443151569,Early-PDUFA
Innohep,tinzaparin sodium,Dupont Pharmaceuticals,NDA,20484,NA,NA,Injectable,Injection,NA,NA,NA,NA,6/30/1999,7/14/2000,2000,treatment of acute symptomatic deep vein thrombosis with or without pulmonary embolism when administered in conjunction with warfarin sodium,NA,Standard,No,No,N/A,No,N/A,N/A,N/A,NA,1999-06-30,2000-07-14,380,5.940171252720432,Early-PDUFA
Colazal,balsalazide disodium,Salix Pharmaceuticals,NDA,20610,NA,NA,Capsule,Oral,NA,NA,NA,NA,6/23/1997,7/18/2000,2000,treatment of mildly to moderate active ulcerative colitis,NA,Standard,No,No,N/A,No,N/A,N/A,N/A,NA,1997-06-23,2000-07-18,1121,7.02197642307216,Early-PDUFA
Abreva,docosanol,Avanir Pharmaceuticals,NDA,20941,NA,NA,Cream,Topical,NA,NA,NA,NA,12/22/1997,7/25/2000,2000,treatment of cold sores and fever blisters,NA,Standard,No,No,N/A,No,N/A,N/A,N/A,NA,1997-12-22,2000-07-25,946,6.852242569051878,Early-PDUFA
Rescula,unoprostone isopropyl,Ciba Vision,NDA,21214,NA,NA,Solution/Drops,Ophthalmic,NA,NA,NA,NA,2/15/2000,8/3/2000,2000,indicated for the lowering of intraocular pressure in patients with open-angel glaucoma or ocular hypertension who are intolerant of other intraocular pressure lowering medications or insufficiently responsive (failed to achieve target IOP determined after multiple measurements over time) to another intraocular pressure lowering medication,NA,Priority,No,No,N/A,No,N/A,N/A,N/A,NA,2000-02-15,2000-08-03,170,5.135798437050262,Early-PDUFA
Cetrotide,cetrorelix acetate,Asta Medica,NDA,21197,NA,NA,Injectable,Injection,NA,NA,NA,NA,10/29/1999,8/11/2000,2000,prevention of premature LH surges in women undergoing controlled ovarian stimulation,NA,Standard,No,No,N/A,No,N/A,N/A,N/A,NA,1999-10-29,2000-08-11,287,5.659482215759621,Early-PDUFA
Kaletra,"lopinavir, ritonavir",Abbott Laboratories,NDA,21226,21251,NA,Capsule,Oral,Solution,Oral,NA,NA,6/1/2000,9/15/2000,2000,in combination with other antiretroviral agents for the treatment of HIV-1 infections in adults and pediatric patients age six months and older,NA,Priority,No,Yes,N/A,Yes,N/A,N/A,N/A,NA,2000-06-01,2000-09-15,106,4.663439094112067,Early-PDUFA
Trisenox,arsenic trioxide,Cell Therapeutics,NDA,21248,NA,NA,Injectable,Injection,NA,NA,NA,NA,3/28/2000,9/25/2000,2000,"indicated for induction of remission and consolidation in patients with acute promyelocytic leukemia (APL) who are refractory to, or have relapsed from, retinoid and anthracycline chemotherapy, and whose APL is characterized by the presence of the t(15;17) translocation or PML/RAR-alpha gene expression",NA,Priority,Yes,No,N/A,Yes,N/A,N/A,N/A,NA,2000-03-28,2000-09-25,181,5.198497031265826,Early-PDUFA
Mifeprex,mifepristone,Population Council,NDA,20687,NA,NA,Tablet,Oral,NA,NA,NA,NA,3/18/1996,9/28/2000,2000,indicated for medical termination of intrauterine pregnancy through 49 days’ pregnancy,NA,Priority,No,No,N/A,No,N/A,N/A,N/A,NA,1996-03-18,2000-09-28,1655,7.411556287811163,Early-PDUFA
Myobloc,botulinum toxin type B,Elan Pharmaceuticals,BLA,103846,NA,NA,Injectable,Injection,NA,NA,NA,NA,12/22/1998,12/8/2000,2000,treatment of patients with cervical dystonia to reduce the severity of abnormal head position and neck pain associated with cervical dystonia,NA,Standard,Yes,No,N/A,No,N/A,N/A,N/A,NA,1998-12-22,2000-12-08,717,6.57507584059962,Early-PDUFA
Angiomax,bivalirudin,The Medicines Company,NDA,20873,NA,NA,Injectable,Intravenous,NA,NA,NA,NA,12/23/1997,12/15/2000,2000,indicated for use as an anticoagulant in conjunction with aspirin in patients with unstable angina undergoing percutaneous transluminal coronary angioplasty (PTCA),NA,Standard,No,No,N/A,No,N/A,N/A,N/A,NA,1997-12-23,2000-12-15,1088,6.992096427415888,Early-PDUFA
Starlix,nateglinide,Novartis Pharmaceuticals,NDA,21204,NA,NA,Tablet,Oral,NA,NA,NA,NA,12/17/1999,12/22/2000,2000,"indicated  as  monotherapy  to  lower  blood  glucose  in  patients  with  Type  2  diabetes (non-insulin   dependent   diabetes   mellitus,   NIDDM)   whose   hyperglycemia   cannot   be adequately controlled by diet and physical exercise and who have not been chronically treated with other anti-diabetic agents; also indicated   for   use   in   combination   with   metformin in  patients   whose hyperglycemia  is  inadequately  controlled  with  metformin,  Starlix    may  be  added  to,  but  not substituted for, metformin",NA,Standard,No,No,N/A,No,N/A,N/A,N/A,NA,1999-12-17,2000-12-22,371,5.916202062607435,Early-PDUFA
Peg-Intron,peginterferon alfa-2b,Schering,BLA,103949,NA,NA,Injectable,Injection,NA,NA,NA,NA,12/23/1999,1/19/2001,2001,treatment of chronic hepatitis C in patients not previously treated with interferon alfa who have compensated liver disease and are at least 18 years of age,NA,Standard,No,No,N/A,No,N/A,N/A,N/A,NA,1999-12-23,2001-01-19,393,5.973809611869261,Early-PDUFA
Cancidas,caspofungin acetate,Merck Research Laboratories,NDA,21227,NA,NA,Powder,Intravenous,NA,NA,NA,NA,7/28/2000,1/26/2001,2001,treatment of invasive aspergillosis in patients who are refractory to or intolerant of other therapies,NA,Priority,No,No,N/A,Yes,N/A,N/A,N/A,NA,2000-07-28,2001-01-26,182,5.204006687076795,Early-PDUFA
Geodon,ziprasidone hydrochloride,Pfizer Central Research,NDA,20825,NA,NA,Capsule,Oral,NA,NA,NA,NA,3/17/1997,2/5/2001,2001,treatment of schizophrenia,NA,Standard,No,No,N/A,No,N/A,N/A,N/A,NA,1997-03-17,2001-02-05,1421,7.259116128097101,Early-PDUFA
Foradil,formoterol fumarate,Novartis Pharmaceuticals,NDA,20831,NA,NA,Powder,Inhalation,NA,NA,NA,NA,6/26/1997,2/16/2001,2001,"indicated for the long-term, administration in the maintenance treatment of asthma and in the prevention of bronchospasm in adults and children 5 years of age and older with reversible obstructive airways disease, including patients with symptoms of nocturnal asthma; also indicated for the acute prevention of exercise-induced bronchospasm (EIB) in adults and children 12 years of age and older, when administered on an occasional, as-needed basis",NA,Standard,No,No,N/A,No,N/A,N/A,N/A,NA,1997-06-26,2001-02-16,1331,7.193685818395112,Early-PDUFA
Reminyl,galantamine hydrobromide,Janssen Research Foundation,NDA,21169,NA,NA,Tablet,Oral,NA,NA,NA,NA,9/29/1999,2/28/2001,2001,treatment of mild to moderate dementia of the Alzheimer's type,NA,Standard,No,No,N/A,No,N/A,N/A,N/A,NA,1999-09-29,2001-02-28,518,6.249975242259483,Early-PDUFA
Travatan,travoprost,Alcon Research,NDA,21257,NA,NA,Solution/Drops,Ophthalmic,NA,NA,NA,NA,7/7/2000,3/16/2001,2001,indicated for the reduction of intraocular pressure in patients with open-angle glaucoma or ocular hypertension who are intolerant of other intraocular pressure lowering medications or insufficiently responsive (failed to achieve target IOP determined after multiple measurements over time) to another intraocular pressure lowering medication,NA,Priority,No,No,N/A,No,N/A,N/A,N/A,NA,2000-07-07,2001-03-16,252,5.529429087511423,Early-PDUFA
Lumigan,bimatoprost,Allergan,NDA,21275,NA,NA,Solution/Drops,Ophthalmic,NA,NA,NA,NA,9/18/2000,3/16/2001,2001,indicated for the reduction of elevated intraocular pressure in patients with open angle glaucoma or ocular hypertension who are intolerant of other intraocular pressure lowering medications or insufficiently responsive (failed to achieve target IOP determined after multiple measurements over time) to another intraocular pressure lowering medication,NA,Priority,No,No,N/A,No,N/A,N/A,N/A,NA,2000-09-18,2001-03-16,179,5.187385805840755,Early-PDUFA
Campath,alemtuzumab,Millennium and ILEX Partners,BLA,103948,NA,NA,Injectable,Injection,NA,NA,NA,NA,12/23/1999,5/7/2001,2001,treatment of patients with B-cell chronic lymphocytic leukemia who have been treated with alkylating agents and who have failed fludarabine therapy,NA,Priority,Yes,Yes,N/A,Yes,N/A,N/A,N/A,NA,1999-12-23,2001-05-07,501,6.2166061010848646,Early-PDUFA
Axert,almotriptan malate,Pharmacia and Upjohn,NDA,21001,NA,NA,Tablet,Oral,NA,NA,NA,NA,12/20/1999,5/7/2001,2001,indicated for the acute treatment of migraine with or without aura in adults,NA,Standard,No,No,N/A,No,N/A,N/A,N/A,NA,1999-12-20,2001-05-07,504,6.222576268071369,Early-PDUFA
Gleevec,imatinib mesylate,Novartis Pharmaceuticals,NDA,21335,NA,NA,Capsule,Oral,NA,NA,NA,NA,2/27/2001,5/10/2001,2001,"indicated for the treatment of patients with chronic myeloid leukemia (CML) in blast crisis, accelerated phase, or in chronic phase after failure of interferon-alpha therapy",NA,Priority,Yes,Yes,N/A,Yes,N/A,N/A,N/A,NA,2001-02-27,2001-05-10,72,4.276666119016055,Early-PDUFA
Yasmin,"drospirenone,ethinyl estradiol",Berlex Laboratories,NDA,21098,NA,NA,Tablet,Oral,NA,NA,NA,NA,5/17/1999,5/11/2001,2001,indicated for the prevention of pregnancy in women who elect to use an oral contraceptive,NA,Standard,No,No,N/A,No,N/A,N/A,N/A,NA,1999-05-17,2001-05-11,725,6.586171654854675,Early-PDUFA
Definity,perflutren lipid microsphere,Dupont Pharmaceuticals,NDA,21064,NA,NA,Injectable,Intravenous,NA,NA,NA,NA,12/9/1998,7/31/2001,2001,indicated for use in patients with suboptimal echocardiograms to opacify the left ventricular chamber and to improve the delineation of the left ventricular endocardial border,NA,Standard,No,No,N/A,No,N/A,N/A,N/A,NA,1998-12-09,2001-07-31,965,6.872128101338986,Early-PDUFA
Natrecor,nesiritide,Scios,NDA,20920,NA,NA,For Solution,Intravenous,NA,NA,NA,NA,4/27/1998,8/10/2001,2001,treatment of patients with acutely decompensated congestive heart failure who have dyspnea at rest or with minimal activity,NA,Standard,No,No,N/A,No,N/A,N/A,N/A,NA,1998-04-27,2001-08-10,1201,7.0909098220799835,Early-PDUFA
Zometa,zoledronic acid,Novartis Pharmaceuticals,NDA,21223,NA,NA,Injectable,Intravenous,NA,NA,NA,NA,12/21/1999,8/20/2001,2001,treatment of hypercalcemia of malignancy,NA,Priority,Yes,No,N/A,No,N/A,N/A,N/A,NA,1999-12-21,2001-08-20,608,6.410174881966167,Early-PDUFA
Spectracef,cefditoren pivoxil,TAP Pharmaceutical Products,NDA,21222,NA,NA,Tablet,Oral,NA,NA,NA,NA,12/29/1999,8/29/2001,2001,"treatment of acute bacterial exacerbation of chronic bronchitis, pharyngitis/tonsillitis, and uncomplicated skin and skin structure infections",NA,Standard,No,No,N/A,No,N/A,N/A,N/A,NA,1999-12-29,2001-08-29,609,6.411818267709897,Early-PDUFA
Aranesp,darbepoetin alfa,Amgen,BLA,103951,NA,NA,Injectable,Injection,NA,NA,NA,NA,12/28/1999,9/17/2001,2001,"treatment of anemia associated with chronic renal failure, including patients on dialysis and patients not on dialysis",NA,Standard,No,No,N/A,No,N/A,N/A,N/A,NA,1999-12-28,2001-09-17,629,6.444131256700441,Early-PDUFA
NuvaRing,"etonogestrel, ethinyl estradiol",Organon,NDA,21187,NA,NA,Ring,Vaginal,NA,NA,NA,NA,12/28/1999,10/3/2001,2001,indicated for the prevention of pregnancy in women who elect to use this product as a method of contraception,NA,Standard,No,No,N/A,No,N/A,N/A,N/A,NA,1999-12-28,2001-10-03,645,6.4692503167957724,Early-PDUFA
Viread,tenofovir disoproxil fumarate,Gilead Sciences,NDA,21356,NA,NA,Tablet,Oral,NA,NA,NA,NA,5/1/2001,10/26/2001,2001,in combination with other antiretroviral agents for the treatment of HIV-1 infection in adults,NA,Priority,No,Yes,N/A,Yes,N/A,N/A,N/A,NA,2001-05-01,2001-10-26,178,5.181783550292085,Early-PDUFA
Frova,frovatriptan,Elan Pharmaceuticals,NDA,21006,NA,NA,Tablet,Oral,NA,NA,NA,NA,1/29/1999,11/8/2001,2001,acute treatment of migraine,NA,Standard,No,No,N/A,No,N/A,N/A,N/A,NA,1999-01-29,2001-11-08,1014,6.921658184151129,Early-PDUFA
Kineret,anakinra,Amgen,BLA,103950,NA,NA,Injectable,Injection,NA,NA,NA,NA,12/28/1999,11/14/2001,2001,"indicated for the reduction in signs and symptoms of moderately to severely active rheumatoid arthritis, in patients 18 years of age or older who have failed one or more disease modifying antirheumatic drugs (DMARDs)",NA,Standard,No,No,N/A,No,N/A,N/A,N/A,NA,1999-12-28,2001-11-14,687,6.532334292222349,Early-PDUFA
Bextra,valdecoxib,GD Searle,NDA,21341,NA,NA,Tablet,Oral,NA,NA,NA,NA,1/16/2001,11/16/2001,2001,indicated for the relief of signs and symptoms of osteoarthritis and adult rheumatoid arthritis and for the treatment of primary dysmenorrhea,NA,Standard,No,No,N/A,No,N/A,N/A,N/A,NA,2001-01-16,2001-11-16,304,5.717027701406222,Early-PDUFA
Avodart,dutasteride,GlaxoSmithKline,NDA,21319,NA,NA,Capsule,Oral,NA,NA,NA,NA,12/21/2000,11/20/2001,2001,treatment of symptomatic benign prostatic hyperplasia in men with an enlarged prostate gland,NA,Standard,No,No,N/A,No,N/A,N/A,N/A,NA,2000-12-21,2001-11-20,334,5.811140992976701,Early-PDUFA
Ortho Evra,"norelgestromin, ethinyl estradiol",RW Johnson Pharmaceutical Research,NDA,21180,NA,NA,"Film, Extended Release",Transdermal,NA,NA,NA,NA,12/21/2000,11/20/2001,2001,indicated for the prevention of pregnancy,NA,Standard,No,No,N/A,No,N/A,N/A,N/A,NA,2000-12-21,2001-11-20,334,5.811140992976701,Early-PDUFA
Tracleer,bosentan,Actelion Pharmaceuticals,NDA,21290,NA,NA,Tablet,Oral,NA,NA,NA,NA,11/17/2000,11/20/2001,2001,indicated for the treatment of pulmonary arterial hypertension,NA,Standard,Yes,No,N/A,No,N/A,N/A,N/A,NA,2000-11-17,2001-11-20,368,5.908082938168931,Early-PDUFA
Invanz,ertapenem sodium,Merck,NDA,21337,NA,NA,Injectable,"Intramuscular, Intravenous",NA,NA,NA,NA,11/30/2000,11/21/2001,2001,"treatment of complicated intra-abdominal infections; complicated skin and skin structure infections; community acquired pneumonia; complicated urinary tract infections including pyelonephritis; acute pelvic infections including postpartum endomyometritis, septic abortion and post surgical gynecologic infections",NA,Standard,No,No,N/A,No,N/A,N/A,N/A,NA,2000-11-30,2001-11-21,356,5.87493073085203,Early-PDUFA
Xigris,drotrecogin alfa,Eli Lilly,BLA,125029,NA,NA,Injectable,Injection,NA,NA,NA,NA,1/26/2001,11/21/2001,2001,indicated for the reduction of mortality in adult patients with severe sepsis (sepsis associated with acute organ dysfunction) who have a high risk of death,NA,Priority,No,No,N/A,No,N/A,N/A,N/A,NA,2001-01-26,2001-11-21,299,5.700443573390687,Early-PDUFA
Arixtra,fondaparinux sodium,Fonda BV,NDA,21345,NA,NA,Injectable,Subcutaneous,NA,NA,NA,NA,2/15/2001,12/7/2001,2001,"indicated for the prophylaxis of deep vein thrombosis, which may lead to pulmonary embolism, in patients undergoing hip fracture surgery, hip replacement surgery, or knee replacement surgery",NA,Priority,No,No,N/A,No,N/A,N/A,N/A,NA,2001-02-15,2001-12-07,295,5.68697535633982,Early-PDUFA
Elidel,pimecrolimus,Novartis Pharmaceuticals,NDA,21302,NA,NA,Cream,Topical,NA,NA,NA,NA,12/15/2000,12/13/2001,2001,"short-term and intermittent long-term therapy in the treatment of mild to moderate atopic dermatitis in non-immunocompromised patients 2 years of age and older, in whom the use of alternative, conventional therapies is deemed inadvisable because of potential risks, or in the treatment of patients who are not adequately responsive to or intolerant of alternative, conventional therapies",NA,Standard,No,No,N/A,No,N/A,N/A,N/A,NA,2000-12-15,2001-12-13,363,5.8944028342648505,Early-PDUFA
Clarinex,desloratadine,Schering,NDA,21165,NA,NA,Tablet,Oral,NA,NA,NA,NA,10/21/1999,12/21/2001,2001,indicated for the relief of the nasal and non-nasal symptoms of seasonal allergic rhinitis in patients 12 years of age and older,NA,Standard,No,No,N/A,No,N/A,N/A,N/A,NA,1999-10-21,2001-12-21,792,6.674561391814426,Early-PDUFA
Orfadin,nitisinone,Swedish Orphan,NDA,21232,NA,NA,Capsule,Oral,NA,NA,NA,NA,9/8/2000,1/18/2002,2002,indicated as adjunctive therapy to dietary restriction of tyrosine and phenylalanine in the treatment of hereditary tyrosinemia type 1,NA,Priority,Yes,No,N/A,Yes,N/A,N/A,N/A,NA,2000-09-08,2002-01-18,497,6.208590026096629,Early-PDUFA
Neulasta,pegfilgrastim,Amgen,BLA,125031,NA,NA,Injectable,Injection,NA,NA,NA,NA,4/2/2001,1/31/2002,2002,"indicated to decrease the incidence of infection, as manifested by febrile neutropenia, in patients with non-myeloid malignancies receiving myelosuppressive anti-cancer drugs associated with a clinically significant incidence of febrile neutropenia",NA,Standard,No,No,N/A,No,N/A,N/A,N/A,NA,2001-04-02,2002-01-31,304,5.717027701406222,Early-PDUFA
Zevalin,ibritumomab tiuxetan,Idec Pharmaceuticals,BLA,125019,NA,NA,Injectable,Injection,NA,NA,NA,NA,11/1/2000,2/19/2002,2002,"as part of a specific therapeutic regimen including Rituximab, Indium-111, Ibritumomab Tiuxetan, and Yttrium-90 Ibritumomab Tiuxetan, is indicated for the treatment of patients with relapsed or refractory low-grade, follicular, or transformed B-cell non-Hodgkin's lymphoma, including patients with Rituximab (Rituxan) refractory follicular non-Hodgkin’s lymphoma",NA,Priority,Yes,Yes,N/A,Yes,N/A,N/A,N/A,NA,2000-11-01,2002-02-19,475,6.163314804034641,Early-PDUFA
Rebif,interferon beta-1a,Serono,BLA,103780,NA,NA,Injectable,Injection,NA,NA,NA,NA,2/27/1998,3/7/2002,2002,treatment of patients with relapsing forms of multiple sclerosis to decrease the frequency of clinical exacerbations and delay the accumulation of physical disability,NA,Standard,No,No,N/A,No,N/A,N/A,N/A,NA,1998-02-27,2002-03-07,1469,7.292337176173877,Early-PDUFA
Faslodex,fulvestrant,AstraZeneca Pharmaceuticals,NDA,21344,NA,NA,Injectable,Intramuscular,NA,NA,NA,NA,3/28/2001,4/25/2002,2002,treatment of hormone receptor positive metastatic breast cancer in postmenopausal women with disease progression following antiestrogen therapy,NA,Standard,No,No,N/A,No,N/A,N/A,N/A,NA,2001-03-28,2002-04-25,393,5.973809611869261,Early-PDUFA
Benicar,olmesartan medoxomil,Sankyo,NDA,21286,NA,NA,Tablet,Oral,NA,NA,NA,NA,7/25/2000,4/25/2002,2002,treatment of hypertension,NA,Standard,No,No,N/A,No,N/A,N/A,N/A,NA,2000-07-25,2002-04-25,639,6.459904454377535,Early-PDUFA
Remodulin,treprostinil sodium,United Therapeutics,NDA,21272,NA,NA,Injectable,"Iv (Infusion), Subcutaneous",NA,NA,NA,NA,10/16/2000,5/21/2002,2002,treatment of pulmonary arterial hypertension,NA,Priority,Yes,Yes,N/A,No,N/A,N/A,N/A,NA,2000-10-16,2002-05-21,582,6.366470447731438,Early-PDUFA
Vfend,voriconazole,Pfizer,NDA,21266,21267,NA,Tablet,Oral,Injectable,Injection,NA,NA,11/17/2000,5/24/2002,2002,"treatment of invasive aspergillosis and serious fungal infections caused by Scedosporium apiospermum and Fusarium spp., including Fusarium solani, in patients intolerant of, or refractory to, other therapy",NA,Standard,No,No,N/A,No,N/A,N/A,N/A,NA,2000-11-17,2002-05-24,553,6.315358001522335,Early-PDUFA
Imagent,"dimyristoylphosphatidylcholine, perflexane",Alliance Pharmaceuticals,NDA,21191,NA,NA,Injectable,Intravenous,NA,NA,NA,NA,10/14/1999,5/31/2002,2002,indicated for the use in patients with suboptimal echocardiograms to opacify the left ventricular chamber and to improve the delineation of the left ventricular endocardial border,NA,Standard,No,No,N/A,No,N/A,N/A,N/A,NA,1999-10-14,2002-05-31,960,6.866933284461882,Early-PDUFA
Elitek,rasburicase,Sanofi-Synthelabo,BLA,103946,NA,NA,Injectable,Injection,NA,NA,NA,NA,12/16/1999,7/12/2002,2002,"indicated for the initial management of plasma uric acid levels in pediatric patients with leukemia, lymphoma, and solid tumor malignancies who are receiving anti-cancer therapy expected to result in tumor lysis and subsequent elevation of plasma uric acid",NA,Standard,Yes,No,N/A,No,N/A,N/A,N/A,NA,1999-12-16,2002-07-12,939,6.844815479208263,Early-PDUFA
Xyrem,sodium oxybate,Orphan Medical,NDA,21196,NA,NA,Solution,Oral,NA,NA,NA,NA,10/2/2000,7/17/2002,2002,treatment of cataplexy associated with narcolepsy,NA,Priority,Yes,No,N/A,No,N/A,N/A,N/A,NA,2000-10-02,2002-07-17,653,6.481577129276431,Early-PDUFA
Zelnorm,tegaserod maleate,Novartis Pharmaceuticals,NDA,21200,NA,NA,Tablet,Oral,NA,NA,NA,NA,2/11/2000,7/24/2002,2002,short-term treatment of women with irritable bowel syndrome whose primary bowel symptom is constipation,NA,Priority,No,No,N/A,No,N/A,N/A,N/A,NA,2000-02-11,2002-07-24,894,6.795705775173514,Early-PDUFA
Eloxatin,oxaliplatin,Sanofi-Synthelabo,NDA,21492,NA,NA,Injectable,Intravenous,NA,NA,NA,NA,6/24/2002,8/9/2002,2002,in combination with infusional 5-FU/LV for the treatment of patients with metastatic carcinoma of the colon or rectum whose disease has recurred or progressed during or within 6 months of completion of first line therapy with the combination of bolus 5-FU/LV and irinotecan,NA,Priority,No,Yes,N/A,Yes,N/A,N/A,N/A,NA,2002-06-24,2002-08-09,46,3.828641396489095,Early-PDUFA
Hepsera,adefovir dipivoxil,Gilead Sciences,NDA,21449,NA,NA,Tablet,Oral,NA,NA,NA,NA,3/21/2002,9/20/2002,2002,treatment of chronic hepatitis B in adults with evidence of active viral replication and either evidence of persistent elevations in serum alanine aminotransferase (ALT)/aspartate aminotransferase (AST) or histologically active disease,NA,Priority,No,No,N/A,No,N/A,N/A,N/A,NA,2002-03-21,2002-09-20,183,5.209486152841421,Early-PDUFA
Inspra,eplerenone,GD Searle,NDA,21437,NA,NA,Tablet,Oral,NA,NA,NA,NA,11/29/2001,9/27/2002,2002,"treatment of hypertension, alone or in combination with other agents",NA,Standard,No,No,N/A,No,N/A,N/A,N/A,NA,2001-11-29,2002-09-27,302,5.71042701737487,Early-PDUFA
Pegasys,peginterferon alfa-2a,Hoffmann-La Roche,BLA,103964,NA,NA,Injectable,Injection,NA,NA,NA,NA,5/22/2000,10/16/2002,2002,treatment of adults with chronic hepatitis C who have compensated liver disease and who have not been previously treated with interferon alfa,NA,Standard,No,No,N/A,No,N/A,N/A,N/A,NA,2000-05-22,2002-10-16,877,6.776506992372183,Early-PDUFA
Zetia,ezetimibe,Schering,NDA,21445,NA,NA,Tablet,Oral,NA,NA,NA,NA,12/27/2001,10/25/2002,2002,"indicated as adjunctive therapy to diet for reduction of elevated total-C, LDL-C and Apo B in patients with primary (heterozygous familial and non-familial) hypercholesterolemia either alone or with an HMG-Co A reductase inhibitor; treatment of homozygous familial hypercholesterolemia in combination with either atorvastatin or simvastatin, as an adjunct to other lipid-lowering treatments (e.g., LDL apheresis) or, if such treatments are unavailable, in combination with either atorvastatin or simvastatin alone; treatment of homozygous familial sitosterolemia as adjunctive therapy to diet for the reduction of elevated sitosterol and campesterol levels",NA,Standard,No,No,N/A,No,N/A,N/A,N/A,NA,2001-12-27,2002-10-25,302,5.71042701737487,Early-PDUFA
Abilify,aripiprazole,Otsuka Pharmaceutical,NDA,21436,NA,NA,Tablet,Oral,NA,NA,NA,NA,10/31/2001,11/15/2002,2002,treatment of schizophrenia,NA,Standard,No,No,N/A,No,N/A,N/A,N/A,NA,2001-10-31,2002-11-15,380,5.940171252720432,Early-PDUFA
Alinia,nitazoxanide,Romark Laboratories,NDA,21498,NA,NA,For Suspension,Oral,NA,NA,NA,NA,5/29/2002,11/22/2002,2002,treatment of diarrhea caused by Cryptosporidium parvum and Giardia lamblia,NA,Priority,Yes,No,N/A,No,N/A,N/A,N/A,NA,2002-05-29,2002-11-22,177,5.176149732573829,Early-PDUFA
Strattera,atomoxetine hydrochloride,Eli Lilly,NDA,21411,NA,NA,Capsule,Oral,NA,NA,NA,NA,10/12/2001,11/26/2002,2002,treatment of Attention-Deficit Hyperactivity Disorder (ADHD) for children and adolescents ages 6-18 and adults,NA,Standard,No,No,N/A,No,N/A,N/A,N/A,NA,2001-10-12,2002-11-26,410,6.016157159698354,Early-PDUFA
Extraneal,icodextrin,Baxter Healthcare,NDA,21321,NA,NA,Solution,Intraperitoneal,NA,NA,NA,NA,12/22/2000,12/20/2002,2002,indicated for a single daily exchange for the long (8-16-hour) dwell during continuous ambulatory peritoneal dialysis (CAPD) or automated peritoneal dialysis (APD) for the management of chronic renal failure,NA,Standard,Yes,No,N/A,No,N/A,N/A,N/A,NA,2000-12-22,2002-12-20,728,6.590301048196686,Early-PDUFA
Relpax,eletriptan hydrobromide,Pfizer,NDA,21016,NA,NA,Tablet,Oral,NA,NA,NA,NA,10/27/1998,12/26/2002,2002,acute treatment of migraine,NA,Standard,No,No,N/A,No,N/A,N/A,N/A,NA,1998-10-27,2002-12-26,1521,7.327123292259293,Early-PDUFA
Humira,adalimumab,Abbott Laboratories,BLA,125057,NA,NA,Injectable,Injection,NA,NA,NA,NA,3/29/2002,12/31/2002,2002,indicated for reducing signs and symptoms and inhibiting the progression of structural damage in adult patients with moderately to severely active rheumatoid arthritis who have had an inadequate response to one or more disease-modifying anti-rheumatic drugs (DMARDs),NA,Standard,No,No,N/A,No,N/A,N/A,N/A,NA,2002-03-29,2002-12-31,277,5.6240175061873385,Early-PDUFA
Amevive,alefacept,Biogen,BLA,125036,NA,NA,Injectable,Injection,NA,NA,NA,NA,8/6/2001,1/30/2003,2003,treatment of adult patients with moderate to severe chronic plaque psoriasis who are candidates for systemic therapy or phototherapy,NA,Standard,No,No,N/A,No,N/A,N/A,N/A,NA,2001-08-06,2003-01-30,542,6.295266001439646,Mid-PDUFA
Fuzeon,enfuvirtide,Hoffmann-La Roche,NDA,21481,NA,NA,Injectable,Subcutaneous,NA,NA,NA,NA,9/16/2002,3/13/2003,2003,"in combination with other antiretroviral agents, for the treatment of HIV-1 infection in treatment experienced patients with evidence of HIV-1 replication despite ongoing antiretroviral therapy",NA,Priority,No,Yes,N/A,Yes,N/A,N/A,N/A,NA,2002-09-16,2003-03-13,178,5.181783550292085,Mid-PDUFA
Somavert,pegvisomant,Pharmacia and Upjohn,BLA,21106,NA,NA,Injectable,Subcutaneous,NA,NA,NA,NA,12/26/2000,3/25/2003,2003,"treatment of acromegaly in patients who have an inadequate response to surgery and/or radiation therapy and/or other medical therapies, or for whom these therapies are not appropriate",NA,Priority,Yes,No,N/A,Yes,N/A,N/A,N/A,Transition Product from NDA to BLA due to BPCI : Please see page 2 of data dictionary for more information.,2000-12-26,2003-03-25,819,6.70808408385307,Mid-PDUFA
Emend,aprepitant,Merck,NDA,21549,NA,NA,Capsule,Oral,NA,NA,NA,NA,9/27/2002,3/26/2003,2003,"in combination with other antiemetic agents, for the prevention of acute and delayed nausea and vomiting associated with initial and repeat courses of highly emetogenic cancer chemotherapy, including high-dose cisplatin",NA,Priority,No,No,N/A,No,N/A,N/A,N/A,NA,2002-09-27,2003-03-26,180,5.19295685089021,Mid-PDUFA
Factive,gemifloxacin mesylate,LG Life Sciences,NDA,21158,NA,NA,Tablet,Oral,NA,NA,NA,NA,12/16/1999,4/4/2003,2003,treatment of community-acquired pneumonia and acute bacterial exacerbation of chronic bronchitis,NA,Standard,No,No,N/A,No,N/A,N/A,N/A,NA,1999-12-16,2003-04-04,1205,7.094234845924755,Mid-PDUFA
Fabrazyme,agalsidase beta,Genzyme,BLA,103979,NA,NA,Injectable,Injection,NA,NA,NA,NA,6/23/2000,4/24/2003,2003,indicated for use in patients with Fabry disease to reduce globotriaosylceramide (GL-3) deposition in capillary endothelium of the kidney and certain other cell types,NA,Priority,Yes,Yes,N/A,Yes,N/A,N/A,N/A,NA,2000-06-23,2003-04-24,1035,6.942156705699469,Mid-PDUFA
Aldurazyme,laronidase,Biomarin Pharmaceutical,BLA,125058,NA,NA,Injectable,Injection,NA,NA,NA,NA,7/29/2002,4/30/2003,2003,indicated for patients with Hurler and Hurler-Scheie forms of Mucopolysaccharidosis I (MPS I) and for patients with the Scheie form who have moderate to severe symptoms,NA,Priority,Yes,No,N/A,Yes,N/A,N/A,N/A,NA,2002-07-29,2003-04-30,275,5.616771097666572,Mid-PDUFA
Iressa,gefitinib,AstraZeneca Pharmaceuticals,NDA,21399,NA,NA,Tablet,Oral,NA,NA,NA,NA,8/5/2002,5/5/2003,2003,indicated as monotherapy for the treatment of patients with locally advanced or metastatic non-small cell lung cancer after failure of both platinum-based and docetaxel chemotherapies,NA,Priority,No,Yes,N/A,Yes,N/A,N/A,N/A,NA,2002-08-05,2003-05-05,273,5.60947179518496,Mid-PDUFA
Velcade,bortezomib,Millennium Pharmaceuticals,NDA,21602,NA,NA,Injectable,"Intravenous, Subcutaneous",NA,NA,NA,NA,1/21/2003,5/13/2003,2003,treatment of multiple myeloma patients who have received at least two prior therapies and have demonstrated disease progression on the last therapy,NA,Priority,Yes,Yes,N/A,Yes,N/A,N/A,N/A,NA,2003-01-21,2003-05-13,112,4.718498871295094,Mid-PDUFA
Boniva,ibandronate sodium,Hoffmann-La Roche,NDA,21455,NA,NA,Tablet,Oral,NA,NA,NA,NA,7/16/2002,5/16/2003,2003,treatment and prevention of postmenopausal osteoporosis,NA,Standard,No,No,N/A,No,N/A,N/A,N/A,NA,2002-07-16,2003-05-16,304,5.717027701406222,Mid-PDUFA
Uroxatral,alfuzosin hydrochloride,Sanofi-Synthelabo,NDA,21287,NA,NA,"Tablet, Extended Release",Oral,NA,NA,NA,NA,12/8/2000,6/12/2003,2003,treatment of the signs and symptoms of benign prostatic hyperplasia (BPH),NA,Standard,No,No,N/A,No,N/A,N/A,N/A,NA,2000-12-08,2003-06-12,916,6.82001636467413,Mid-PDUFA
Reyataz,atazanavir sulfate,Bristol-Myers Squibb,NDA,21567,NA,NA,Capsule,Oral,NA,NA,NA,NA,12/20/2002,6/20/2003,2003,in combination with other antiretroviral agents for the treatment of HIV-1 infection in adults,NA,Priority,No,No,N/A,No,N/A,N/A,N/A,NA,2002-12-20,2003-06-20,182,5.204006687076795,Mid-PDUFA
Xolair,omalizumab,Genentech,BLA,103976,NA,NA,Injectable,Injection,NA,NA,NA,NA,6/5/2000,6/20/2003,2003,indicated for adults and adolescents (12 years of age and above) with moderate to severe persistent asthma who have a positive skin test or in vitro reactivity to a perennial aeroallergen and whose symptoms are inadequately controlled with inhaled corticosteroids,NA,Standard,No,No,N/A,No,N/A,N/A,N/A,NA,2000-06-05,2003-06-20,1110,7.01211529430638,Mid-PDUFA
Bexxar,"tositumomab, iodine I 131 tositumomab",Corixa,BLA,125011,NA,NA,Injectable,Injection,NA,NA,NA,NA,9/15/2000,6/27/2003,2003,"indicated for the treatment of patients with CD20 positive, follicular, non-Hodgkin's lymphoma, with and without transformation, whose disease is refractory to Rituximab and has relapsed following chemotherapy",NA,Priority,Yes,No,N/A,Yes,N/A,N/A,N/A,NA,2000-09-15,2003-06-27,1015,6.922643891475888,Mid-PDUFA
Emtriva,emtricitabine,Gilead Sciences,NDA,21500,NA,NA,Capsule,Oral,NA,NA,NA,NA,9/3/2002,7/2/2003,2003,indicated for the treatment of HIV infection in adults,NA,Standard,No,No,N/A,Yes,N/A,N/A,N/A,NA,2002-09-03,2003-07-02,302,5.71042701737487,Mid-PDUFA
Aloxi,palonosetron hydrochloride,Helsinn Healthcare,NDA,21372,NA,NA,Injectable,Intravenous,NA,NA,NA,NA,9/27/2002,7/25/2003,2003,prevention of acute nausea and vomiting associated with initial and repeat courses of moderately and highly emetogenic cancer chemotherapy; prevention of delayed nausea and vomiting associated with initial and repeat courses of moderately emetogenic cancer chemotherapy,NA,Standard,No,No,N/A,No,N/A,N/A,N/A,NA,2002-09-27,2003-07-25,301,5.707110264748875,Mid-PDUFA
Zavesca,miglustat,Actelion Pharmaceuticals,NDA,21348,NA,NA,Capsule,Oral,NA,NA,NA,NA,8/21/2001,7/31/2003,2003,"treatment of mild to moderate Type I Gaucher disease in adults for whom enzyme replacement therapy is not a therapeutic option (e.g., due to constraints such as allergy, hypersensitivity, or poor venous access)",NA,Standard,Yes,No,N/A,Yes,N/A,N/A,N/A,NA,2001-08-21,2003-07-31,709,6.5638555265321274,Mid-PDUFA
Crestor,rosuvastatin calcium,AstraZeneca Pharmaceuticals,NDA,21366,NA,NA,Tablet,Oral,NA,NA,NA,NA,6/26/2001,8/12/2003,2003,"indicated as an adjunct to diet to reduce elevated total-C in patients with primary hypercholesterolemia (heterozygous familial and nonfamilial) and mixed dyslipidemia (Frederickson Type IIa and IIb);  as an adjunct to diet for the treatment of patients with elevated serum TG levels (Frederickson Type IV); indicated to reduce LDL-C, total-C, and ApoB in patients with homozygous familial hypercholesterolemia as an adjunct to other lipid-lowering treatments (e.g., LDL apheresis) or if such treatments are unavailable)",NA,Standard,No,No,N/A,No,N/A,N/A,N/A,NA,2001-06-26,2003-08-12,777,6.655440350367647,Mid-PDUFA
Levitra,vardenafil hydrochloride,Bayer,NDA,21400,NA,NA,Tablet,Oral,NA,NA,NA,NA,9/24/2001,8/19/2003,2003,treatment of erectile dysfunction,NA,Standard,No,No,N/A,No,N/A,N/A,N/A,NA,2001-09-24,2003-08-19,694,6.542471960506805,Mid-PDUFA
Cubicin,daptomycin,Cubist Pharmaceuticals,NDA,21572,NA,NA,Powder,Intravenous,NA,NA,NA,NA,12/20/2002,9/12/2003,2003,treatment of complicated skin and skin structure infections caused by susceptible strains of Gram-positive microorganisms,NA,Priority,No,No,N/A,No,N/A,N/A,N/A,NA,2002-12-20,2003-09-12,266,5.583496308781699,Mid-PDUFA
Radiogardase,prussian blue,Heyl Chemisch-pharmazeutische Fabrik GmbH,NDA,21626,NA,NA,Capsule,Oral,NA,NA,NA,NA,3/13/2003,10/2/2003,2003,treatment of patients with known or suspected internal contamination with radioactive cesium and/or radioactive or non-radioactive thallium to increase their rates of elimination,NA,Priority,Yes,No,N/A,No,N/A,N/A,N/A,NA,2003-03-13,2003-10-02,203,5.313205979041787,Mid-PDUFA
Elestat,epinastine hydrochloride,Allergan,NDA,21565,NA,NA,Solution/Drops,Ophthalmic,NA,NA,NA,NA,12/20/2002,10/16/2003,2003,prevention of itching associated with allergic conjunctivitis,NA,Standard,No,No,N/A,No,N/A,N/A,N/A,NA,2002-12-20,2003-10-16,300,5.703782474656201,Mid-PDUFA
Namenda,memantine hydrochloride,Forest Laboratories,NDA,21487,NA,NA,Tablet,Oral,NA,NA,NA,NA,12/19/2002,10/16/2003,2003,treatment of moderate to severe dementia of the Alzheimer's type,NA,Standard,No,No,N/A,No,N/A,N/A,N/A,NA,2002-12-19,2003-10-16,301,5.707110264748875,Mid-PDUFA
Raptiva,efalizumab,Genentech,BLA,125075,NA,NA,Injectable,Injection,NA,NA,NA,NA,12/27/2002,10/27/2003,2003,treatment of adult patients (18 years or older) with chronic moderate to severe plaque psoriasis who are candidates for systemic therapy or phototherapy,NA,Standard,No,No,N/A,No,N/A,N/A,N/A,NA,2002-12-27,2003-10-27,304,5.717027701406222,Mid-PDUFA
Cialis,tadalafil,Lilly Icos,NDA,21368,NA,NA,Tablet,Oral,NA,NA,NA,NA,6/29/2001,11/21/2003,2003,treatment of erectile dysfunction,NA,Standard,No,No,N/A,No,N/A,N/A,N/A,NA,2001-06-29,2003-11-21,875,6.774223886357614,Mid-PDUFA
Plenaxis,abarelix,Praecis Pharmaceuticals,NDA,21320,NA,NA,Injectable,Intramuscular,NA,NA,NA,NA,12/12/2000,11/25/2003,2003,"palliative treatment of men with advanced symptomatic prostate cancer, in whom LHRH agonist therapy is not appropriate and who refuse surgical castration, and have one or more of the following:  risk of neurological compromise due to metastases, ureteral or bladder outlet obstruction due to local encroachment or metastatic disease, or severe bone pain from skeletal metastases persisting on narcotic analgesia",NA,Priority,No,No,N/A,No,N/A,N/A,N/A,NA,2000-12-12,2003-11-25,1078,6.982862751468942,Mid-PDUFA
Ertaczo,sertaconazole nitrate,Mylan Pharmaceuticals,NDA,21385,NA,NA,Cream,Topical,NA,NA,NA,NA,9/28/2001,12/10/2003,2003,"treatment of interdigital tinea pedis in immunocompetent patients 12 years of age and older, caused by Trichophyton rubrum, Trichophyton mentagrophytes, and Epidermophyton floccosum",NA,Standard,No,No,N/A,No,N/A,N/A,N/A,NA,2001-09-28,2003-12-10,803,6.688354713946762,Mid-PDUFA
Spiriva Handihaler,tiotropium bromide,Boehringer Ingelheim Pharmaceuticals,NDA,21395,NA,NA,Powder,Inhalation,NA,NA,NA,NA,12/13/2001,1/30/2004,2004,"long-term, once-daily, maintenance treatment of bronchospasm associated with chronic obstructive pulmonary disease (COPD), including chronic bronchitis and emphysema",NA,Standard,No,No,N/A,No,N/A,N/A,N/A,NA,2001-12-13,2004-01-30,778,6.656726524178391,Mid-PDUFA
Alimta,pemetrexed disodium,Eli Lilly,NDA,21462,NA,NA,Powder,Intravenous,NA,NA,NA,NA,9/30/2003,2/4/2004,2004,treatment of patients with malignant pleural mesothelioma whose disease is either unresectable or who are otherwise not candidates for curative surgery,NA,Priority,Yes,No,N/A,Yes,N/A,N/A,N/A,NA,2003-09-30,2004-02-04,127,4.844187086458591,Mid-PDUFA
Erbitux,cetuximab,ImClone Systems,BLA,125084,NA,NA,Injectable,Injection,NA,NA,NA,NA,8/14/2003,2/12/2004,2004,"in combination with irinotecan for treatment of EGFR-expressing, metastatic colorectal carcinoma in patients who are refractory to irinotecan-based chemotherapy; as a single agent for treatment of EGFR-expressing, metastatic colorectal carcinoma in patients who are intolerant to irinotecan-based chemotherapy",NA,Priority,No,Yes,N/A,Yes,N/A,N/A,N/A,NA,2003-08-14,2004-02-12,182,5.204006687076795,Mid-PDUFA
Avastin,bevacizumab,Genentech,BLA,125085,NA,NA,Injectable,Injection,NA,NA,NA,NA,9/30/2003,2/26/2004,2004,in combination with intravenous 5-fluorouracil-based chemotherapy is indicated for the first-line treatment of patients with metastatic carcinoma of the colon and rectum,NA,Priority,No,No,N/A,Yes,N/A,N/A,N/A,NA,2003-09-30,2004-02-26,149,5.003946305945459,Mid-PDUFA
Sensipar,cinacalcet hydrochloride,Amgen,NDA,21688,NA,NA,Tablet,Oral,NA,NA,NA,NA,9/8/2003,3/8/2004,2004,"[A] treatment of secondary hyperparathyroidism in patients with chronic kidney disease on dialysis
[B] treatment of hypercalcemia in patients with parathyroid carcinoma",NA,Priority,Yes (indication [B] only),No,N/A,No,N/A,N/A,N/A,NA,2003-09-08,2004-03-08,182,5.204006687076795,Mid-PDUFA
Ketek,telithromycin,Aventis Pharmaceuticals,NDA,21144,NA,NA,Tablet,Oral,NA,NA,NA,NA,3/1/2000,4/1/2004,2004,"treatment of infections caused by susceptible strains of  designated microorganisms in the conditions listed below, for patients 18 years old and above:  acute bacterial exacerbation of chronic bronchitis,  acute bacterial sinusitis, community-acquired pneumonia (of mild to moderate severity)",NA,Standard,No,No,N/A,No,N/A,N/A,N/A,NA,2000-03-01,2004-04-01,1492,7.307872780763706,Mid-PDUFA
ChiRhoStim,human secretin,ChiRhoClin,NDA,21256,NA,NA,For Solution,Intravenous,NA,NA,NA,NA,6/14/2001,4/9/2004,2004,"indicated for stimulation of pancreatic secretions, including bicarbonate, to aid in the diagnosis of pancreatic exocrine dysfunction; also indicated for stimulation of gastrin secretion to aid in the diagnosis of gastrinoma; also indicated for stimulation of pancreatic secretions to facilitate the identification of the ampulla of Vater and accessory papilla during endoscopic retrograde cholangiopancreatography (ERCP)",NA,Priority,Yes,No,N/A,No,N/A,N/A,N/A,NA,2001-06-14,2004-04-09,1030,6.937314081223682,Mid-PDUFA
Apidra,insulin glulisine,Aventis Pharmaceuticals,BLA,21629,NA,NA,Injectable,"Intravenous, Subcutaneous",NA,NA,NA,NA,6/18/2003,4/16/2004,2004,treatment of adult patients with diabetes mellitus for the control of hyperglycemia,NA,Standard,No,No,N/A,No,N/A,N/A,N/A,Transition Product from NDA to BLA due to BPCI : Please see page 2 of data dictionary for more information.,2003-06-18,2004-04-16,303,5.713732805509369,Mid-PDUFA
Apokyn,apomorphine hydrochloride,Bertek Pharmaceuticals,NDA,21264,NA,NA,Injectable,Subcutaneous,NA,NA,NA,NA,1/2/2003,4/20/2004,2004,"indicated for the acute, intermittent treatment of hypomobility, ""off"" episodes (""end-of-dose wearing off"" and unpredictable ""on/off"" episodes) associated with advanced Parkinson's disease",NA,Priority,Yes,No,N/A,Yes,N/A,N/A,N/A,NA,2003-01-02,2004-04-20,474,6.161207321695077,Mid-PDUFA
Vitrase,hyaluronidase (ovine),Ista Pharmaceuticals,BLA,21640,NA,NA,Injectable,Injection,NA,NA,NA,NA,8/5/2003,5/5/2004,2004,indicated as an adjuvant to increase the absorption and dispersion of other injected drugs; for hypodermoclysis; and as an adjunct in subcutaneous urography for improving resorption of radiopaque agents,NA,Priority,No,No,N/A,No,N/A,N/A,N/A,Transition Product from NDA to BLA due to BPCI : Please see page 2 of data dictionary for more information.,2003-08-05,2004-05-05,274,5.6131281063880705,Mid-PDUFA
Tindamax,tinidazole,Presutti Laboratories,NDA,21618,21681,21682,Tablet,Oral,Tablet,Oral,Tablet,Oral,7/17/2003,5/17/2004,2004,"[A] treatment of trichomoniasis
[B] treatment of giardiasis
[C] treatment of amebiasis and amebic liver abscess",NA,Standard,Yes (indication [B] and [C] only),No,N/A,No,N/A,N/A,N/A,NA,2003-07-17,2004-05-17,305,5.720311776607412,Mid-PDUFA
Vidaza,azacitidine,Pharmion,NDA,50794,NA,NA,Powder,"Intravenous, Subcutaneous",NA,NA,NA,NA,12/29/2003,5/19/2004,2004,"treatment of patients with the following myelodysplastic syndrome subtypes: refractory anemia or refractory anemia with ringed sideroblasts (if accompanied by neutropenia or thrombocytopenia and requiring transfusions), refractory anemia with excess blasts, refractory anemia with excess blasts in transformation, and chronic myelomonocytic leukemia",NA,Priority,Yes,No,N/A,Yes,N/A,N/A,N/A,NA,2003-12-29,2004-05-19,142,4.955827057601261,Mid-PDUFA
Xifaxan,rifaximin,Salix Pharmaceuticals,NDA,21361,NA,NA,Tablet,Oral,NA,NA,NA,NA,12/26/2001,5/25/2004,2004,treatment of patients (> 12 years of age) with travelers' diarrhea caused by noninvasive strains of Escherichia coli,NA,Standard,No,No,N/A,No,N/A,N/A,N/A,NA,2001-12-26,2004-05-25,881,6.78105762593618,Mid-PDUFA
Sanctura,trospium chloride,Indevus Pharmaceuticals,NDA,21595,NA,NA,Tablet,Oral,NA,NA,NA,NA,4/29/2003,5/28/2004,2004,"treatment of overactive bladder associated with symptoms of urge urinary incontinence, urgency, and urinary frequency",NA,Standard,No,No,N/A,No,N/A,N/A,N/A,NA,2003-04-29,2004-05-28,395,5.978885764901122,Mid-PDUFA
NutreStore,l-glutamine,Nutritional Restart Pharmaceutical,NDA,21667,NA,NA,For Solution,Oral,NA,NA,NA,NA,8/11/2003,6/10/2004,2004,treatment of short bowel syndrome in patients receiving specialized nutritional support when used in conjunction with a recombinant human growth that is approved for this indication,NA,Standard,Yes,No,N/A,No,N/A,N/A,N/A,NA,2003-08-11,2004-06-10,304,5.717027701406222,Mid-PDUFA
NeutroSpec,technetium Tc 99m fanolesomab,Palatin Technologies,BLA,103928,NA,NA,Injectable,Injection,NA,NA,NA,NA,11/22/1999,7/2/2004,2004,indicated for scintigraphic imaging of patients with equivocal signs and symptoms of appendicitis who are five years of age or older,NA,Standard,No,No,N/A,No,N/A,N/A,N/A,NA,1999-11-22,2004-07-02,1684,7.428927194802272,Mid-PDUFA
Campral,acamprosate calcium,Lipha Pharmaceuticals,NDA,21431,NA,NA,"Tablet, Delayed Release",Oral,NA,NA,NA,NA,12/27/2001,7/29/2004,2004,indicated for the maintenance of abstinence from alcohol in patients with alcohol dependence who are abstinent at treatment initiation,NA,Priority,No,No,N/A,No,N/A,N/A,N/A,NA,2001-12-27,2004-07-29,945,6.851184927493743,Mid-PDUFA
Cymbalta,duloxetine hydrochloride,Eli Lilly,NDA,21427,NA,NA,"Capsule, Delayed Release Pellets",Oral,NA,NA,NA,NA,11/13/2001,8/3/2004,2004,treatment of major depressive disorder (MDD),NA,Standard,No,No,N/A,No,N/A,N/A,N/A,NA,2001-11-13,2004-08-03,994,6.901737206656574,Mid-PDUFA
[drug marketed without a proprietary name],pentetate calcium trisodium,Hameln Pharmaceuticals GmbH,NDA,21749,NA,NA,Solution,"Inhalation, Intravenous",NA,NA,NA,NA,4/28/2004,8/11/2004,2004,"treatment of internal contamination with plutonium, americium or curium to increase the rates of elimination",NA,Priority,Yes,No,N/A,No,N/A,N/A,N/A,NA,2004-04-28,2004-08-11,105,4.653960350157523,Mid-PDUFA
[drug marketed without a proprietary name],pentetate zinc trisodium,Hameln Pharmaceuticals GmbH,NDA,21751,NA,NA,Solution,"Inhalation, Intravenous",NA,NA,NA,NA,4/28/2004,8/11/2004,2004,"treatment of internal contamination with plutonium, americium or curium to increase the rates of elimination",NA,Priority,Yes,No,N/A,No,N/A,N/A,N/A,NA,2004-04-28,2004-08-11,105,4.653960350157523,Mid-PDUFA
Amphadase,hyaluronidase (bovine),Amphastar Pharmaceuticals,BLA,21665,NA,NA,Injectable,Injection,NA,NA,NA,NA,7/7/2003,10/26/2004,2004,indicated as an adjuvant to increase the absorption and dispersion of other injected drugs; for hypodermoclysis; and as an adjunct in subcutaneous urography for improving resorption of radiopaque agents,NA,Priority,No,No,N/A,No,N/A,N/A,N/A,Transition Product from NDA to BLA due to BPCI : Please see page 2 of data dictionary for more information.,2003-07-07,2004-10-26,477,6.1675164908883415,Mid-PDUFA
Fosrenol,lanthanum carbonate hydrate,Shire Pharmaceutical Development,NDA,21468,NA,NA,"Tablet, Chewable",Oral,NA,NA,NA,NA,4/30/2002,10/26/2004,2004,indicated to reduce serum phosphate in patients with end stage renal disease,NA,Standard,No,No,N/A,No,N/A,N/A,N/A,NA,2002-04-30,2004-10-26,910,6.813444599510896,Mid-PDUFA
Omacor,omega-3-acid ethyl esters,Abbott Laboratories,NDA,21654,NA,NA,Capsule,Oral,NA,NA,NA,NA,1/12/2004,11/10/2004,2004,indicated as an adjunct to diet to reduce triglyceride (TG) levels in adult patients with TG levels > 500 mg/dL,NA,Standard,No,No,N/A,No,N/A,N/A,N/A,NA,2004-01-12,2004-11-10,303,5.713732805509369,Mid-PDUFA
Tarceva,erlotinib hydrochloride,OSI Pharmaceuticals,NDA,21743,NA,NA,Tablet,Oral,NA,NA,NA,NA,7/30/2004,11/18/2004,2004,treatment of locally advanced or metastatic Non Small-Cell Lung Cancer (NSCLC) after failure of at least one prior chemotherapy regimen,NA,Priority,No,No,N/A,Yes,N/A,N/A,N/A,NA,2004-07-30,2004-11-18,111,4.709530201312334,Mid-PDUFA
Vesicare,solifenacin succinate,Yamanouchi Pharma America,NDA,21518,NA,NA,Tablet,Oral,NA,NA,NA,NA,12/19/2002,11/19/2004,2004,"treatment of overactive bladder with symptoms of urge urinary incontinence, urgency, and urinary frequency",NA,Standard,No,No,N/A,No,N/A,N/A,N/A,NA,2002-12-19,2004-11-19,701,6.55250788703459,Mid-PDUFA
Multihance,gadobenate dimeglumine,Bracco Diagnostics,NDA,21357,21358,NA,Injectable,Intravenous,Injectable,Injection,NA,NA,4/27/2001,11/23/2004,2004,"indicated for intravenous use in magnetic resonance imaging (MRI) of the central nervous system in adults to visualize lesions with abnormal blood brain barrier or abnormal vascularity of the brain, spine, and associated tissues",NA,Standard,No,No,N/A,No,N/A,N/A,N/A,NA,2001-04-27,2004-11-23,1306,7.174724309836376,Mid-PDUFA
Tysabri,natalizumab,Biogen Idec,BLA,125104,NA,NA,Injectable,Injection,NA,NA,NA,NA,5/24/2004,11/23/2004,2004,treatment of patients with relapsing forms of multiple sclerosis (MS) to reduce the frequency of clinical exacerbations,NA,Priority,No,Yes,N/A,No,N/A,N/A,N/A,NA,2004-05-24,2004-11-23,183,5.209486152841421,Mid-PDUFA
Kepivance,palifermin,Amgen,BLA,125103,NA,NA,Injectable,Injection,NA,NA,NA,NA,6/15/2004,12/15/2004,2004,indicated to decrease the incidence and duration of severe oral mucositis in patients with hematologic malignancies receiving myelotoxic therapy requiring hematopoietic stem cell support,NA,Priority,No,No,N/A,Yes,N/A,N/A,N/A,NA,2004-06-15,2004-12-15,183,5.209486152841421,Mid-PDUFA
Lunesta,eszopiclone,Sepracor,NDA,21476,NA,NA,Tablet,Oral,NA,NA,NA,NA,1/31/2003,12/15/2004,2004,treatment of insomnia,NA,Standard,No,No,N/A,No,N/A,N/A,N/A,NA,2003-01-31,2004-12-15,684,6.52795791762255,Mid-PDUFA
VisionBlue,trypan blue,Dutch Ophthalmic USA,NDA,21670,NA,NA,Solution,Ophthalmic,NA,NA,NA,NA,10/27/2003,12/16/2004,2004,indicated as an aid in ophthalmic surgery by staining the anterior capsule of the lens,NA,Priority,No,No,N/A,No,N/A,N/A,N/A,NA,2003-10-27,2004-12-16,416,6.030685260261263,Mid-PDUFA
Macugen,pegaptanib sodium,Eyetech Pharmaceuticals,NDA,21756,NA,NA,Injectable,Intravitreal,NA,NA,NA,NA,6/17/2004,12/17/2004,2004,treatment of neovascular (wet) age-related macular degeneration,NA,Priority,No,No,N/A,Yes,N/A,N/A,N/A,NA,2004-06-17,2004-12-17,183,5.209486152841421,Mid-PDUFA
Enablex,darifenacin hydrobromide,Novartis Pharmaceuticals,NDA,21513,NA,NA,"Tablet, Extended Release",Oral,NA,NA,NA,NA,12/3/2002,12/22/2004,2004,treatment of overactive bladder,NA,Standard,No,No,N/A,No,N/A,N/A,N/A,NA,2002-12-03,2004-12-22,750,6.620073206530356,Mid-PDUFA
Prialt,ziconotide,Elan Pharmaceuticals,NDA,21060,NA,NA,Injectable,Intrathecal,NA,NA,NA,NA,12/28/1999,12/28/2004,2004,"management of severe chronic pain in patients for whom intrathecal (IT) therapy is warranted and who are intolerant of or refractory to other treatment, such as systemic analgesics, adjunctive therapies, or IT morphine",NA,Priority,No,No,N/A,No,N/A,N/A,N/A,NA,1999-12-28,2004-12-28,1827,7.510430556378006,Mid-PDUFA
Clolar,clofarbine,Genzyme,NDA,21673,NA,NA,Solution,Intravenous,NA,NA,NA,NA,3/30/2004,12/28/2004,2004,treatment of pediatric patients 1 to 21 years old with relapsed or refractory acute lymphoblastic leukemia after at least two prior regimens,NA,Priority,Yes,Yes,N/A,Yes,N/A,N/A,N/A,NA,2004-03-30,2004-12-28,273,5.60947179518496,Mid-PDUFA
Ventavis,iloprost,CoTherix,NDA,21779,NA,NA,Solution,Inhalation,NA,NA,NA,NA,6/30/2004,12/29/2004,2004,treatment of pulmonary arterial hypertension (WHO Group I) in patients with NYHA Class III or IV symptoms,NA,Priority,Yes,No,N/A,No,N/A,N/A,N/A,NA,2004-06-30,2004-12-29,182,5.204006687076795,Mid-PDUFA
Lyrica,pregabalin,Pfizer,NDA,21446,21723,NA,Capsule,Oral,Capsule,Oral,NA,NA,10/31/2003,12/30/2004,2004,"[A] management of neuropathic pain associated with diabetic peripheral neuropathy
[B] management of postherpetic neuralgia",NA,Priority (indication [A] only),No,No,N/A,No,N/A,N/A,N/A,NA,2003-10-31,2004-12-30,426,6.054439346269371,Mid-PDUFA
Symlin,pramlintide acetate,Amylin Pharmaceuticals,NDA,21332,NA,NA,Injectable,Subcutaneous,NA,NA,NA,NA,12/8/2000,3/16/2005,2005,"indicated for type 1 diabetes, as an adjunct treatment in patients who use mealtime insulin therapy and who have failed to achieve desired glucose control despite optimal insulin therapy; indicated for type 2 diabetes, as an adjunct treatment in patients who use mealtime insulin therapy and who have failed to achieve desired glucose control despite optimal insulin therapy, with or without a concurrent sulfonylurea agent and/or metformin",NA,Standard,No,No,N/A,No,N/A,N/A,N/A,NA,2000-12-08,2005-03-16,1559,7.351799869057777,Mid-PDUFA
Mycamine,micafungin sodium,Fujisawa Healthcare,NDA,21506,21754,NA,Injectable,Intravenous,Injectable,Injection,NA,NA,4/29/2002,3/16/2005,2005,"[A] prophylaxis of Candida infections in patients undergoing hematopoietic stem cell transplantation
[B] treatment of esophageal candidiasis",NA,Priority (indication [A] only),No,No,N/A,No,N/A,N/A,N/A,NA,2002-04-29,2005-03-16,1052,6.9584483932976555,Mid-PDUFA
Baraclude,entecavir,Bristol-Myers Squibb,NDA,21797,21798,NA,Tablet,Oral,Solution,Oral,NA,NA,9/29/2004,3/29/2005,2005,treatment of chronic hepatitis B virus infection in adults with evidence of active viral replication and either evidence of persistent elevations in serum aminotransferases (ALT or AST) or histologically active disease,NA,Priority,No,No,N/A,No,N/A,N/A,N/A,NA,2004-09-29,2005-03-29,181,5.198497031265826,Mid-PDUFA
Byetta,exenatide,Amylin Pharmaceuticals,NDA,21773,NA,NA,Injectable,Subcutaneous,NA,NA,NA,NA,6/30/2004,4/28/2005,2005,"indicated to improve glycemic control in patients with type 2 diabetes mellitus who have not achieved adequate glycemic control on metformin, a sulfonylurea, or a combination of metformin and a sulfonylurea",NA,Standard,No,No,N/A,No,N/A,N/A,N/A,NA,2004-06-30,2005-04-28,302,5.71042701737487,Mid-PDUFA
Naglazyme,galsulfase,Biomarin Pharmaceutical,BLA,125117,NA,NA,Injectable,Injection,NA,NA,NA,NA,11/29/2004,5/31/2005,2005,treatment of patients with Mucopolysaccharidosis VI (MPS VI),NA,Priority,Yes,No,N/A,Yes,N/A,N/A,N/A,NA,2004-11-29,2005-05-31,183,5.209486152841421,Mid-PDUFA
Tygacil,tigecycline,Wyeth Pharmaceuticals,NDA,21821,NA,NA,Powder,Intravenous,NA,NA,NA,NA,12/15/2004,6/15/2005,2005,treatment of Complicated Skin and Skin Structure Infections (cSSSI) and Complicated Intra-abdominal Infections (cIAI),NA,Priority,No,No,N/A,No,N/A,N/A,N/A,NA,2004-12-15,2005-06-15,182,5.204006687076795,Mid-PDUFA
Levemir,insulin detemir,Novo Nordisk,BLA,21536,NA,NA,Injectable,Subcutaneous,NA,NA,NA,NA,12/5/2002,6/16/2005,2005,treatment of adult patients with Type 1 or Type 2 diabetes mellitus who require basal (long-acting) insulin for the control of hyperglycemia,NA,Standard,No,No,N/A,No,N/A,N/A,N/A,Transition Product from NDA to BLA due to BPCI : Please see page 2 of data dictionary for more information.,2002-12-05,2005-06-16,924,6.828712071641684,Mid-PDUFA
Aptivus,tipranavir,Boehringer Ingelheim Pharmaceuticals,NDA,21814,NA,NA,Capsule,Oral,NA,NA,NA,NA,12/22/2004,6/22/2005,2005,"co-administered with ritonavir, is indicated for combination antiretroviral treatment of HIV-1 infected adult patients with evidence of viral replication, who are highly treatment-experienced or have HIV-1 strains resistant to multiple protease inhibitors",NA,Priority,No,Yes,N/A,No,N/A,N/A,N/A,NA,2004-12-22,2005-06-22,182,5.204006687076795,Mid-PDUFA
Rozerem,ramelteon,Takeda Global Research & Development Center,NDA,21782,NA,NA,Tablet,Oral,NA,NA,NA,NA,9/22/2004,7/22/2005,2005,treatment of insomnia characterized by difficulty with sleep onset,NA,Standard,No,No,N/A,No,N/A,N/A,N/A,NA,2004-09-22,2005-07-22,303,5.713732805509369,Mid-PDUFA
Nevanac,nepafenac,Alcon,NDA,21862,NA,NA,Suspension/Drops,Ophthalmic,NA,NA,NA,NA,2/28/2005,8/19/2005,2005,treatment of pain and inflammation associated with cataract surgery,NA,Priority,No,No,N/A,No,N/A,N/A,N/A,NA,2005-02-28,2005-08-19,172,5.147494476813453,Mid-PDUFA
Increlex,mecasermin (rDNA origin),Tercica,BLA,21839,NA,NA,Injectable,Subcutaneous,NA,NA,NA,NA,2/28/2005,8/30/2005,2005,long-term treatment of growth failure in children with severe primary IGF-1 deficiency (Primary IGFD) or with growth hormone (GH) gene deletion who have developed neutralizing antibodies to growth hormone,NA,Priority,Yes,No,N/A,No,N/A,N/A,N/A,Transition Product from NDA to BLA due to BPCI : Please see page 2 of data dictionary for more information.,2005-02-28,2005-08-30,183,5.209486152841421,Mid-PDUFA
Hydase,hyaluronidase (bovine),PrimaPharm,BLA,21716,NA,NA,Injectable,Injection,NA,NA,NA,NA,10/20/2003,10/25/2005,2005,indicated as an adjuvant to increase the absorption and dispersion of other injected drugs; for hypodermoclysis; and as an adjunct in subcutaneous urography for improving resorption of radiopaque agents,NA,Priority,No,No,N/A,No,N/A,N/A,N/A,Transition Product from NDA to BLA due to BPCI : Please see page 2 of data dictionary for more information.,2003-10-20,2005-10-25,736,6.601230118728877,Mid-PDUFA
Arranon,nelarabine,GlaxoSmithKline,NDA,21877,NA,NA,Injectable,Intravenous,NA,NA,NA,NA,4/29/2005,10/28/2005,2005,treatment of patients with T-cell acute lymphoblastic leukemia and T-cell lymphoblastic lymphoma whose disease has not responded to or has relapsed following treatment with at least two chemotherapy regimens,NA,Priority,Yes,Yes,N/A,Yes,N/A,N/A,N/A,NA,2005-04-29,2005-10-28,182,5.204006687076795,Mid-PDUFA
Exjade,deferasirox,Novartis Pharmaceuticals,NDA,21882,NA,NA,"Tablet, For Suspension",Oral,NA,NA,NA,NA,5/2/2005,11/2/2005,2005,treatment of chronic iron overload due to blood transfusions (transfusional hemosiderosis) in patients 2 years of age and older,NA,Priority,Yes,Yes,N/A,Yes,N/A,N/A,N/A,NA,2005-05-02,2005-11-02,184,5.214935757608986,Mid-PDUFA
Hylenex,hyaluronidase (human),Halozyme Therapeutics,BLA,21859,NA,NA,Injectable,Injection,NA,NA,NA,NA,3/23/2005,12/2/2005,2005,indicated as an adjuvant to increase the absorption and dispersion of other injected drugs; for hypodermoclysis; and as an adjunct in subcutaneous urography for improving resorption of radiopaque agents,NA,Priority,No,No,N/A,No,N/A,N/A,N/A,Transition Product from NDA to BLA due to BPCI : Please see page 2 of data dictionary for more information.,2005-03-23,2005-12-02,254,5.537334267018537,Mid-PDUFA
Iplex,mecasermin rinfabate (rDNA origin),Insmed,BLA,21884,NA,NA,Injectable,Subcutaneous,NA,NA,NA,NA,1/3/2005,12/12/2005,2005,treatment of growth failure in children with severe primary IGF-1 deficiency (Primary IGFD) or with growth hormone (GH) gene deletion who have developed neutralizing antibodies to growth hormone,NA,Priority,Yes,No,N/A,No,N/A,N/A,N/A,Transition Product from NDA to BLA due to BPCI : Please see page 2 of data dictionary for more information.,2005-01-03,2005-12-12,343,5.8377304471659395,Mid-PDUFA
Nexavar,sorafenib tosylate,Bayer Pharmaceuticals,NDA,21923,NA,NA,Tablet,Oral,NA,NA,NA,NA,7/8/2005,12/20/2005,2005,treatment of patients with advanced renal cell carcinoma,NA,Priority,Yes,No,N/A,Yes,N/A,N/A,N/A,NA,2005-07-08,2005-12-20,165,5.10594547390058,Mid-PDUFA
Orencia,abatacept,Bristol-Myers Squibb,BLA,125118,NA,NA,Injectable,Injection,NA,NA,NA,NA,4/1/2005,12/23/2005,2005,"indicated for reducing signs and symptoms, inducing major clinical response, slowing the progression of structural damage, and improving physical function in adult patients with moderately to severely active rheumatoid arthritis who have had an inadequate response to one or more Disease Modifying Anti-Rheumatoid Drugs (DMARDs), such as methotrexate or TNF antagonists.  Abatacept may be used as monotherapy or concomitantly with DMARDs other than TNF antagonists",NA,Priority,No,No,N/A,Yes,N/A,N/A,N/A,NA,2005-04-01,2005-12-23,266,5.583496308781699,Mid-PDUFA
Revlimid,lenalidomide,Celgene,NDA,21880,NA,NA,Capsule,Oral,NA,NA,NA,NA,4/7/2005,12/27/2005,2005,treatment of patients with transfusion dependent anemia due to low or intermediate-1 risk myelodysplastic syndromes associated with a deletion 5q cytogenetic abnormality with or without additional cytogenetic abnormalities,NA,Priority,Yes,No,N/A,Yes,N/A,N/A,N/A,NA,2005-04-07,2005-12-27,264,5.575949103146316,Mid-PDUFA
Vaprisol,conivaptan hydrochloride,Astellas Pharma,NDA,21697,NA,NA,Injectable,Intravenous,NA,NA,NA,NA,1/30/2004,12/29/2005,2005,treatment of euvolemic hyponatremia in hospitalized patients,NA,Standard,No,No,N/A,No,N/A,N/A,N/A,NA,2004-01-30,2005-12-29,699,6.54965074223381,Mid-PDUFA
Sutent,sunitinib malate,Pfizer,NDA,21938,21968,NA,Capsule,Oral,Capsule,Oral,NA,NA,8/11/2005,1/26/2006,2006,"[A] treatment of gastrointestinal stromal tumor after disease progression on or intolerance to imatinib mesylate
[B] treatment of advanced renal cell carcinoma",NA,Priority,No,Yes (indication [B] only),N/A,Yes,N/A,N/A,N/A,NA,2005-08-11,2006-01-26,168,5.123963979403259,Mid-PDUFA
Ranexa,ranolazine,CV Therapeutics,NDA,21526,NA,NA,"Tablet, Extended Release",Oral,NA,NA,NA,NA,12/30/2002,1/27/2006,2006,treatment of chronic angina,NA,Standard,No,No,N/A,No,N/A,N/A,N/A,NA,2002-12-30,2006-01-27,1124,7.024649030453636,Mid-PDUFA
Amitiza,lubiprostone,Sucampo Pharmaceuticals,NDA,21908,NA,NA,Capsule,Oral,NA,NA,NA,NA,3/31/2005,1/31/2006,2006,treatment of chronic idiopathic constipation in the adult population,NA,Standard,No,No,N/A,No,N/A,N/A,N/A,NA,2005-03-31,2006-01-31,306,5.723585101952381,Mid-PDUFA
Eraxis,anidulafungin,Pfizer,NDA,21632,21948,NA,Powder,Intravenous,Injectable,Injection,NA,NA,4/25/2003,2/17/2006,2006,"[A] treatment of patients with esophageal candidiasis
[B] treatment of patients with candidemia and other forms of Candida infections (intra-abdominal abscess and peritonitis)",NA,Priority (indication [B] only),No,No,N/A,No,N/A,N/A,N/A,NA,2003-04-25,2006-02-17,1029,6.9363427358340495,Mid-PDUFA
Myozyme,alglucosidase alfa,Genzyme,BLA,125141,NA,NA,Injectable,Injection,NA,NA,NA,NA,7/28/2005,4/28/2006,2006,treatment of Pompe disease (GAA deficiency),NA,Priority,Yes,No,N/A,Yes,N/A,N/A,N/A,NA,2005-07-28,2006-04-28,274,5.6131281063880705,Mid-PDUFA
Dacogen,decitabine,MGI Pharma,NDA,21790,NA,NA,Injectable,Intravenous,NA,NA,NA,NA,11/1/2004,5/2/2006,2006,treatment of myelodysplastic syndrome (MDS),NA,Standard,Yes,No,N/A,Yes,N/A,N/A,N/A,NA,2004-11-01,2006-05-02,547,6.304448802421981,Mid-PDUFA
Chantix,varenicline,Pfizer,NDA,21928,NA,NA,Tablet,Oral,NA,NA,NA,NA,11/10/2005,5/10/2006,2006,indicated as an aid to smoking cessation treatment,NA,Priority,No,No,N/A,No,N/A,N/A,N/A,NA,2005-11-10,2006-05-10,181,5.198497031265826,Mid-PDUFA
Azilect,rasagiline mesylate,Teva Pharmaceuticals,NDA,21641,NA,NA,Tablet,Oral,NA,NA,NA,NA,9/5/2003,5/16/2006,2006,indicated for the treatment of the signs and symptoms of idiopathic Parkinson's disease as initial monotherapy and as adjunct therapy to levodopa,NA,Standard,No,No,N/A,No,N/A,N/A,N/A,NA,2003-09-05,2006-05-16,984,6.891625897052253,Mid-PDUFA
Prezista,darunavir,Tibotec,NDA,21976,NA,NA,Tablet,Oral,NA,NA,NA,NA,12/23/2005,6/23/2006,2006,"coadministered with ritonavir, indicated for the treatment of human immunodeficiency virus (HIV) infection in antiretroviral treatment-experienced adult patients, such as those with HIV-1 strains resistant to more than one protease inhibitor",NA,Priority,No,Yes,N/A,Yes,N/A,N/A,N/A,NA,2005-12-23,2006-06-23,182,5.204006687076795,Mid-PDUFA
Sprycel,dasatinib,Bristol-Myers Squibb,NDA,21986,22072,NA,Tablet,Oral,Tablet,Oral,NA,NA,12/28/2005,6/28/2006,2006,"[A] treatment of adults with chronic myeloid leukemia with resistance or intolerance to prior therapy including imatinib
[B] treatment of adults with Philadelphia chromosome-positive acute lymphoblastic leukemia with resistance or intolerance to prior therapy",NA,Priority,Yes,Yes (indication [A] only),N/A,Yes (indication [A] only),N/A,N/A,N/A,NA,2005-12-28,2006-06-28,182,5.204006687076795,Mid-PDUFA
Lucentis,ranibizumab,Genentech,BLA,125156,NA,NA,Injectable,Injection,NA,NA,NA,NA,12/30/2005,6/30/2006,2006,treatment of patients with neovascular (wet) age-related macular degeneration,NA,Priority,No,No,N/A,No,N/A,N/A,N/A,NA,2005-12-30,2006-06-30,182,5.204006687076795,Mid-PDUFA
Anthelios SX,"avobenzone, ecamsule, octocrylene",L'Oreal USA Products,NDA,21502,NA,NA,Cream,Topical,NA,NA,NA,NA,5/12/2005,7/21/2006,2006,prevention of sunburn and to help provide protection from UVA and UVB rays,NA,Standard,No,No,N/A,No,N/A,N/A,N/A,NA,2005-05-12,2006-07-21,435,6.075346031088684,Mid-PDUFA
Elaprase,idursulfase,Shire Human Genetic Therapies,BLA,125151,NA,NA,Injectable,Injection,NA,NA,NA,NA,11/23/2005,7/24/2006,2006,"treatment of patients with Hunter syndrome (Mucopolysaccharidosis II, MPS II)",NA,Priority,Yes,No,N/A,Yes,N/A,N/A,N/A,NA,2005-11-23,2006-07-24,243,5.493061443340548,Mid-PDUFA
Noxafil,posaconazole,Schering,NDA,22003,NA,NA,Suspension,Oral,NA,NA,NA,NA,12/22/2005,9/15/2006,2006,"prophylaxis of invasive Aspergillus and Candida infections in patients, 13 years of age and older, who are at high risk of developing these infections due to being severely immunocompromised, such as hematopoietic stem cell transplant (HSCT) recipients with Graft versus Host Disease (GVHD) or those with hematologic malignancies with prolonged neutropenia from chemotherapy",NA,Priority,No,No,N/A,No,N/A,N/A,N/A,NA,2005-12-22,2006-09-15,267,5.58724865840025,Mid-PDUFA
Vectibix,panitumumab,Amgen,BLA,125147,NA,NA,Injectable,Injection,NA,NA,NA,NA,3/29/2006,9/27/2006,2006,"treatment of EGFR-expressing metastatic colorectal carcinoma with disease progression on or following fluoropyrimidine, oxaliplatin, and irinotecan-containing chemotherapy regimens",NA,Priority,No,Yes,N/A,Yes,N/A,N/A,N/A,NA,2006-03-29,2006-09-27,182,5.204006687076795,Mid-PDUFA
Pylera,"biskalcitrate, metronidazole, tetracycline hydrochloride",Axcan Scandipharm,NDA,50786,NA,NA,Capsule,Oral,NA,NA,NA,NA,10/23/2001,9/28/2006,2006,"in combination with omeprazole, for the treatment of patients with Helicobacter pylori infection and duodenal ulcer disease (active or history of within the past 5 years) to eradicate H. pylori",NA,Standard,No,No,N/A,No,N/A,N/A,N/A,NA,2001-10-23,2006-09-28,1801,7.496097345175956,Mid-PDUFA
Zolinza,vorinostat,Merck,NDA,21991,NA,NA,Capsule,Oral,NA,NA,NA,NA,4/7/2006,10/6/2006,2006,"treatment of cutaneous manifestations in patients with cutaneous T-cell lymphoma (CTCL) who have progressive, persistent or recurrent disease on or following two systemic therapies",NA,Priority,Yes,No,N/A,Yes,N/A,N/A,N/A,NA,2006-04-07,2006-10-06,182,5.204006687076795,Mid-PDUFA
Januvia,sitagliptin phosphate,Merck,NDA,21995,NA,NA,Tablet,Oral,NA,NA,NA,NA,12/16/2005,10/16/2006,2006,"indicated as an adjunct to diet and exercise to improve glycemic control in patients with type 2 diabetes mellitus as monotherapy and in combination with metformin or a PPAR? agonist (e.g., thiazolidinediones) when diet and exercise plus the single agent do not provide adequate glycemic control",NA,Standard,No,No,N/A,No,N/A,N/A,N/A,NA,2005-12-16,2006-10-16,304,5.717027701406222,Mid-PDUFA
Omnaris,ciclesonide,Altana Pharma,NDA,22004,NA,NA,"Spray, Metered",Nasal,NA,NA,NA,NA,12/22/2005,10/20/2006,2006,treatment of seasonal and allergic rhinitis in patients 12 years of age and older,NA,Standard,No,No,N/A,No,N/A,N/A,N/A,NA,2005-12-22,2006-10-20,302,5.71042701737487,Mid-PDUFA
Tyzeka,telbivudine,Idenix Pharmaceuticals,NDA,22011,NA,NA,Tablet,Oral,NA,NA,NA,NA,12/30/2005,10/25/2006,2006,treatment of chronic hepatitis B (CHB) in patients with evidence of viral replication and active liver inflammation,NA,Standard,No,No,N/A,No,N/A,N/A,N/A,NA,2005-12-30,2006-10-25,299,5.700443573390687,Mid-PDUFA
Veregen,kunecatechins,Medigene,NDA,21902,NA,NA,Ointment,Topical,NA,NA,NA,NA,9/30/2005,10/31/2006,2006,treatment of external genital and perianal warts (Condylomata acuminata) in immunocompetent patients 18 years and older,NA,Standard,No,No,N/A,No,N/A,N/A,N/A,NA,2005-09-30,2006-10-31,396,5.981414211254481,Mid-PDUFA
Invega,paliperidone,Johnson & Johnson,NDA,21999,NA,NA,"Tablet, Extended Release",Oral,NA,NA,NA,NA,11/30/2005,12/19/2006,2006,treatment of schizophrenia,NA,Standard,No,No,N/A,No,N/A,N/A,N/A,NA,2005-11-30,2006-12-19,384,5.950642552587727,Mid-PDUFA
Vyvanse,lisdexamfetamine dimesylate,New River Pharmaceuticals,NDA,21977,NA,NA,Capsule,Oral,NA,NA,NA,NA,12/6/2005,2/23/2007,2007,treatment of Attention-Deficit Hyperactivity Disorder (ADHD) in children 6-12 years of age,NA,Standard,No,No,N/A,No,N/A,N/A,N/A,NA,2005-12-06,2007-02-23,444,6.095824562432225,Mid-PDUFA
Tekturna,aliskiren,Novartis Pharmaceuticals,NDA,21985,NA,NA,Tablet,Oral,NA,NA,NA,NA,2/13/2006,3/5/2007,2007,treatment of hypertension,NA,Standard,No,No,N/A,No,N/A,N/A,N/A,NA,2006-02-13,2007-03-05,385,5.953243334287785,Mid-PDUFA
Tykerb,lapatinib,GlaxoSmithKline,NDA,22059,NA,NA,Tablet,Oral,NA,NA,NA,NA,9/13/2006,3/13/2007,2007,"in combination with capecitabine for the treatment of patients with advanced or metastatic breast cancer whose tumors over-express HER2 (ErbB2) and who have received prior therapy including and anthracycline, a taxane and trastuzumab",NA,Priority,No,No,N/A,Yes,N/A,N/A,N/A,NA,2006-09-13,2007-03-13,181,5.198497031265826,Mid-PDUFA
Soliris,eculizumab,Alexion Pharmaceuticals,BLA,125166,NA,NA,Injectable,Injection,NA,NA,NA,NA,9/15/2006,3/16/2007,2007,treatment of paroxysmal nocturnal hemoglobinuria to reduce hemolysis,NA,Priority,Yes,No,N/A,No,N/A,N/A,N/A,NA,2006-09-15,2007-03-16,182,5.204006687076795,Mid-PDUFA
Altabax,retapamulin,GlaxoSmithKline,NDA,22055,NA,NA,Ointment,Topical,NA,NA,NA,NA,6/12/2006,4/12/2007,2007,treatment of impetigo,NA,Standard,No,No,N/A,No,N/A,N/A,N/A,NA,2006-06-12,2007-04-12,304,5.717027701406222,Mid-PDUFA
Neupro,rotigotine,Schwarz BioSciences,NDA,21829,NA,NA,"Film, Extended Release",Transdermal,NA,NA,NA,NA,1/28/2005,5/9/2007,2007,treatment of the signs and symptoms of early-stage idiopathic Parkinson’s disease,NA,Standard,No,No,N/A,No,N/A,N/A,N/A,NA,2005-01-28,2007-05-09,831,6.7226297948554485,Mid-PDUFA
Torisel,temsirolimus,Wyeth,NDA,22088,NA,NA,Solution,Intravenous,NA,NA,NA,NA,10/5/2006,5/30/2007,2007,treatment of advanced renal cell carcinoma,NA,Priority,Yes,No,N/A,Yes,N/A,N/A,N/A,NA,2006-10-05,2007-05-30,237,5.4680601411351315,Mid-PDUFA
Letairis,ambrisentan,Gilead Sciences,NDA,22081,NA,NA,Tablet,Oral,NA,NA,NA,NA,12/18/2006,6/15/2007,2007,treatment of pulmonary arterial hypertension (WHO Group I) in patients with WHO class II or III symptoms to improve exercise capacity and delay clinical worsening,NA,Priority,Yes,No,N/A,Yes,N/A,N/A,N/A,NA,2006-12-18,2007-06-15,179,5.187385805840755,Mid-PDUFA
Selzentry,maraviroc,Pfizer,NDA,22128,NA,NA,Tablet,Oral,NA,NA,NA,NA,12/20/2006,8/6/2007,2007,treatment of patients infected with CCR5-tropic HIV-1,NA,Priority,No,Yes,N/A,Yes,N/A,N/A,N/A,NA,2006-12-20,2007-08-06,229,5.43372200355424,Mid-PDUFA
[drug marketed without a proprietary name],ammonia N 13,Feinstein Institute for Medical Research,NDA,22119,NA,NA,Injectable,Intravenous,NA,NA,NA,NA,10/25/2006,8/23/2007,2007,indicated for diagnostic Positron Emission Tomography (PET) imaging of the myocardium under rest or pharmacologic stress conditions to evaluate myocardial perfusion in patients with suspected or existing coronary artery disease,NA,Standard,No,No,N/A,No,N/A,N/A,N/A,NA,2006-10-25,2007-08-23,302,5.71042701737487,Mid-PDUFA
Somatuline Depot,lanreotide,Beaufour Ipsen Pharma,NDA,22074,NA,NA,Solution,Subcutaneous,NA,NA,NA,NA,10/30/2006,8/30/2007,2007,long-term treatment of acromegalic patients who have had an inadequate response to or cannot be treated with surgery and/or radiotherapy,NA,Standard,Yes,No,N/A,No,N/A,N/A,N/A,NA,2006-10-30,2007-08-30,304,5.717027701406222,Mid-PDUFA
Doribax,doripenem,Johnson & Johnson,NDA,22106,NA,NA,Injectable,Intravenous,NA,NA,NA,NA,12/13/2006,10/12/2007,2007,NA,"Doribax is indicated to reduce the development of drug-resistant bacteria and maintain the effectiveness of DORIBAX and other antibacterial drugs, DORIBAX should be used only to treat infections that are proven or strongly suspected to be caused by susceptible bacteria. When culture and susceptibility information are available, they should be considered in selecting and modifying antibacterial therapy. In the absence of such data, local epidemiology and susceptibility patterns may contribute to the empiric selection of therapy. 
DORIBAX (doripenem for injection) is indicated as a single agent for the treatment of complicated intra-abdominal infections caused by Escherichia coli, Klebsiella pneumoniae, Pseudomonas aeruginosa, Bacteroides caccae, Bacteroides fragilis, Bacteroides thetaiotaomicron, Bacteroides uniformis, Bacteroides vulgatus, Streptococcus intermedius, Streptococcus constellatus and Peptostreptococcus micros. 
DORIBAX (doripenem for injection) is indicated as a single agent for the treatment of complicated urinary tract infections, including pyelonephritis caused by Escherichia coli including cases with concurrent bacteremia, Klebsiella pneumoniae, Proteus mirabilis, Pseudomonas aeruginosa, and Acinetobacter baumannii.",Standard,No,No,N/A,No,N/A,No,No,NA,2006-12-13,2007-10-12,303,5.713732805509369,Mid-PDUFA
Isentress,raltegravir,Merck,NDA,22145,NA,NA,Tablet,Oral,NA,NA,NA,NA,4/13/2007,10/12/2007,2007,NA,"ISENTRESS in combination with other antiretroviral agents is indicated for the treatment of HIV-1 infection in treatment-experienced adult patients who have evidence of viral replication and HIV-1 strains resistant to multiple antiretroviral agents. 
This indication is based on analyses of plasma HIV-1 RNA levels up through 24 weeks in two controlled studies of ISENTRESS. These studies were conducted in clinically advanced, 3-class antiretroviral (NNRTI, NRTI, PI) treatment-experienced adults. 
The use of other active agents with ISENTRESS is associated with a greater likelihood of treatment response.
The safety and efficacy of ISENTRESS have not been established in treatment-naïve adult patients or pediatric patients.  
There are no study results demonstrating the effect of ISENTRESS on clinical progression of HIV-1 infection.",Priority,No,Yes,N/A,Yes,N/A,No,No,NA,2007-04-13,2007-10-12,182,5.204006687076795,Mid-PDUFA
Ixempra,ixabepilone,Bristol-Myers Squibb,NDA,22065,NA,NA,Injectable,Intravenous,NA,NA,NA,NA,4/16/2007,10/16/2007,2007,NA,"IXEMPRA is indicated in combination with capecitabine for the treatment of patients with metastatic or locally advanced breast cancer resistant to treatment with an anthracycline and a taxane, or whose cancer is taxane resistant and for whom further anthracycline therapy is contraindicated. Anthracycline resistance is defined as progression while on therapy or within 6 months in the adjuvant setting or 3 months in the metastatic setting. Taxane resistance is defined as progression while on therapy or within 12 months in the adjuvant setting or 4 months in the metastatic setting. 
IXEMPRA is indicated as monotherapy for the treatment of metastatic or locally advanced breast cancer in patients whose tumors are resistant or refractory to anthracyclines, taxanes, and capecitabine.",Priority,No,No,N/A,No,N/A,No,No,NA,2007-04-16,2007-10-16,183,5.209486152841421,Mid-PDUFA
Tasigna,nilotinib,Novartis Pharmaceuticals,NDA,22068,NA,NA,Capsule,Oral,NA,NA,NA,NA,9/29/2006,10/29/2007,2007,NA,"Tasigna (nilotinib) is indicated for the treatment of chronic phase and accelerated phase Philadelphia chromosome positive chronic myelogenous leukemia (CML) in adult patients resistant or intolerant to  prior therapy that included imatinib. The effectiveness of Tasigna is based on hematologic and cytogenetic response rates. There are no controlled trials demonstrating a clinical benefit, such as improvement in disease-related symptoms or increased survival.",Standard,Yes,Yes,N/A,Yes,N/A,No,No,NA,2006-09-29,2007-10-29,395,5.978885764901122,Mid-PDUFA
Mircera,methoxy polyethylene glycol-epoetin beta,Hoffmann-La Roche,BLA,125164,NA,NA,Injectable,Injection,NA,NA,NA,NA,4/19/2006,11/14/2007,2007,NA,"Mircera is indicated for the treatment of anemia associated with chronic renal failure (CRF) in adults, including patients on dialysis and not on dialysis.
Mircera is not indicated for the treatment of anemia due to cancer chemotherapy.",Standard,No,No,N/A,No,N/A,No,No,NA,2006-04-19,2007-11-14,574,6.352629396319567,Mid-PDUFA
Kuvan,sapropterin dihydrochloride,Biomarin Pharmaceutical,NDA,22181,NA,NA,Tablet,Oral,NA,NA,NA,NA,5/25/2007,12/13/2007,2007,NA,Kuvan is indicated to reduce blood phenylalanine (Phe) levels in patients with hyperphenylalaninemia (HPA) due to tetrahydrobiopterin- (BH4-) responsive Phenylketonuria (PKU). Kuvan is to be used in conjunction with a Phe-restricted diet.,Priority,Yes,No,N/A,Yes,N/A,No,No,NA,2007-05-25,2007-12-13,202,5.308267697401205,Mid-PDUFA
Bystolic,nebivolol,Mylan Bertek Pharmaceuticals,NDA,21742,NA,NA,Tablet,Oral,NA,NA,NA,NA,4/30/2004,12/17/2007,2007,NA,BYSTOLIC is indicated for the treatment of hypertension. BYSTOLIC may be used alone or in combination with other antihypertensive agents.,Standard,No,No,N/A,No,N/A,No,No,NA,2004-04-30,2007-12-17,1326,7.189922170745808,Mid-PDUFA
Intelence,etravirine,Tibotec,NDA,22187,NA,NA,Tablet,Oral,NA,NA,NA,NA,7/18/2007,1/18/2008,2008,NA,"INTELENCE, in combination with other antiretroviral agents, is indicated for the treatment of human immunodeficiency virus type 1 (HIV-1) infection in antiretroviral treatment-experienced adult patients, who have evidence of viral replication and HIV-1 strains resistant to a non-nucleoside reverse transcriptase inhibitor (NNRTI) and other antiretroviral agents.
This indication is based on Week 24 analyses from 2 randomized, double-blind, placebo-controlled trials of INTELENCE. Both studies were conducted in clinically advanced, 3-class antiretroviral (NNRTI, N[t]RTI, PI) treatment-experienced adults. 
The following points should be considered when initiating therapy with INTELENCE: 
- Treatment history and, when available, resistance testing, should guide the use of INTELENCE. 
- The use of other active antiretroviral agents with INTELENCE is associated with an increased likelihood of treatment response. 
- In patients who have experienced virologic failure on an NNRTI-containing regimen, do not use INTELENCE in combination with only N[t]RTIs. 
- The risks and benefits of INTELENCE have not been established in pediatric patients or in treatment-naïve adult patients.",Priority,No,Yes,N/A,Yes,N/A,No,No,NA,2007-07-18,2008-01-18,184,5.214935757608986,Mid-PDUFA
Emend,fosaprepitant dimeglumine,Merck,NDA,22023,NA,NA,Powder,Intravenous,NA,NA,NA,NA,4/3/2006,1/25/2008,2008,NA,"EMEND for Injection, in combination with other antiemetic agents, is indicated for the: 
- prevention of acute and delayed nausea and vomiting associated with initial and repeat courses of highly emetogenic cancer chemotherapy including high-dose cisplatin 
- prevention of nausea and vomiting associated with initial and repeated courses of moderately emetogenic cancer chemotherapy.",Standard,No,No,N/A,No,N/A,No,No,NA,2006-04-03,2008-01-25,662,6.495265555937008,Mid-PDUFA
Arcalyst,rilonacept,Regeneron Pharmaceuticals,BLA,125249,NA,NA,Injectable,Injection,NA,NA,NA,NA,5/29/2007,2/27/2008,2008,NA,"ARCALYST (rilonacept) is an interleukin-1 blocker indicated for the treatment of Cryopyrin-Associated Periodic Syndomes (CAPS), including Familial Cold Autoinflammatory Syndrome (FCAS) and Muckle-Wells Syndrome (MWS) in adults and children 12 and older.",Priority,Yes,No,N/A,Yes,N/A,No,No,NA,2007-05-29,2008-02-27,274,5.6131281063880705,Mid-PDUFA
Pristiq,desvenlafaxine,Wyeth Pharmaceuticals,NDA,21992,NA,NA,"Tablet, Extended Release",Oral,NA,NA,NA,NA,12/22/2005,2/29/2008,2008,NA,"Pristiq, a selective serotonin and norepinephrine reuptake inhibitor (SNRI), is indicated for the treatment of major depressive disorder (MDD). The efficacy of Pristiq has been established in four 8-week, placebo-controlled studies of outpatients who met DSM-IV criteria for major depressive disorder. 
A major depressive episode (DSM-IV) implies a prominent and relatively persistent (nearly every day for at least 2 weeks) depressed or dysphoric mood that usually interferes with daily functioning, and includes at least 5 of the following 9 symptoms: depressed mood, loss of interest in usual activities, significant change in weight and/or appetite, insomnia or hypersomnia, psychomotor agitation or retardation, increased fatigue, feelings of guilt or worthlessness, slowed thinking or impaired concentration, or a suicide attempt or suicidal ideation.",Standard,No,No,N/A,No,N/A,No,No,NA,2005-12-22,2008-02-29,799,6.683360945766275,Mid-PDUFA
Treanda,bendamustine hydrochloride,Cephalon,NDA,22249,NA,NA,Powder,Iv (Infusion),NA,NA,NA,NA,9/20/2007,3/20/2008,2008,NA,TREANDA (bendamustine hydrochloride) for Injection is indicated for the treatment of patients with chronic lymphocytic leukemia (CLL). Efficacy relative to first line therapies other than chlorambucil has not been established.,Priority,Yes,No,N/A,No,N/A,No,No,NA,2007-09-20,2008-03-20,182,5.204006687076795,Mid-PDUFA
Lexiscan,regadenoson,CV Therapeutics,NDA,22161,NA,NA,Solution,Intravenous,NA,NA,NA,NA,5/14/2007,4/10/2008,2008,NA,Lexiscan (regadenoson) injection is a pharmacologic stress agent indicated for radionuclide myocardial perfusion imaging (MPI) in patients unable to undergo adequate exercise stress.,Standard,No,No,N/A,No,N/A,No,No,NA,2007-05-14,2008-04-10,332,5.805134968916488,Mid-PDUFA
Cimzia,certolizumab pegol,UCB,BLA,125160,NA,NA,Injectable,Injection,NA,NA,NA,NA,3/1/2006,4/22/2008,2008,NA,CIMZIA is indicated for reducing signs and symptoms of Crohn's disease and maintaining clinical response in adult patients with moderately to severely active disease who have had an inadequate response to conventional therapy.,Standard,No,No,N/A,No,N/A,No,No,NA,2006-03-01,2008-04-22,783,6.663132695990803,Mid-PDUFA
Relistor,methylnaltrexone bromide,Progenics Pharmaceuticals,NDA,21964,NA,NA,Solution,Subcutaneous,NA,NA,NA,NA,3/30/2007,4/24/2008,2008,NA,"RELISTOR is indicated for the treatment of opioid-induced constipation in patients with advanced illness who are receiving palliative care, when response to laxative therapy has not been sufficient. Use of RELISTOR beyond four months has not been studied.",Standard,No,No,N/A,No,N/A,No,No,NA,2007-03-30,2008-04-24,391,5.968707559985366,Mid-PDUFA
Entereg,alvimopan,Adolor,NDA,21775,NA,NA,Capsule,Oral,NA,NA,NA,NA,6/25/2004,5/20/2008,2008,NA,ENTEREG is indicated to accelerate the time to upper and lower gastrointestinal recovery following partial large or small bowel resection surgery with primary anastomosis.,Standard,No,No,N/A,Yes,N/A,No,No,NA,2004-06-25,2008-05-20,1425,7.261927092702751,Mid-PDUFA
Durezol,difluprednate,Sirion Therapeutics,NDA,22212,NA,NA,Emulsion,Ophthalmic,NA,NA,NA,NA,12/26/2007,6/23/2008,2008,NA,"Durezol (difluprednate ophthalmic emulsion) 0.05%, a topical corticosteroid, is indicated for the treatment of inflammation and pain associated with ocular surgery.",Priority,No,No,N/A,No,N/A,No,No,NA,2007-12-26,2008-06-23,180,5.19295685089021,Mid-PDUFA
Eovist,gadoxetate disodium,Bayer Healthcare Pharmaceuticals,NDA,22090,NA,NA,Solution,Intravenous,NA,NA,NA,NA,7/2/2007,7/3/2008,2008,NA,EOVIST Injection is a gadolinium-based contrast agent indicated for intravenous use in T1-weighted magnetic resonance imaging (MRI) of the liver to detect and characterize lesions in adults with known or suspected focal liver disease.,Standard,No,No,N/A,No,N/A,No,No,NA,2007-07-02,2008-07-03,367,5.905361848054571,Mid-PDUFA
Cleviprex,clevidipine,The Medicines Company,NDA,22156,NA,NA,Emulsion,Intravenous,NA,NA,NA,NA,7/2/2007,8/1/2008,2008,NA,Cleviprex is indicated for the reduction of blood pressure when oral therapy is not feasible or not desirable.,Standard,No,No,N/A,No,N/A,No,No,NA,2007-07-02,2008-08-01,396,5.981414211254481,Mid-PDUFA
Xenazine,tetrabenazine,Prestwick Pharmaceuticals,NDA,21894,NA,NA,Tablet,Oral,NA,NA,NA,NA,9/26/2005,8/15/2008,2008,NA,XENAZINE is indicated for the treatment of chorea associated with Huntington's disease.,Priority,Yes,No,N/A,Yes,N/A,No,No,NA,2005-09-26,2008-08-15,1054,6.960347729101308,Mid-PDUFA
Nplate,romiplostim,Amgen,BLA,125268,NA,NA,Injectable,Injection,NA,NA,NA,NA,10/23/2007,8/22/2008,2008,NA,"Nplate is indicated for the treatment of thrombocytopenia in patients with chronic immune (idiopathic) thrombocytopenic purpura (ITP) who have had an insufficient response to corticosteroids, immunoglobulins or splenectomy. Nplate should be used only in patients with ITP whose degree of thrombocytopenia and clinical condition increases the risk for bleeding. Nplate should not be used in an attempt to normalize platelet counts.",Priority,Yes,No,N/A,Yes,N/A,No,No,NA,2007-10-23,2008-08-22,304,5.717027701406222,Mid-PDUFA
AdreView,iobenguane I 123,GE Healthcare,NDA,22290,NA,NA,Solution,Intravenous,NA,NA,NA,NA,3/21/2008,9/19/2008,2008,NA,AdreView is a radiopharmaceutical indicated for use in the detection of primary or metastatic pheochromocytoma or neuroblastoma as an adjunct to other diagnostic tests.,Priority,Yes,No,N/A,No,N/A,No,No,NA,2008-03-21,2008-09-19,182,5.204006687076795,Mid-PDUFA
Rapaflo,silodosin,Watson Laboratories,NDA,22206,NA,NA,Capsule,Oral,NA,NA,NA,NA,12/13/2007,10/8/2008,2008,NA,"RAPAFLO, a selective alpha-1 adrenergic receptor antagonist, is indicated for the treatment of the signs and symptoms of benign prostatic hyperplasia (BPH). RAPAFLO is not indicated for the treatment of hypertension.",Standard,No,No,N/A,No,N/A,No,No,NA,2007-12-13,2008-10-08,300,5.703782474656201,Mid-PDUFA
Vimpat,lacosamide,Schwarz Biosciences,NDA,22253,22254,NA,Tablet,Oral,Injectable,Injection,NA,NA,9/28/2007,10/28/2008,2008,NA,"VIMPAT (lacosamide) tablets are indicated as adjunctive therapy in the treatment of partial-onset seizures in patients with epilepsy aged 17 years and older. 
VIMPAT (lacosamide) injection for intravenous use is indicated as adjunctive therapy in the treatment of partial-onset seizures in patients with epilepsy aged 17 years and older when oral administration is temporarily not feasible.",Standard,No,No,N/A,No,N/A,No,No,NA,2007-09-28,2008-10-28,396,5.981414211254481,Mid-PDUFA
Toviaz,fesoterodine fumarate,Pfizer,NDA,22030,NA,NA,"Tablet, Extended Release",Oral,NA,NA,NA,NA,3/27/2006,10/31/2008,2008,NA,"Toviaz is indicated for the treatment of overactive bladder with symptoms of urge urinary incontinence, urgency, and frequency.",Standard,No,No,N/A,No,N/A,No,No,NA,2006-03-27,2008-10-31,949,6.855408798609928,Mid-PDUFA
Banzel,rufinamide,Eisai Medical Research,NDA,21911,NA,NA,Tablet,Oral,NA,NA,NA,NA,11/17/2005,11/14/2008,2008,NA,BANZEL (rufinamide) is indicated for adjunctive treatment of seizures associated with Lennox-Gastaut syndrome in children 4 years and older and adults.,Standard,Yes,No,N/A,No,N/A,No,No,NA,2005-11-17,2008-11-14,1093,6.996681488176539,Mid-PDUFA
Promacta,eltrombopag,GlaxoSmithKline,NDA,22291,NA,NA,Tablet,Oral,NA,NA,NA,NA,12/19/2007,11/20/2008,2008,NA,"PROMACTA is indicated for the treatment of thrombocytopenia in patients with chronic immune (idiopathic) thrombocytopenic purpura (ITP) who have had an insufficient response to corticosteroids, immunoglobulins, or splenectomy. PROMACTA should be used only in patients with ITP whose degree of thrombocytopenia and clinical condition increases the risk for bleeding. PROMACTA should not be used in an attempt to normalize platelet counts.",Priority,Yes,Yes,N/A,No,N/A,No,No,NA,2007-12-19,2008-11-20,337,5.820082930352362,Mid-PDUFA
Nucynta,tapentadol,Johnson & Johnson,NDA,22304,NA,NA,Tablet,Oral,NA,NA,NA,NA,1/23/2008,11/20/2008,2008,NA,tapentadol is indicated for the relief of moderate to severe acute pain in patients 18 years of age or older.,Standard,No,No,N/A,No,N/A,No,No,NA,2008-01-23,2008-11-20,302,5.71042701737487,Mid-PDUFA
Lusedra,fospropofol disodium,Eisai Medical Research,NDA,22244,NA,NA,Solution,Intravenous,NA,NA,NA,NA,9/27/2007,12/12/2008,2008,NA,LUSEDRA (fospropofol disodium) injection is an intravenous sedative-hypnotic agent indicated for monitored anesthesia care (MAC) sedation in adult patients undergoing diagnostic or therapeutic procedures.,Standard,No,No,N/A,No,N/A,No,No,NA,2007-09-27,2008-12-12,442,6.091309882077698,Mid-PDUFA
Mozobil,plerixafor,Genzyme,NDA,22311,NA,NA,Solution,Subcutaneous,NA,NA,NA,NA,6/16/2008,12/15/2008,2008,NA,Mozobil (plerixafor injection) is indicated in combination with granulocyte-colony stimulating factor (G-CSF) to mobilize hematopoietic stem cells to the peripheral blood for collection and subsequent autologous transplantation in patients with non-Hodgkin’s lymphoma (NHL) and multiple myeloma (MM).,Priority,Yes,No,N/A,No,N/A,No,No,NA,2008-06-16,2008-12-15,182,5.204006687076795,Mid-PDUFA
Vasovist,gadofosveset trisodium,Epix Pharmaceuticals,NDA,21711,NA,NA,Solution,Intravenous,NA,NA,NA,NA,12/15/2003,12/22/2008,2008,NA,VASOVIST is indicated for use as a contrast agent in magnetic resonance angiography (MRA) to evaluate aortoiliac occlusive disease (AIOD) in adults with known or suspected peripheral vascular disease.,Standard,No,No,N/A,No,N/A,No,No,NA,2003-12-15,2008-12-22,1834,7.51425465281641,Mid-PDUFA
Firmagon,degarelix,Ferring Pharmaceuticals,NDA,22201,NA,NA,Powder,Subcutaneous,NA,NA,NA,NA,2/28/2008,12/24/2008,2008,NA,degarelix is a GnRH receptor antagonist indicated for treatment of patients with advanced prostate cancer.,Standard,No,No,N/A,No,N/A,No,No,NA,2008-02-28,2008-12-24,300,5.703782474656201,Mid-PDUFA
Savella,milnacipran hydrochloride,Cypress Bioscience,NDA,22256,NA,NA,Tablet,Oral,NA,NA,NA,NA,12/18/2007,1/14/2009,2009,NA,"Savella is indicated for the management of fibromyalgia. 
Savella is not approved for use in pediatric patients.",Standard,No,No,N/A,No,N/A,No,No,NA,2007-12-18,2009-01-14,393,5.973809611869261,Mid-PDUFA
Uloric,febuxostat,Takeda Pharmaceuticals,NDA,21856,NA,NA,Tablet,Oral,NA,NA,NA,NA,12/15/2004,2/13/2009,2009,NA,"ULORIC is a xanthine oxidase (XO) inhibitor indicated for the chronic management of hyperuricemia in patients with gout. 
ULORIC is not recommended for the treatment of asymptomatic hyperuricemia.",Standard,No,No,N/A,No,N/A,No,No,NA,2004-12-15,2009-02-13,1521,7.327123292259293,Mid-PDUFA
Afinitor,everolimus,Novartis Pharmaceuticals,NDA,22334,NA,NA,Tablet,Oral,NA,NA,NA,NA,6/30/2008,3/30/2009,2009,NA,AFINITOR is indicated for the treatment of patients with advanced renal cell carcinoma after failure of treatment with sunitinib or sorafenib.,Priority,No,No,N/A,No,N/A,No,No,NA,2008-06-30,2009-03-30,273,5.60947179518496,Mid-PDUFA
Coartem,"artemether, lumefantrine",Novartis Pharmaceuticals,NDA,22268,NA,NA,Tablet,Oral,NA,NA,NA,NA,6/27/2008,4/7/2009,2009,NA,"Coartem (artemether/lumefantrine) Tablets are indicated for treatment of acute, uncomplicated malaria infections due to Plasmodium falciparum in patients of 5 kg bodyweight and above. Coartem Tablets have been shown to be effective in geographical regions where resistance to chloroquine has been reported. 
Limitations of Use: 
- Coartem Tablets are not approved for patients with severe or complicated P. falciparum malaria. 
- Coartem Tablets are not approved for the prevention of malaria.",Priority,Yes,No,N/A,Yes,N/A,TD,No,NA,2008-06-27,2009-04-07,284,5.648974238161206,Mid-PDUFA
Ulesfia,benzyl alcohol,Sciele Pharma,NDA,22129,NA,NA,Lotion,Topical,NA,NA,NA,NA,6/15/2007,4/9/2009,2009,NA,"benzyl alcohol Lotion is indicated for the topical treatment of head lice infestation in patients 6 months of age and older. 
Limitation of Use:
benzyl alcohol Lotion does not have ovocidal activity. 
Adjunctive Measures: 
benzyl alcohol Lotion should be used in the context of an overall lice management program: 
- Wash (in hot water) or dry-clean all recently worn clothing, hats, used bedding, and towels. 
- Wash personal care items such as combs, brushes and hair clips in hot water. 
- A fine-tooth comb or special nit comb may be used to remove dead lice and nits.",Standard,No,No,N/A,No,N/A,No,No,NA,2007-06-15,2009-04-09,664,6.498282149476434,Mid-PDUFA
Simponi,golimumab,Centocor Ortho Biotech,BLA,125289,NA,NA,Injectable,Injection,NA,NA,NA,NA,6/24/2008,4/24/2009,2009,NA,"SIMPONI, in combination with methotrexate, is indicated for the treatment of adult patients with moderately to severely active rheumatoid arthritis. 
SIMPONI, alone or in combination with methotrexate, is indicated for the treatment of adult patients with active psoriatic arthritis.
SIMPONI is indicated for the treatment of adult patients with active ankylosing spondylitis.",Standard,No,No,N/A,No,N/A,No,No,NA,2008-06-24,2009-04-24,304,5.717027701406222,Mid-PDUFA
Dysport,abobotulinumtoxinA,Ipsen Biopharm,BLA,125274,NA,NA,Injectable,Injection,NA,NA,NA,NA,11/29/2007,4/29/2009,2009,NA,"[A] DYSPORT (abobotulinumtoxinA) is an acetylcholine release inhibitor and a neuromuscular blocking agent indicated for the treatment of adults with cervical dystonia to reduce the severity of abnormal head position and neck pain in both toxin-naïve and previously treated patients. 
[B] DYSPORT (abobotulinumtoxinA) is an acetylcholine release inhibitor and a neuromuscular blocking agent indicated for the temporary improvement in the appearance of moderate to severe glabellar lines associated with procerus and corrugator muscle activity in adult patients < 65 years of age.",Standard,Yes (indication [A] only),No,N/A,No,N/A,No,No,NA,2007-11-29,2009-04-29,517,6.248042874508429,Mid-PDUFA
Fanapt,iloperidone,Vanda Pharmaceuticals,NDA,22192,NA,NA,Tablet,Oral,NA,NA,NA,NA,9/27/2007,5/6/2009,2009,NA,"FANAPT tablets are indicated for the acute treatment of adults with schizophrenia. 
When deciding among the alternative treatments available for this condition, the prescriber should consider the finding that FANAPT is associated with prolongation of the QTc interval. Prolongation of the QTc interval is associated in some other drugs with the ability to cause torsade de pointes-type arrhythmia, a potentially fatal polymorphic ventricular tachycardia which can result in sudden death. In many cases this would lead to the conclusion that other drugs should be tried first. Whether FANAPT will cause torsade de pointes or increase the rate of sudden death is not yet known. 
Patients must be titrated to an effective dose of FANAPT. Thus, control of symptoms may be delayed during the first 1 to 2 weeks of treatment compared to some other antipsychotic drugs that do not require a similar titration. Prescribers should be mindful of this delay when selecting an antipsychotic drug for the acute treatment of schizophrenia. 
The effectiveness of FANAPT in long-term use, that is, for more than 6 weeks, has not been systematically evaluated in controlled trials. Therefore, the physician who elects to use FANAPT for extended periods should periodically re-evaluate the long-term usefulness of the drug for the individual patient.",Standard,No,No,N/A,No,N/A,No,No,NA,2007-09-27,2009-05-06,587,6.375024819828097,Mid-PDUFA
Samsca,tolvaptan,Otsuka Pharmaceutical,NDA,22275,NA,NA,Tablet,Oral,NA,NA,NA,NA,10/23/2007,5/19/2009,2009,NA,"SAMSCA is indicated for the treatment of clinically significant hypervolemic and euvolemic hyponatremia (serum sodium < 125 mEq/L or less marked hyponatremia that is symptomatic and has resisted correction with fluid restriction), including patients with heart failure, cirrhosis, and Syndrome of Inappropriate Antidiuretic Hormone (SIADH). Important Limitations: Patients requiring intervention to raise serum sodium urgently to prevent or to treat serious neurological symptoms should not be treated with SAMSCA. It has not been established that raising serum sodium with SAMSCA provides a symptomatic benefit to patients.",Standard,No,No,N/A,No,N/A,No,No,NA,2007-10-23,2009-05-19,574,6.352629396319567,Mid-PDUFA
Besivance,besifloxacin,Bausch & Lomb,NDA,22308,NA,NA,Suspension/Drops,Ophthalmic,NA,NA,NA,NA,6/2/2008,5/28/2009,2009,NA,"Besivance (besifloxacin ophthalmic suspension) 0.6%, is indicated for the treatment of bacterial conjunctivitis caused by susceptible isolates of the following bacteria: 
CDC coryneform group G 
Corynebacterium pseudodiphtheriticum*
Corynebacterium striatum*
Haemophilus influenzae
Moraxella lacunata*
Staphylococcus aureus
Staphylococcus epidermidis
Staphylococcus hominis*
Staphylococcus lugdunensis*
Streptococcus mitis group
Streptococcus oralis
Streptococcus pneumoniae
Streptococcus salivarius*
*Efficacy for this organism was studied in fewer than 10 infections.",Standard,No,No,N/A,No,N/A,No,No,NA,2008-06-02,2009-05-28,360,5.886104031450156,Mid-PDUFA
Ilaris,canakinumab,Novartis Pharmaceuticals,BLA,125319,NA,NA,Injectable,Injection,NA,NA,NA,NA,12/17/2008,6/17/2009,2009,NA,"ILARIS (canakinumab) is an interleukin-1beta blocker indicated for the treatment of Cryopyrin-Associated Periodic Syndromes (CAPS), in adults and children 4 years of age and older including: 
- Familial Cold Autoinflammatory Syndrom (FCAS) 
- Muckle-Wells Syndrome (MWS)",Priority,Yes,No,N/A,Yes,N/A,No,No,NA,2008-12-17,2009-06-17,182,5.204006687076795,Mid-PDUFA
Multaq,dronedarone,Sanofi-Aventis,NDA,22425,NA,NA,Tablet,Oral,NA,NA,NA,NA,7/31/2008,7/1/2009,2009,NA,"MULTAQ is indicated to reduce the risk of cardiovascular hospitalization in patients with paroxysmal or persistent atrial fibrillation (AF) or atrial flutter (AFL), with a recent episode of AF/AFL and associated cardiovascular risk factors (i.e., age >70, hypertension, diabetes, prior cerebrovascular accident, left atrial diameter >= 50 mm or left ventricular ejection fraction [LVEF] < 40%), who are in sinus rhythm or who will be cardioverted.",Priority,No,No,N/A,No,N/A,No,No,NA,2008-07-31,2009-07-01,335,5.814130531825066,Mid-PDUFA
Effient,prasugrel,Eli Lilly,NDA,22307,NA,NA,Tablet,Oral,NA,NA,NA,NA,12/26/2007,7/10/2009,2009,NA,"Effient is indicated to reduce the rate of thrombotic cardiovascular (CV) events (including stent thrombosis) in patients with acute coronary syndrome (ACS) who are to be managed with percutaneous coronary intervention (PCI) as follows:  
- Patients with unstable angina (UA) or non-ST-elevation myocardial infarction (NSTEMI).  
- Patients with ST-elevation myocardial infarction (STEMI) when managed with either primary or delayed PCI. 
Effient has been shown to reduce the rate of a combined endpoint of cardiovascular death, nonfatal myocardial infarction (MI), or nonfatal stroke compared to clopidogrel. The difference between treatments was driven predominantly by MI, with no difference on strokes and little difference on CV death. 
It is generally recommended that antiplatelet therapy be administered promptly in the management of ACS because many cardiovascular events occur within hours of initial presentation. In the clinical trial that established the efficacy of Effient, Effient and the control drug were not administered to UA/NSTEMI patients until coronary anatomy was established. For the small fraction of patients that required urgent CABG after treatment with Effient, the risk of significant bleeding was substantial. Because the large majority of patients are managed without CABG, however, treatment can be considered before determining coronary anatomy if need for CABG is considered unlikely. The advantages of earlier treatment with Effient must then be balanced against the increased rate of bleeding in patients who do need to undergo urgent CABG.",Priority,No,No,N/A,No,N/A,No,No,NA,2007-12-26,2009-07-10,562,6.331501849893691,Mid-PDUFA
Onglyza,saxagliptin,Bristol-Myers Squibb,NDA,22350,NA,NA,Tablet,Oral,NA,NA,NA,NA,6/30/2008,7/31/2009,2009,NA,"Monotherapy and Combination Therapy:
ONGLYZA is indicated as an adjunct to diet and exercise to improve glycemic control in adults with type 2 diabetes mellitus. 
Important Limitations of Use: 
ONGLYZA should not be used for the treatment of type 1 diabetes mellitus or diabetic ketoacidosis, as it would not be effective in these settings. 
ONGLYZA has not been studied in combination with insulin.",Standard,No,No,N/A,No,N/A,No,No,NA,2008-06-30,2009-07-31,396,5.981414211254481,Mid-PDUFA
Livalo,pitavastatin,Kowa Research Institute,NDA,22363,NA,NA,Tablet,Oral,NA,NA,NA,NA,10/3/2008,8/3/2009,2009,NA,"Drug therapy should be one component of multiple-risk-factor intervention in individuals who require modifications of their lipid profile. Lipid-altering agents should be used in addition to a diet restricted in saturated fat and cholesterol only when the response to diet and other nonpharmacological measures has been inadequate. 
LIVALO is indicated as an adjunctive therapy to diet to reduce elevated total cholesterol (TC), low-density lipoprotein cholesterol (LDL-C), apolipoprotein B (Apo B), triglycerides (TG), and to increase HDL-C in adult patients with primary hyperlipidemia or mixed dyslipidemia. 
Limitations of Use: 
Doses of LIVALO greater than 4 mg once daily were associated with an increased risk for severe myopathy in premarketing clinical studies. Do not exceed 4 mg once daily dosing of LIVALO. 
The effect of LIVALO on cardiovascular morbidity and mortality has not been determined. 
LIVALO has not been studied in patients with severe renal impairment (glomerular filtration rate < 30 mL/min/1.73 m2) not on hemodialysis. LIVALO should not be used in this patient population. 
LIVALO has not been studied with the protease inhibitor combination lopinavir/ritonavir. LIVALO should not be used with this combination of protease inhibitors. 
LIVALO has not been studied in Fredrickson Type I, III, and V dyslipidemias.",Standard,No,No,N/A,No,N/A,No,No,NA,2008-10-03,2009-08-03,304,5.717027701406222,Mid-PDUFA
Saphris,asenapine,Organon,NDA,22117,NA,NA,Tablet,Oral,NA,NA,NA,NA,8/31/2007,8/13/2009,2009,NA,"SAPHRIS is indicated for the acute treatment of schizophrenia in adults. The physician who elects to use SAPHRIS for extended periods in schizophrenia should periodically re-evaluate the long-term risks and benefits of the drug for the individual patient. 
SAPHRIS is indicated for the acute treatment of manic or mixed episodes associated with bipolar I disorder with or without psychotic features in adults. If SAPHRIS is used for extended periods in bipolar disorder, the physician should periodically re-evaluate the long-term risks and benefits of the drug for the individual patient.",Standard,No,No,N/A,No,N/A,No,No,NA,2007-08-31,2009-08-13,713,6.569481420414296,Mid-PDUFA
Bepreve,bepotastine besilate,Ista Pharmaceuticals,NDA,22288,NA,NA,Solution/Drops,Ophthalmic,NA,NA,NA,NA,11/12/2008,9/8/2009,2009,NA,Bepreve (bepotastine besilate ophthalmic solution) 1.5% is a histamine H1 receptor antagonist indicated for the treatment of itching associated with signs and symptoms of allergic conjunctivitis.,Standard,No,No,N/A,No,N/A,No,No,NA,2008-11-12,2009-09-08,300,5.703782474656201,Mid-PDUFA
Vibativ,telavancin,Theravance,NDA,22110,NA,NA,Powder,Intravenous,NA,NA,NA,NA,12/19/2006,9/11/2009,2009,NA,"To reduce the development of drug-resistant bacteria and maintain the effectiveness of VIBATIV and other antibacterial drugs, VIBATIV should be used only to treat infections that are proven or strongly suspected to be caused by susceptible bacteria. When culture and susceptibility information are available, they should be considered in selecting or modifying antibacterial therapy. In the absence of such data, local epidemiology and susceptibility patterns may contribute to the empiric selection of therapy. 
VIBATIV is indicated for the treatment of adult patients with complicated skin and skin structure infections (cSSSI) caused by susceptible isolates of the following Gram-positive microorganisms: Staphylococcus aureus (including methicillin-susceptible and -resistant isolates), Streptococcus pyogenes, Streptococcus agalactiae, Streptococcus anginosus group (includes S. anginosus, S. intermedius, and S. constellatus), or Enterococcus faecalis (vancomycin-susceptible isolates only). 
Combination therapy may be clinically indicated if the documented or presumed pathogens include Gram-negative organisms. 
Appropriate specimens for bacteriological examination should be obtained in order to isolate and identify the causative pathogens and to determine their susceptibility to telavancin. VIBATIV may be initiated as empiric therapy before results of these tests are known.",Standard,No,No,N/A,Yes,N/A,No,No,NA,2006-12-19,2009-09-11,997,6.904750769961838,Mid-PDUFA
Folotyn,pralatrexate,Allos Therapeutics,NDA,22468,NA,NA,Solution,Intravenous,NA,NA,NA,NA,3/24/2009,9/24/2009,2009,NA,FOLOTYN is indicated for the treatment of patients with relapsed or refractory peripheral T-cell lymphoma (PTCL). This indication is based on overall response rate. Clinical benefit such as improvement in progression free survival or overall survival has not been demonstrated.,Priority,Yes,Yes,N/A,Yes,N/A,No,No,NA,2009-03-24,2009-09-24,184,5.214935757608986,Mid-PDUFA
Stelara,ustekinumab,Centocor Ortho Biotech,BLA,125261,NA,NA,Injectable,Injection,NA,NA,NA,NA,11/29/2007,9/25/2009,2009,NA,STELARA is indicated for the treatment of adult patients (18 years or older) with moderate to severe plaque psoriasis who are candidates for phototherapy or systemic therapy.,Standard,No,No,N/A,No,N/A,No,No,NA,2007-11-29,2009-09-25,666,6.501289670540389,Mid-PDUFA
Votrient,pazopanib,GlaxoSmithKline,NDA,22465,NA,NA,Tablet,Oral,NA,NA,NA,NA,12/19/2008,10/19/2009,2009,NA,VOTRIENT is indicated for the treatment of patients with advanced renal cell carcinoma (RCC).,Standard,No,No,N/A,No,N/A,No,No,NA,2008-12-19,2009-10-19,304,5.717027701406222,Mid-PDUFA
Arzerra,ofatumumab,GlaxoSmithKline,BLA,125326,NA,NA,Injectable,Injection,NA,NA,NA,NA,1/30/2009,10/26/2009,2009,NA,"ARZERRA (ofatumumab) is indicated for the treatment of patients with chronic lymphocytic leukemia (CLL) refractory to fludarabine and alemtuzumab. 
The effectiveness of ARZERRA is based on the demonstration of durable objective responses. No data demonstrate an improvement in disease related symptoms or increased survival with ARZERRA.",Priority,Yes,Yes,N/A,Yes,N/A,No,No,NA,2009-01-30,2009-10-26,269,5.594711379601839,Mid-PDUFA
Istodax,romidepsin,Gloucester Pharmaceuticals,NDA,22393,NA,NA,Powder,Intravenous,NA,NA,NA,NA,1/12/2009,11/5/2009,2009,NA,ISTODAX is indicated for treatment of cutaneous T-cell lymphoma (CTCL) in patients who have received at least one prior systemic therapy.,Standard,Yes,No,N/A,Yes,N/A,No,No,NA,2009-01-12,2009-11-05,297,5.6937321388027,Mid-PDUFA
Qutenza,capsaicin,Neurogesx,NDA,22395,NA,NA,Patch,Topical,NA,NA,NA,NA,10/16/2008,11/16/2009,2009,NA,Qutenza is indicated for the management of neuropathic pain associated with postherpetic neuralgia.,Standard,Yes,No,N/A,No,N/A,No,No,NA,2008-10-16,2009-11-16,396,5.981414211254481,Mid-PDUFA
Kalbitor,ecallantide,Dyax,BLA,125277,NA,NA,Injectable,Injection,NA,NA,NA,NA,9/23/2008,12/1/2009,2009,NA,KALBITOR (ecallantide) is indicated for treatment of acute attacks of hereditary angioedema (HAE) in patients 16 years of age and older.,Priority,Yes,No,N/A,Yes,N/A,No,No,NA,2008-09-23,2009-12-01,434,6.073044534100405,Mid-PDUFA
Actemra,tocilizumab,Genentech,BLA,125276,NA,NA,Injectable,Injection,NA,NA,NA,NA,11/19/2007,1/8/2010,2010,NA,ACTEMRA (tocilizumab) is indicated for treatment of adult patients with moderately- to severely-active rheumatoid arthritis who have had an inadequate response to one or more TNF antagonist therapies.,Standard,No,No,N/A,No,N/A,No,No,NA,2007-11-19,2010-01-08,781,6.660575149839686,Mid-PDUFA
Ampyra,dalfampridine,Acorda Therapeutics,NDA,22250,NA,NA,"Tablet, Extended Release",Oral,NA,NA,NA,NA,4/22/2009,1/22/2010,2010,NA,AMPYRA (dalfampridine) is indicated as a treatment to improve walking in patients with multiple sclerosis (MS). This was demonstrated by an increase in walking speed.,Priority,Yes,No,N/A,No,N/A,No,No,NA,2009-04-22,2010-01-22,275,5.616771097666572,Mid-PDUFA
Victoza,liraglutide,Novo Nordisk,NDA,22341,NA,NA,Solution,Subcutaneous,NA,NA,NA,NA,5/23/2008,1/25/2010,2010,NA,Victoza is indicated as an adjunct to diet and exercise to improve glycemic control in adults with type 2 diabetes mellitus.,Standard,No,No,N/A,No,N/A,No,No,NA,2008-05-23,2010-01-25,612,6.416732282512326,Mid-PDUFA
Xiaflex,clostridial collagenase histolyticum,Auxilium Pharmaceuticals,BLA,125338,NA,NA,Injectable,Injection,NA,NA,NA,NA,2/27/2009,2/2/2010,2010,NA,XIAFLEX is indicated for the treatment of adult patients with Dupuytren's contracture with a palpable cord.,Priority,Yes,No,N/A,No,N/A,No,No,NA,2009-02-27,2010-02-02,340,5.8289456176102075,Mid-PDUFA
Vpriv,velaglucerase alfa,Shire Human Genetic Therapies,BLA,22575,NA,NA,Powder,Intravenous,NA,NA,NA,NA,8/31/2009,2/26/2010,2010,NA,VPRIV (velaglucerase alfa for injection) is a hydrolytic lysosomal glucocerebroside-specific enzyme indicated for long-term enzyme replacement therapy (ERT) for pediatric and adult patients with type 1 Gaucher disease.,Priority,Yes,No,N/A,Yes,N/A,No,No,Transition Product from NDA to BLA due to BPCI : Please see page 2 of data dictionary for more information.,2009-08-31,2010-02-26,179,5.187385805840755,Mid-PDUFA
Carbaglu,carglumic acid,Orphan Europe,NDA,22562,NA,NA,Tablet,Oral,NA,NA,NA,NA,6/18/2009,3/18/2010,2010,NA,"Carbaglu is indicated as an adjunctive therapy in pediatric and adult patients for the treatment of acute hyperammonemia due to the deficiency of the hepatic enzyme N-acetylglutamate synthase (NAGS). During acute hyperammonemic episodes concomitant administration of Carbaglu with other ammonia lowering therapies such as alternate pathway medications, hemodialysis, and dietary protein restriction are recommended. 
Carbaglu is indicated for maintenance therapy in pediatric and adult patients for chronic hyperammonemia due to the deficiency of the hepatic enzyme N-acetylglutamate synthase (NAGS). During maintenance therapy, the concomitant use of other ammonia lowering therapies and protein restriction may be reduced or discontinued based on plasma ammonia levels.",Priority,Yes,No,N/A,Yes,N/A,No,No,NA,2009-06-18,2010-03-18,273,5.60947179518496,Mid-PDUFA
Natazia,estradiol valerate; estradiol valerate and dienogest,Bayer HealthCare Pharmaceuticals,NDA,22252,NA,NA,Tablet,Oral,NA,NA,NA,NA,7/6/2009,5/6/2010,2010,NA,"Natazia is indicated for use by women to prevent pregnancy. 
The efficacy of Natazia in women with a body mass index (BMI) of >30 kg/m2 has not been evaluated.",Standard,No,No,N/A,No,N/A,No,No,NA,2009-07-06,2010-05-06,304,5.717027701406222,Mid-PDUFA
Lumizyme,alglucosidase alfa,Genzyme,BLA,125291,NA,NA,Injectable,Injection,NA,NA,NA,NA,5/30/2008,5/24/2010,2010,NA,"LUMIZYME (alglucosidase alfa) is a lysosomal glycogen-specific enzyme indicated for patients 8 years and older with late (non-infantile) onset Pompe disease (acid alpha-glucosidase(GAA) deficiency) who do not have evidence of cardiac hypertrophy. The safety and efficacy of LUMIZYME have not been evaluated in controlled clinical trials in infantile-onset patients, or in late (non-infantile) onset patients less than 8 years of age.",Priority,Yes,No,N/A,Yes,N/A,No,No,NA,2008-05-30,2010-05-24,724,6.584791392385716,Mid-PDUFA
Prolia,denosumab,Amgen,BLA,125320,NA,NA,Injectable,Injection,NA,NA,NA,NA,12/19/2008,6/1/2010,2010,NA,"Prolia is indicated for the treatment of postmenopausal women with osteoporosis at high risk for fracture, defined as history of osteoporotic fracture, or multiple risk factors for fracture; or in patients who have failed or are intolerant to other available osteoporosis therapy. In postmenopausal women with osteoporosis, Prolia reduces the incidence of vertebral, nonvertebral, and hip fractures.",Standard,No,No,N/A,No,N/A,No,No,NA,2008-12-19,2010-06-01,529,6.270988431858299,Mid-PDUFA
Jevtana,cabazitaxel,Sanofi-Aventis,NDA,201023,NA,NA,Solution,Intravenous,NA,NA,NA,NA,3/31/2010,6/17/2010,2010,NA,JEVTANA is a microtubule inhibitor indicated in combination with prednisone for the treatment of patients with hormone-refractory metastatic prostate cancer previously treated with a docetaxel-containing treatment regimen.,Priority,No,No,N/A,Yes,N/A,No,No,NA,2010-03-31,2010-06-17,78,4.356708826689592,Mid-PDUFA
Lastacaft,alcaftadine,Vistakon Pharmaceuticals,NDA,22134,NA,NA,Solution/Drops,Ophthalmic,NA,NA,NA,NA,9/29/2009,7/28/2010,2010,NA,LASTACAFT is a H1 histamine receptor antagonist indicated for the prevention of itching associated with allergic conjunctivitis.,Standard,No,No,N/A,No,N/A,No,No,NA,2009-09-29,2010-07-28,302,5.71042701737487,Mid-PDUFA
Xeomin,incobotulinumtoxinA,Merz Pharmaceuticals,BLA,125360,NA,NA,Injectable,Injection,NA,NA,NA,NA,7/2/2009,7/30/2010,2010,NA,Xeomin (incobotulinumtoxinA) is indicated for the treatment of adults with cervical dystonia to decrease the severity of abnormal head position and neck pain in both botulinum toxin-naïve and previously treated patients. XEOMIN (incobotulinumtoxinA) is indicated for the treatment of adults with blepharospasm who were previously treated with onabotulinumtoxinA (Botox).,Standard,No,No,N/A,No,N/A,No,No,NA,2009-07-02,2010-07-30,393,5.973809611869261,Mid-PDUFA
Ella,ulipristal acetate,Laboratoire HRA Pharma,NDA,22474,NA,NA,Tablet,Oral,NA,NA,NA,NA,10/15/2009,8/13/2010,2010,NA,Ella is a progesterone agonist/antagonist emergency contraceptive indicated for prevention of pregnancy following unprotected intercourse or a known or suspected contraceptive failure. ella is not intended for routine use as a contraceptive.,Standard,No,No,N/A,No,N/A,No,No,NA,2009-10-15,2010-08-13,302,5.71042701737487,Mid-PDUFA
Krystexxa,pegloticase,Savient Pharmaceuticals,BLA,125293,NA,NA,Injectable,Injection,NA,NA,NA,NA,10/31/2008,9/14/2010,2010,NA,"KRYSTEXXA (pegloticase) is a PEGylated uric acid specific enzyme indicated for the treatment  of chronic gout in adult patients refractory to conventional therapy. 
Gout refractory to conventional therapy occurs in patients who have failed to normalize serum uric acid and whose signs and symptoms are inadequately controlled with xanthine oxidase inhibitors at the maximum medically appropriate dose or for whom these drugs are contraindicated. 
Important limitations of use: 
KRSTEXXA is not recommended for the treatment of asymptomatic hyperuricemia.",Priority,Yes,No,N/A,No,N/A,No,No,NA,2008-10-31,2010-09-14,683,6.52649485957079,Mid-PDUFA
Gilenya,fingolimod,Novartis Pharmaceuticals,NDA,22527,NA,NA,Capsule,Oral,NA,NA,NA,NA,12/21/2009,9/21/2010,2010,NA,GILENYA is indicated for the treatment of patients with relapsing forms of multiple sclerosis (MS) to reduce the frequency of clinical exacerbations and to delay the accumulation of physical disability.,Priority,No,No,N/A,Yes,N/A,No,No,NA,2009-12-21,2010-09-21,274,5.6131281063880705,Mid-PDUFA
Pradaxa,dabigatran etexilate mesylate,Boehringer Ingelheim Pharmaceuticals,NDA,22512,NA,NA,Capsule,Oral,NA,NA,NA,NA,4/19/2010,10/19/2010,2010,NA,PRADAXA is indicated to reduce the risk of stroke and systemic embolism in patients with non-valvular atrial fibrillation.,Priority,No,No,N/A,No,N/A,No,No,NA,2010-04-19,2010-10-19,183,5.209486152841421,Mid-PDUFA
Latuda,lurasidone hydrochloride,Sunovion Pharmaceuticals,NDA,200603,NA,NA,Tablet,Oral,NA,NA,NA,NA,12/30/2009,10/28/2010,2010,NA,"LATUDA is indicated for the treatment of patients with schizophrenia. 
The efficacy of LATUDA in schizophrenia was established in four 6-week controlled studies of adult patients with schizophrenia. 
The effectiveness of LATUDA for longer-term use, that is, for more than 6 weeks, has not been established in controlled studies. Therefore, the physician who elects to use LATUDA for extended periods should periodically re-evaluate the long-term usefulness of the drug in the individual patient.",Standard,No,No,N/A,No,N/A,No,No,NA,2009-12-30,2010-10-28,302,5.71042701737487,Mid-PDUFA
Teflaro,ceftaroline fosamil,Cerexa,NDA,200327,NA,NA,Powder,Intravenous,NA,NA,NA,NA,12/30/2009,10/29/2010,2010,NA,"Teflaro (ceftaroline fosamil) is indicated for the treatment of patients with the following infections caused by susceptible isolates of the designated microorganisms. 
[A] Teflaro is indicated for the treatment of actute bacterial skin and skin structure infections (ABSSSI) caused by susceptible isolates of the following Gram-positive and Gram-negative microorganisms: Staphylococcus aureus (including methicillin-susceptible and -resistant isolates), Streptococcus pyogenes, Streptococcus agalactiae, Escherichia coli, Klebsiella pneumoniae, and Klebsiella oxytoca.  
[B] Teflaro is indicated for the treatment of community-acquired bacterial pneumonia (CABP) caused by susceptible isolates of the following Gram-positive and Gram-negative microorganisms: Streptococcus pneumonia (including cases with concurrent bacteremia), Staphylococcus aureus (methicillin-susceptible isolates only), Haemophilus influenzae, Klebsiella pneumoniae, Klebsiella oxytoca, and Escherichia coli. 
Usage: To reduce the development of drug-resistant bacteria and maintain the effectiveness of Teflaro and other antibacterial drugs, Teflaro should be used to treat only ABSSSI or CABP that are proven or strongly suspected to be caused by susceptible bacteria.  Appropriate specimens for microbiological examination should be obtained in order to isolate and identify the causative pathogens and to determine their susceptibility to ceftaroline.  When culture and susceptibility information are available, they should be considered in selecting or modifying antibacterial therapy. In the absence of such data, local epidemiology and susceptibility patterns may contribute to the empiric selection of therapy.",Standard,No,No,N/A,Yes (indication [A] only),N/A,No,No,NA,2009-12-30,2010-10-29,303,5.713732805509369,Mid-PDUFA
Egrifta,tesamorelin,Kendle International,BLA,22505,NA,NA,Powder,Subcutaneous,NA,NA,NA,NA,5/29/2009,11/10/2010,2010,NA,"EGRIFTA (tesamorelin for injection) is indicated for the reduction of excess abdominal fat in HIV-infected patients with lipodystrophy.  
Limitations of Use: 
- Since the long-term cardiovascular safety and potential long-term cardiovascular benefit of EGRIFTA treatment have not been studied and are not known, careful consideration should be given whether to continue EGRIFTA treatment in patients who do not show a clear efficacy response as judged by the degree of reduction in visceral adipose tissue measured by waist circumference or CT scan. 
- EGRIFTA is not indicated for weight loss management (weight neutral effect).  
- There are no data to support improved compliance with anti-retroviral therapies in HIV-positive patients taking EGRIFTA.",Standard,No,No,N/A,No,N/A,No,No,Transition Product from NDA to BLA due to BPCI : Please see page 2 of data dictionary for more information.,2009-05-29,2010-11-10,530,6.272877006546167,Mid-PDUFA
Halaven,eribulin mesylate,Eisai,NDA,201532,NA,NA,Solution,Intravenous,NA,NA,NA,NA,3/30/2010,11/15/2010,2010,NA,HALAVEN is indicated for the treatment of patients with metastatic breast cancer who have previously received at least two chemotherapeutic regimens for the treatment of metastatic disease.  Prior therapy should have included an anthracycline and a taxane in either the adjuvant or metastatic setting.,Priority,No,No,N/A,Yes,N/A,No,No,NA,2010-03-30,2010-11-15,230,5.438079308923196,Mid-PDUFA
DaTscan,ioflupane I 123,GE Healthcare,NDA,22454,NA,NA,Solution,Intravenous,NA,NA,NA,NA,3/9/2009,1/14/2011,2011,NA,"DaTscan is a radiopharmaceutical indicated for striatal dopamine transporter visualization using single photon emission computed tomography (SPECT) brain imaging to assist in the evaluation of adult patients with suspected Parkinsonian syndromes (PS).  In these patients, DaTscan may be used to help differentiate essential tremor from tremor due to PS (idiopathic Parkinson’s disease, multiple system atrophy and progressive supranuclear palsy). DaTscan is an adjunct to other diagnostic evaluations.",Priority,No,No,N/A,No,N/A,No,No,NA,2009-03-09,2011-01-14,676,6.516193076042964,Mid-PDUFA
Natroba,spinosad,Parapro,NDA,22408,NA,NA,Suspension,Topical,NA,NA,NA,NA,1/22/2009,1/18/2011,2011,NA,"NATROBA (spinosad) Topical Suspension is indicated for the topical treatment of head lice infestation in patients four (4) years of age and older.  
Adjunctive Measures:
NATROBA Topical Suspension should be used in the context of an overall lice management program:  
- Wash (in hot water) or dry-clean all recently worn clothing, hats, used bedding and towels.  
- Wash personal care items such as combs, brushes and hair clips in hot water.  
- A fine-tooth comb or special nit comb may be used to remove dead lice and nits.",Standard,No,No,N/A,No,N/A,No,No,NA,2009-01-22,2011-01-18,726,6.587550014824796,Mid-PDUFA
Viibryd,vilazodone hydrochloride,Trovis Pharmaceuticals,NDA,22567,NA,NA,Tablet,Oral,NA,NA,NA,NA,3/22/2010,1/21/2011,2011,NA,"VIIBRYD is indicated for the treatment of major depressive disorder (MDD). The efficacy of VIIBRYD was established in two 8-week, randomized, double-blind, placebo-controlled trials in adult patients with a diagnosis of MDD. 
Major depressive disorder consists of one or more major depressive episodes. A major depressive episode (DSM-IV-TR) implies a prominent and relatively persistent (nearly every day for at least 2 weeks) depressed or dysphoric mood that usually interferes with daily functioning, and includes at least 5 of the following 9 symptoms: depressed mood, loss of interest in usual activities, significant change in weight and/or appetite, insomnia or hypersomnia, psychomotor agitation or retardation, increased fatigue, feelings of guilt or worthlessness, slowed thinking or impaired concentration, or a suicide attempt or suicidal ideation.",Standard,No,No,N/A,No,N/A,No,No,NA,2010-03-22,2011-01-21,305,5.720311776607412,Mid-PDUFA
Edarbi,azilsartan medoxomil,Takeda Pharmaceuticals,NDA,200796,NA,NA,Tablet,Oral,NA,NA,NA,NA,4/27/2010,2/25/2011,2011,NA,Edarbi is an angiotensin II receptor blocker (ARB) indicated for the treatment of hypertension.  It may be used alone or in combination with other antihypertensive agents.,Standard,No,No,N/A,No,N/A,No,No,NA,2010-04-27,2011-02-25,304,5.717027701406222,Mid-PDUFA
Daliresp,roflumilast,Forest Research Institute,NDA,22522,NA,NA,Tablet,Oral,NA,NA,NA,NA,7/17/2009,2/28/2011,2011,NA,"DALIRESP is indicated as a treatment to reduce the risk of COPD exacerbations in patients with severe COPD associated with chronic bronchitis and a history of exacerbations.  
Limitations of Use: 
DALIRESP is not a bronchodilator and is not indicated for the relief of acute bronchospasm.",Standard,No,No,N/A,No,N/A,No,No,NA,2009-07-17,2011-02-28,591,6.3818160174060985,Mid-PDUFA
Benlysta,belimumab,Human Genome Sciences,BLA,125370,NA,NA,Injectable,Injection,NA,NA,NA,NA,6/9/2010,3/9/2011,2011,NA,"BENLYSTA (belimumab) is indicated for the treatment of adult patients with active, autoantibody-positive, systemic lupus erythematosus (SLE) who are receiving standard therapy.  
Limitations of Use:  
The efficacy of BENLYSTA has not been evaluated in patients with severe active lupus nephritis or severe active central nervous system lupus.  BENLYSTA has not been studied in combination with other biologics or intravenous cyclophosphamide. Use of BENLYSTA is not recommended in these situations.",Priority,No,No,N/A,Yes,N/A,No,No,NA,2010-06-09,2011-03-09,273,5.60947179518496,Mid-PDUFA
Gadavist,gadobutrol,Bayer HealthCare Pharmaceuticals,NDA,201277,NA,NA,Solution,Intravenous,NA,NA,NA,NA,5/14/2010,3/14/2011,2011,NA,Gadavast is a gadolinium-based contrast agent indicated for intravenous use in diagnostic magnetic resonance imaging (MRI) in adults and children (2 years of age and older) to detect and visualize areas with disrupted blood brain barrier (BBB) and/or abnormal vascularity of the central nervous system.,Standard,No,No,N/A,No,N/A,No,No,NA,2010-05-14,2011-03-14,304,5.717027701406222,Mid-PDUFA
Yervoy,ipilimumab,Bristol-Myers Squibb,BLA,125377,NA,NA,Injectable,Injection,NA,NA,NA,NA,6/25/2010,3/25/2011,2011,NA,YERVOY (ipilimumab) is indicated for the treatment of unresectable metastatic melanoma.,Priority,Yes,No,N/A,Yes,N/A,No,No,NA,2010-06-25,2011-03-25,273,5.60947179518496,Mid-PDUFA
Caprelsa,vandetanib,AstraZeneca Pharmaceuticals,NDA,22405,NA,NA,Tablet,Oral,NA,NA,NA,NA,7/7/2010,4/6/2011,2011,NA,"Vandetanib is indicated for the treatment of symptomatic or progressive medullary thyroid cancer in patients with unresectable locally advanced or metastatic disease.  
Use of vandetanib in patients with indolent, asymptomatic or slowly progressing disease should be carefully considered because of the treatment related risks of vandetanib.",Priority,Yes,No,N/A,Yes,N/A,No,No,NA,2010-07-07,2011-04-06,273,5.60947179518496,Mid-PDUFA
Horizant,gabapentin enacarbil,GlaxoSmithKline,NDA,22399,NA,NA,"Tablet, Extended Release",Oral,NA,NA,NA,NA,1/9/2009,4/6/2011,2011,NA,"HORIZANT (gabapentin enacarbil) Extended-Release Tablets are indicated for the treatment of moderate-to-severe primary Restless Legs Syndrome (RLS) in adults.  
HORIZANT is not recommended for patients who are required to sleep during the daytime and remain awake at night.",Standard,No,No,N/A,No,N/A,No,No,NA,2009-01-09,2011-04-06,817,6.705639094860003,Mid-PDUFA
